position,company,location,salary,summary
Machine Learning Data Analyst,Cognizant,"Denver, CO",,"Experience in various statistical and machine learning models, data mining, unstructured data analytics in corporate or academic research environments...."
Data Engineer,Return Path,"Broomfield, CO 80021",,"As a Data Engineer, you will collaborate with fellow engineers, data scientists and data analysts to support their needs and the needs of the business...."
Data Science Researcher,National Renewable Energy Laboratory,"Golden, CO",,"Design, implement, and document data workflows. Integrating multiple data sources, models, and software tools with scientific and engineering workflows for..."
Data Engineer,IMM,"Boulder, CO",,"Data pipeline/workflow management. You will work closely with our solutions architect, data scientists, and analysts to help build out our data aggregation and..."
Engineer I - Data Strategist (662144),Ball Aerospace,"Broomfield, CO",,"Technical data sourcing, management, and analysis. Open source data sourcing, management, and analysis. Our team of more than 3,000 engineers, scientists,..."
Sr. Data Scientist,BP,"Denver, CO",,"The data and analytics organization are teams of highly experienced data scientists, data engineers, data management and quality experts, reporting and..."
Software Development Engineer - Machine Learning,Conga,"Broomfield, CO 80021",,Knowledge of industry standards and trends in big data and machine learning. Bachelor’s Degree in Computer Science or equivalent experience and 3+ years of...
Lead Data Scientist,BP,"Denver, CO",,"The data and analytics organization are teams of highly experienced data scientists, data engineers, data management and quality experts, reporting and..."
"Faculty Positions in Data Science, Machine Learning, and Security",University of Colorado,"Boulder, CO",,"This is an interdisciplinary search in data science, machine learning, and security, conducted by the Departments of Computer Science, Electrical, Computer and..."
Data Scientist Snr Manager,Oracle,"Broomfield, CO",,Data Scientist Snr Manager-1700142B. 3+ years in leadership/management of data science/analytic team. Create processes to calibrate any external data with...
Junior Data Scientist/Software Engineer,CCRi,"Aurora, CO",,"CCRi is looking for smart, innovative data scientists with analytical and software engineering skills. Data Processing and Analytics:...."
Data Engineer I,"UNAVCO, Inc.","Boulder, CO",,"The Data Engineer will also play an active role in the development of new data access and processing tools and interfaces, providing expertise on data and end..."
"Research Analyst - Navigant Research - Energy- Boulder, CO",Navigant,"Boulder, CO",,Regularly uses close visual acuity and operates computer equipment to prepare and analyze and transmit data....
Sr. Data Engineer,"Pandora Media, Inc.","Boulder, CO",,"Experience collaborating with data scientists, exposure to machine learning algorithms and/or statistical modeling methods...."
Principal Engineer - Machine Learning,Medtronic,"Boulder, CO",,ESSENTIAL DUTIES AND RESPONSIBILITIES: The principal development engineer in Technology Explorations role is responsible for the application of technology to...
High Dimensional Data Analysis,University of Colorado,"Boulder, CO",,"The position is in the area of high dimensional data analysis (big data), with possible areas of emphasis including nonlinear optimization, analysis in high..."
Research Associate,University of Colorado,"Boulder, CO",,And the ability to effectively interact with other scientists and students. Applicants must complete the Faculty/University Staff and EEO Data (application)...
Business Intelligence Intern (661821),Ball Aerospace,"Lafayette, CO",,"Collect, integrate, analyze and visualize data using a variety of data analytics and visualization tools. Increasingly businesses understand that one of their..."
"Associate, Data Scientist",KPMG,"Denver, CO 80202 (Lodo area)",,"Retrieve, process and prepare a rich data variety of data sources such as social media, news, internal/external documents, emails, financial data, and..."
Research Analyst,Denver Investments,"Denver, CO",,"Perform data collection, industry research, analysis, and report conclusions to aid in the investment decision-making process...."
Production Control Center Scheduler (662358),Ball Aerospace,"Broomfield, CO",,"Collect and verify production data and calculate statistical data for use in reports. Check and post data to production logs, records, or reports...."
"Associate, Data Scientist",KPMG,"Denver, CO 80202 (Lodo area)",,"Retrieve, process and prepare a rich data variety of data sources such as social media, news, internal/external documents, emails, financial data, and..."
Research Analyst,Denver Investments,"Denver, CO",,"Perform data collection, industry research, analysis, and report conclusions to aid in the investment decision-making process...."
RESEARCH ANALYST,Kroenke Sports & Entertainment,"Denver, CO",,Ability to conduct in-depth data analysis. Ability to work with large data sets. Seeks ways to automate reporting for recurring data analysis....
Principal Data Scientist - Audience Target Team,Oracle,"Broomfield, CO",,Principal Data Scientist - Audience Target Team-170017IX. Acting as a source of knowledge and mentorship for junior data scientists....
Geodesist (Gravity Scientist) ZP-1372-04 (DE/CR),Department of Commerce,"Boulder, CO","$92,969 - $142,821 a year","Geodesist (Gravity Scientist), ZP-1372-04. Collect and process terrestrial and airborne gravity data. Ability to collect high quality terrestrial and airborne..."
Professional Research Asst,University of Colorado,"Boulder, CO",,Experience with modern particle detectors and data analysis techniques. Research Scientist Position on CMS at the University of Colorado Boulder....
Senior Data Scientist,Layer3 TV,"Denver, CO",,Layer3 TV is seeking a data scientist with exceptional technical aptitude and the ability to draw insights from data....
Postdoctoral Researcher – Data Science and Machine Learning,National Renewable Energy Laboratory,"Golden, CO",,"Experience monitoring, mining, synthesizing from and analyzing multiple sources of digital and/or event-based data, such as network traffic and IoT data, is a..."
2018 Unidata Summer Internship,UCAR,"Boulder, CO",,"Work to enhance Unidata scientific data access and distribution software products, e.g., THREDDS Data Server (TDS) and netCDF...."
Principal Data Scientist - Audience Target Team,Oracle,"Broomfield, CO",,Principal Data Scientist - Audience Target Team-170017IX. Acting as a source of knowledge and mentorship for junior data scientists....
2018 Unidata Summer Internship,UCAR,"Boulder, CO",,"Work to enhance Unidata scientific data access and distribution software products, e.g., THREDDS Data Server (TDS) and netCDF...."
Postdoctoral: Vehicle Data Analysis Engineer,National Renewable Energy Laboratory,"Golden, CO",,"Solid engineering and technical capabilities in experimental design, on-board data acquisition, data mining and data analysis. Vehicle Data Analysis:...."
Operations Research Analyst,Department of the Air Force,"Buckley AFB, CO","$72,168 - $155,073 a year","An example of specialized experience includes extracting& organizing raw cost data under general direction from the team leader, conducting basic mathematical..."
Senior Data Scientist,Comcast,"Denver, CO 80202 (Lodo area)",,Who does the Data Scientist work with? 4+ years working within an enterprise data warehouse environment or big data architecture....
Animal Care Tech I,University of Colorado,"Boulder, CO","$28,000 - $29,000 a year",Experience entering and manipulating data in a database. You will also provide routine and specialized care for a variety of species of small laboratory animals...
Research Firmware Engineer,Honeywell,"Broomfield, CO 80021",,"Demonstrated understanding of centralized and distributed data storage, managing data access latency, and databases...."
Computer Scientist (DHA),Department of Commerce,"Boulder, CO","$65,228 - $101,641 a year",Computer Research Scientists. Computer And Information Research Scientists. This vacancy may be used to fill other Computer Scientist positions at the Institute...
Administrative Associate III (662029),Ball Aerospace,"Broomfield, CO",,"Gather and interpret data; Prepare various schedules and perform data entry, etc. Our team of more than 3,000 engineers, scientists, technicians and support..."
Office Assistant,National Ecological Observatory Network Inc,"Boulder, CO",,"A 30+ year project dedicated to understanding how changes in climate, land use and invasive species impact ecology, the observatorys scientists and engineers..."
Environmental Technician/Entry Level Scientist,GHD,"Golden, CO",,"Environmental Technician/Entry Level Scientist - GOL00101. Perform sampling, site inspections and other data collection...."
Measurement Science,"Muse Biotechnology, Inc.","Boulder, CO",,Support process development by interpreting data and providing guidance for process optimization. We are looking for a highly talented Scientist to be a key...
US Head of Data Architecture and Analysis,Janus Henderson,"Denver, CO",,"Data feeds between the central data hub/warehouse and business applications or data marts. Architectural and data schema design in the data hub, warehouses and..."
Habitat Team Spring Intern,Environmental Defense Fund,"Boulder, CO 80302",$14.28 an hour,"Help design, and input data methodically in a Google spreadsheet. Work closely with staff scientists shape the research questions and analysis for this project...."
Cell Biology & Translational Medicine Scientist,Array BioPharma,"Boulder, CO 80301",,"Plans, designs and initiates studies, and analyzes the data. Generates in-vitro data that support investigational new drug filings for product candidates...."
Administrative Associate III-Travel (662165),Ball Aerospace,"Lafayette, CO",,"Accounting skills for reconciliations, accruals and daily data analyses with a strong competence in Microsoft Office, especially Excel...."
Sr. Market Research Analyst,TSYS,"Broomfield, CO",,"Data visualization tools such as Tableau. Works independently to analyze marketing data, interpret it for brand impact and report to management on implications..."
Science Writer/Media Relations Professional,University of Colorado,"Boulder, CO",,"And data visualization. Identify stories of wide public interest for news packaging by meeting with campus scientists to discuss latest research efforts, and..."
Competitive Research Analyst,Layer3 TV,"Denver, CO",,"Strong analytical skills, including ability to analyze large data sets, identify insights, and synthesize how insights impact business decisions...."
Administrative Associate II (661909) - Current security clearance required,Ball Aerospace,"Broomfield, CO",,"Gather and interpret data; Prepare various schedules and perform data entry, etc. Our team of more than 3,000 engineers, scientists, technicians and support..."
Sr. Research Associate/Research Scientist/Scientist I - Bioinformatics,"Somalogic, Inc.","Boulder, CO 80301",,Experience analyzing “wide” data sets (more covariates than observations). Experience working with large data sets in a Health Science or Clinical field....
"Food Scientist, Product Development Innovation",Dean Foods,"Broomfield, CO 80021",,Tactical decision-making ability using sound scientific principles and data analytics. Job Description & Requirements....
Material Control Analyst I (662024),Ball Aerospace,"Boulder, CO",,"Our team of more than 3,000 engineers, scientists, technicians and support staff drives all the achievements at Ball Aerospace...."
Technical Systems Manager --Research & Innovation,DANONE,"Louisville, CO",,"Aptitude for training and collaborating with a wide variety of personalities including scientists, engineers, and business partners...."
Knowledge Management Analyst,National Ecological Observatory Network Inc,"Boulder, CO",,"A 30+ year project dedicated to understanding how changes in climate, land use and invasive species impact ecology, the observatorys scientists and engineers..."
Data Scientist,BAE Systems,"Buckley AFB, CO 80011 (Norfolk Glen area)",,"As a Data Scientist, you will leverage knowledge of data science, methodologies, and processing techniques to perform predictive analytics in the geospatial..."
Scientist I/II - Bioinformatics 2017-166,"SomaLogic, Inc.","Boulder, CO 80301",,Experience analyzing “wide” data sets (more covariates than observations). Experience working with large data sets in a Health Science or Clinical field....
Scientist I/II - Bioinformatics,"Somalogic, Inc.","Boulder, CO 80301",,Experience analyzing “wide” data sets (more covariates than observations). Experience working with large data sets in a Health Science or Clinical field....
Security Data Science Director,Great-West,"Denver, CO",,Experience managing Data Scientists. Great-West Financial is looking for a high-energy Director of Data Science to help build out a centralized security...
RESEARCH SCIENTIST - OUTER SOLAR SYSTEM,Southwest Research Institute,"Boulder, CO",,"Experience is data analysis of spacecraft data, IDL and other scientific coding languages, ice science (laboratory, in situ or remote), peer-reviewed journal..."
Analyst II-Project Controls (661697),Ball Aerospace,"Boulder, CO",,Compile and analyze Sales Forecast data and cost estimating data. Organize cost and/or schedule data for monthly/quarterly program reviews....
Associate Mission Systems Analyst (661328),Ball Aerospace,"Westminster, CO",,"Participate in test data collection and evaluation. Our team of more than 3,000 engineers, scientists, technicians and support staff drives all the achievements..."
Sr. Office Assistant,National Ecological Observatory Network Inc,"Boulder, CO",,"Gather and research data to create reports as needed for designated teams. A 30+ year project dedicated to understanding how changes in climate, land use and..."
Research Scientist,CACI,"Aurora, CO 80010 (Delmar Parkway area)",,"Possess excellent data gathering, analytical, and problem solving skills. BIT Systems Inc...."
Data Scientist IV,DCP Midstream,"Denver, CO",,"Understands data elements, data models and working with structured or unstructured data sets. Strong background in advanced statistical and data science..."
PostDoctoral Associate,University of Colorado,"Boulder, CO",,"Applicants must complete the Faculty/University Staff and EEO Data (application) form, and upload the following required documents:...."
Research Associate - Bioinformatics,National Jewish Health,"Denver, CO 80206 (Central East Denver area)",,Prepares data for utilization by other scientists. Analysis of allele-specific expression data. Writes advanced scripts to access databases and analyze data....
Bioinformatics Analyst Trainee,National Jewish Health,"Denver, CO 80206 (Central East Denver area)",,Writes custom web tools for scientists. Writes custom scripts to access databases and analyze data. Bachelors-level training in high-throughput data analysis...
Data Reporting Analyst Associate - Research Informatics Analyst,Children's Hospital Colorado,"Aurora, CO",,"Gathers functional and technical requirements to design, build, test, deliver and manage data repositories, reporting, ETL, data warehouse, registry or data..."
Business Intelligence Data Scientist,Chipotle Mexican Grill,"Denver, CO 80202 (Lodo area)",,Business Intelligence Data Scientist (17030694) Description Position Summary:. The Data Scientist will drive internal data analytics projects serving all areas...
Bioinformatics Analyst I,National Jewish Health,"Denver, CO 80206 (Central East Denver area)",,Writes custom web tools for scientists. Complete tasks in a Linux environment including primary analysis of sequence data (read mapping and gene expression...
Engineer I-Mission Systems Analyst (662223),Ball Aerospace,"Boulder, CO",,"Our team of more than 3,000 engineers, scientists, technicians and support staff drives all the achievements at Ball Aerospace...."
Business Analyst,NBI Resources,"Aurora, CO",,Our core team of Computer scientists and Data Engineers have a passion for building tools that solve our clients most challenging and complex technical problems...
"Intern, Marketing Operations & Data Analysis",Ping Identity,"Denver, CO 80202 (Lodo area)",,"At Ping Identity, we're changing the way people think about enterprise security technology. With our innovative Identity Defined Security platform, we're..."
"Sr Staff Scientist, R&D",DigitalGlobe,"Westminster, CO",,Experience with 3D and elevation data. Please review the job details below....
Associate Range Engineer (662328),Ball Aerospace,"Westminster, CO",,"Our team of more than 3,000 engineers, scientists, technicians and support staff drives all the achievements at Ball Aerospace...."
Associate Industrial Engineer (661975),Ball Aerospace,"Westminster, CO",,"Identify and implement ways to automate data collection and analysis. Our team of more than 3,000 engineers, scientists, technicians and support staff drives..."
Associate Structural Engineer (661396),Ball Aerospace,"Westminster, CO",,"Our team of more than 3,000 engineers, scientists, technicians and support staff drives all the achievements at Ball Aerospace...."
Embedded Software Engineer I (662365),Ball Aerospace,"Boulder, CO",,"Our team of more than 3,000 engineers, scientists, technicians and support staff drives all the achievements at Ball Aerospace...."
Malware Threat Research Analyst,Webroot,"Broomfield, CO",,You are an information security/malware professional looking to contribute to an innovative and collaborative environment. You have a passion for the thrill...
Sr. Office Assistant,National Ecological Observatory Network Inc,"Boulder, CO",,"Gather and research data to create reports as needed for designated teams. A 30+ year project dedicated to understanding how changes in climate, land use and..."
PostDoctoral Associate,University of Colorado,"Boulder, CO",,"Applicants must complete the Faculty/University Staff and EEO Data (application) form, and upload the following required documents:...."
Administrative Associate III-Travel (662165),Ball Aerospace,"Lafayette, CO",,"Accounting skills for reconciliations, accruals and daily data analyses with a strong competence in Microsoft Office, especially Excel...."
Administrative Associate III (662029),Ball Aerospace,"Broomfield, CO",,"Gather and interpret data; Prepare various schedules and perform data entry, etc. Our team of more than 3,000 engineers, scientists, technicians and support..."
"Food Scientist, Product Development Innovation",Dean Foods,"Broomfield, CO 80021",,Tactical decision-making ability using sound scientific principles and data analytics. Job Description & Requirements....
Technical Systems Manager --Research & Innovation,DANONE,"Louisville, CO",,"Aptitude for training and collaborating with a wide variety of personalities including scientists, engineers, and business partners...."
Prospect Research and Data Analyst,Nurse Family Partnership,"Denver, CO 80203 (Capitol Hill area)",,"This position will ensure that frontline fundraisers on our regional, institutional, and individual giving teams have the data and information that they need to..."
Engineer I-Mission Systems Analyst (662223),Ball Aerospace,"Boulder, CO",,"Our team of more than 3,000 engineers, scientists, technicians and support staff drives all the achievements at Ball Aerospace...."
Embedded Software Engineer I (662365),Ball Aerospace,"Boulder, CO",,"Our team of more than 3,000 engineers, scientists, technicians and support staff drives all the achievements at Ball Aerospace...."
Postdoctoral Fellow,University of Colorado,"Aurora, CO",,"Lead and organize data acquisition and analysis. The Proenza lab in the Department of Physiology and Biophysics and the Department of Medicine, Division of..."
In Process Quality Inspector (660994),Ball Aerospace,"Westminster, CO",,"Familiarity with basic computer usage for data entry and required employee interaction (i.e. Our team of more than 3,000 engineers, scientists, technicians and..."
Artificial Intelligence Software Engineer,KPMG,"Denver, CO 80202 (Lodo area)",,"Design, develop and maintain artificial intelligence-enabled managed services (APIs) with a team of Data Scientist, Software Engineers and Project Managers...."
Sr Deep Learning Software Engineer,NVIDIA,"Boulder, CO 80302",,"Artificial intelligence, the dream of computer scientists for over half a century, is no longer science fiction...."
Machinist Prototype-Wire EDM (662155) - 2nd Shift,Ball Aerospace,"Boulder, CO",,"Our team of more than 3,000 engineers, scientists, technicians and support staff drives all the achievements at Ball Aerospace...."
Machinist Prototype-CNC 2nd Shift (661604),Ball Aerospace,"Boulder, CO",,"Our team of more than 3,000 engineers, scientists, technicians and support staff drives all the achievements at Ball Aerospace...."
Material Planner (661698),Ball Aerospace,"Westminster, CO",,"Our team of more than 3,000 engineers, scientists, technicians and support staff drives all the achievements at Ball Aerospace...."
QC Inspector III - CMM & Procured Inspection (661026),Ball Aerospace,"Boulder, CO",,"Our team of more than 3,000 engineers, scientists, technicians and support staff drives all the achievements at Ball Aerospace...."
Machinist I (660885),Ball Aerospace,"Boulder, CO",,"Our team of more than 3,000 engineers, scientists, technicians and support staff drives all the achievements at Ball Aerospace...."
CdTe Thin-Film Materials Processing Technician,National Renewable Energy Laboratory,"Golden, CO",,Performing work reproducibly with high degree of quality and reliability Recording data in computer databases ....
Data Analytics Manager,Telligen,"Greenwood Village, CO 80111",,"Data Analytics Manager. Ensures customer satisfaction through the technical development, testing, and documentation of the data analysis solutions...."
In Process Quality Inspector (660994),Ball Aerospace,"Westminster, CO",,"Familiarity with basic computer usage for data entry and required employee interaction (i.e. Our team of more than 3,000 engineers, scientists, technicians and..."
Quantitative Analyst - IHS Command Center,DISH Network,"Littleton, CO",,"Collect, report on, model, analyze, and present large amounts of data with meticulous attention to detail. Conduct long-term and short-term data analysis with a..."
"Administrative Intern-Environmental, Health & Safety (661485)",Ball Aerospace,"Boulder, CO",,"Provide health & safety-related statistical data to BATC employees, including management personnel, as required...."
Material Planner (661698),Ball Aerospace,"Westminster, CO",,"Our team of more than 3,000 engineers, scientists, technicians and support staff drives all the achievements at Ball Aerospace...."
K-12 Research Analyst II,National Conference of State Legislatures,"Denver, CO 80230 (Central East Denver area)","$3,486 a month","Collects and monitors data on legislative actions, state and federal programs, using library resources, available databases, and public and private..."
Associate Optical Engineer - Spatial Metrology (662163),Ball Aerospace,"Boulder, CO",,"Experience with basic data analysis. Work with teams of engineers performing optical system development, integration, alignment, and data analysis...."
PRA - QC Analyst,University of Colorado,"Aurora, CO",,"As needed, assist development scientists and operations with technical/operational support. Excellent communication skills in both written as well as..."
Production Control Expeditor (661737),Ball Aerospace,"Boulder, CO",,"Collect and verify production data for use in reports. Check and post data to production logs, records, or reports...."
Technical Writer Intern (661823),Ball Aerospace,"Boulder, CO",,"Our team of more than 3,000 engineers, scientists, technicians and support staff drives all the achievements at Ball Aerospace...."
Sr. Project Controls Analyst - Scheduling (662169),Ball Aerospace,"Boulder, CO",,"Recommend and maintain any additional historical data bases pertinent to assigned business unit. Our team of more than 3,000 engineers, scientists, technicians..."
Advanced Systems Manager Senior-Special Programs (661830),Ball Aerospace,"Broomfield, CO",,"Our team of more than 3,000 engineers, scientists, technicians and support staff drives all the achievements at Ball Aerospace...."
Senior Analytics Engineer - Oracle Public Cloud,Oracle,"Broomfield, CO",,"We are seeking seasoned engineers or data scientists with:. Big data processing (Spark, etc.). Data acquisition (streaming and batch) and aggregation...."
PRA - QC Analyst,University of Colorado,"Aurora, CO",,"As needed, assist development scientists and operations with technical/operational support. Excellent communication skills in both written as well as..."
Planner-Supply Chain Management (660236),Ball Aerospace,"Boulder, CO",,"Our team of more than 3,000 engineers, scientists, technicians and support staff drives all the achievements at Ball Aerospace...."
RF Technician I (662236),Ball Aerospace,"Westminster, CO",,"Our team of more than 3,000 engineers, scientists, technicians and support staff drives all the achievements at Ball Aerospace...."
Engineer Associate - Systems Test (662266),Ball Aerospace,"Boulder, CO",,"Our team of more than 3,000 engineers, scientists, technicians and support staff drives all the achievements at Ball Aerospace...."
Engineer Associate-Space Systems (661828),Ball Aerospace,"Boulder, CO",,"Our team of more than 3,000 engineers, scientists, technicians and support staff drives all the achievements at Ball Aerospace...."
