position,company,location,salary,summary
Senior Machine Learning Scientist New York | San Francisco,Foursquare,"New York, NY",,Ability to collaborate with a diverse set of engineers and data scientists. You will be responsible for everything from data exploration and initial prototyping...
External Data Specifications Manager (eDSM),Bristol-Myers Squibb,"Hopewell, NJ",,"Reviews transferred data for quality and validity. Proactively resolves data, vendor and investigative site issues...."
External Protocol Data Manager (ePDM),Bristol-Myers Squibb,"Hopewell, NJ",,"Reviews transferred data for quality and validity. Proactively resolves data, vendor and investigative site issues...."
Data Scientist II,GILT,"New York, NY 10011 (Chelsea area)",,"The Data team is composed of data engineers and data scientists, and sits within the HBC Tech organization...."
Visiting Scientist (AI),Facebook,"New York, NY",,"Facebook is seeking Visiting Scientists to join our Facebook Artificial Intelligence Research team. And publications in Machine Learning, AI, computer science,..."
Software Engineer - Machine Learning / Data Science,eBay Inc.,"New York, NY 10011 (Chelsea area)",,Be able to extract patterns from large sets of data in order to deliver business insights from data Basic Qualifications:....
ASSOCIATE STATISTICIAN [Temporary],United Nations,"New York, NY",,"Ability to identify, extract, analyze and disseminate statistical data. Assists in training and technical support on data collection programmes, country..."
"Scientist II, Biologics DPD",Celgene Corporation,"Summit, NJ 07901",,Experience in multiple approaches for experimental design and statistical data analysis including Design of Experiments (DoE) and multivariate analysis modeling...
"Scientist II, Biologics Drug Product Dev",Celgene Corporation,"Summit, NJ 07901",,The Scientist II will work within the Biologics Development & Manufacturing organization as a lead scientist for Drug Product development (formulation and...
Environmental Scientist,Vertex,"Branchburg, NJ",,"Environmental Scientist, Remediation. Analyze laboratory and engineering data. VERTEX is regarded as one of the premier engineering, construction, environmental..."
Data Scientist,eBay Inc.,"New York, NY 10011 (Chelsea area)",,"Help eBay take data to the next level. Hadoop, Hive, Pig, Spark, H2O, etc. -A data miner. Be able to extract patterns from large sets of data in order to..."
Wireless Networking Researcher,Vencore,"Basking Ridge, NJ",,"Experience with statistical data analysis. From smart grid to smart phones, intelligent highways to intelligent battlefields, Vencore Labs’ 200 scientists,..."
Faculty - Open Rank (Tenured and Tenure-Track),Columbia University,"New York, NY",,"The Zuckerman Institute brings together scientists from diverse backgrounds whose research focuses on brain function, wiring, and development...."
Analysis and Big Data Innovation Delivery Associate,JP Morgan Chase,"New York, NY 10001 (Chelsea area)",,The role requires excellent strategic thinking to define the data and analytics roadmaps that drive business value and then the ability to drive execution of...
Faculty - All Ranks (Tenured and Tenure-Track),Columbia University,"New York, NY",,"The Zuckerman Institute brings together scientists from diverse backgrounds whose research focuses on brain function, wiring, and development...."
Environmental Scientist – Data Analyst,Louis Berger,"Morristown, NJ",,"Rapid and precise data management skills using databases in MS Excel and/or MS Access® is required. Position is focused on geochemical, geostatistical and..."
"Director, Data Analytics and Robotics Auditing",S&P Global,"New York, NY",,Data Scientist Profile and Experience. The Audit Director - Data Analytics is responsible for leading the Data Analytics team....
Junior UX/UI Designer - Coop/Intern,L'Oreal USA,"Clark, NJ 07066",,"The person will be expected to work alongside senior designers, engineers, data scientists, and project managers...."
"Scientist III, Quality Control",Amneal Pharmaceuticals,"Piscataway, NJ",,"Must be able to identify trends in analytical data. Assist other scientists with analytical, instrument and software related problems as required...."
"Risk Management Associate, Statistical Analysis",Prudential,"Newark, NJ 07102 (Central Business District area)",,"Provides assistance to businesses corporate functions in analyzing complex risk data and ensuring that risks are properly identified, assessed, monitored,..."
Curator of Education,Wildlife Conservation Society,"New York, NY",,"We offer the opportunity for professional growth through staff development events, WCS scientist talks, workshops, or conferences...."
Associate Research Scientist,NYU Langone Health,"New York, NY",,May develop protocol for the collection and quality of research data. We have an exciting opportunity to join our team as an Associate Research Scientist....
Global Head Cardio-Vascular & Metabolism,Sanofi US,"Bridgewater, NJ",,Facilitate (in managing the group) integrated expert medical input in Cardio-Vascular & Metabolism studies to the operational aspects of clinical studies...
Software Engineer,Banc3 Inc.,"Princeton, NJ",,"Experience with Linux O/S (Fedora) developing data processing, high-speed data transfer using TCP/IP and UDP, and automated test procedure development...."
Equity Research Analyst – Small Cap Consumer Sectors,Franklin Templeton Investments,"Short Hills, NJ",,Compile data from multiple sources and develop detailed financial models on covered companies. Equity Research Analyst – Small Cap Consumer Sectors-819163....
R&D Compliance specialist,Chenoa Information Services,"Bridgewater, NJ 08807",,Review analytical data according to cGMP and within the timeframes defined. Ability to work on complex issues where analysis of situations or data requires an...
Scientific Director of Statistical Modeling and Methodology,Johnson & Johnson Family of Companies,"Raritan, NJ",,Serving in internal Independent Data Monitoring Committees for trials involving innovative approaches requiring unblinded interim analyses;...
"Associate Principal Scientist, Pharmacokinetics (Animal Health)",Merck,"Madison, NJ",,Ensure correct scientific analysis of data and validity of study and expert reports within the area of responsibility (environmental risk assessment)....
Implementation and Improvement Research Associate,DEPT OF HEALTH/MENTAL HYGIENE,"New York, NY","$70,286 - $88,213 a year","Two years as a City Research Scientist Level I can be substituted for the experience required in ""1"" and ""2"" above...."
Revenue Management Analyst - Proc Improvement,NYU Langone Health,"New York, NY",,Maintains data integrity when manipulating data files for purposes of analysis. Extracts and complies data from various system sources to develop sound analyses...
Environmental Scientist,Vertex,"Branchburg, NJ",,"Environmental Scientist, Remediation. Analyze laboratory and engineering data. VERTEX is regarded as one of the premier engineering, construction, environmental..."
Technical Project Lead -L'Oreal Technology Incubator,L'Oreal USA,"Clark, NJ 07066",,"Started in 2012, L’Oréal’s Technology Incubator is a global team that includes physicists, engineers, UX and hardware designers, and data scientists...."
Innovation & Technology Senior Data Scientist,PwC,"New York, NY 10002 (Lower East Side area)",,"Proven ability in data analytics management. 5 in data analytics, development and programming. The team helps develop cutting edge data analytic and automation..."
Director of Data Analytics and Reporting,DEPT OF DESIGN & CONSTRUCTION,"New York, NY","$60,435 - $161,497 a year",Ensuring effective data flow to external dashboards such as the Capital Projects Dashboard and Open Data portal;...
Teaching Assistant,Instructional Associate and Teaching Assistant Rol...,"New York, NY",,"You are eager to shape the skills, minds, and careers of the newest generation of web developers, designers and data scientists...."
"Director, Consumption Insights & Analytics","Starz Entertainment, LLC","New York, NY",,Understanding of statistical modeling methodologies and experience working with data scientists preferred. Deep understanding of Nielsen and Comscore data sets...
IT Intern - Emerging Technology,Lazard Ltd.,"New York, NY",,"The Emerging Technology Intern will to work closely with technologists, data scientists, and analysts across the Firm...."
"Sr. Applied Data Scientist, Machine Learning, Deep Learning and NLP",Wolters Kluwer,"Princeton, NJ",,3+ years work experience in data sciences. Applied Data Scientist who is passionate about technology and solving real world problems to build models and...
Senior Statistical Analyst,Scholastic,"New York, NY",,"This person will work collaboratively with analytics, data engineering and Scholastic’s businesses to support reporting, campaign selection, and strategic..."
Data Science - Senior Consultant,Capgemini,"Jersey City, NJ",,"3-5 years professional work experience as a data scientist or on advanced analytics / statistics projects. Our team has worked with geospatial data, on social..."
Senior Research Scientist,Columbia University,"New York, NY",,"Familiarity with photonics is necessary, along with experience in electrical engineering and data communication systems...."
MQA – Algorithmic Rates Quantitative Analyst - VP,Citi,"New York, NY",,"Primary Location: United States,New York,New York Education: Master's Degree Job Function: Trading Schedule: Full-time Shift: Day Job Employee Status: Regular..."
Data Scientist - Human Services,Mathematica Policy Research,"Princeton, NJ 08540",,"Mathematica seeks a data scientist with experience in the design, development and implementation of applied data science and advanced analytics efforts for data..."
Senior Data Strategy Analyst,"Neustar, Inc.","New York, NY 10012 (Little Italy area)",,"Manage data collection from clients, data review and quality checks of incoming data to ensure high quality data is used in database processing...."
Senior Chemist - Polymer Science / Global Materials,Sun Chemical Corporation,"Carlstadt, NJ 07072",,Summarizes data in reports and/or presentations at regular intervals. Develop a strong working relationship in which he/she learns from experienced scientists...
Student Intern,NYU Langone Health,"New York, NY",,Maintain data integrity when manipulating data files for purposes of analysis to ensure data does not become corrupted through conscientious use of tools and a...
Color Scientist,Sun Chemical Corporation,"Carlstadt, NJ 07072",,"Senior Color Scientist. Perform statistical data analysis on color measurements and material properties, assist with gage R&R studies of optical properties of..."
Chemist - Polymer Science / Global Materials,Sun Chemical Corporation,"Carlstadt, NJ 07072",,Development Team Scientist. Summarizes data in reports and/or presentations at regular intervals. Develop a strong working relationship in which he/she learns...
Technology Risk Measurement- Data Scientist- Jr. level - NY,RPC Solutions,"New York, NY",,"Data Scientist – Jr Level. 1-4 years experience in data analytics, data science, data structure, and statistics...."
"Summer Research Assistant/Associate, Neuroscience",Simons Foundation,"New York, NY 10010 (Gramercy area)",,The primary mission of the Center for Computational Biology is to create new computational frameworks that will enable scientists to analyze the large and...
"Summer Research Assistant/Associate, Biophysical Modeling",Simons Foundation,"New York, NY 10010 (Gramercy area)",,The primary mission of the Center for Computational Biology is to create new computational frameworks that will enable scientists to analyze the large and...
Sales Intern NY - Summer 2018,BuzzFeed,"New York, NY",,"We have offices in 19 cities around the world and more than 1500 employees including reporters, video producers, data scientists, engineers, brand strategists,..."
Software Engineer,Persado,"New York, NY 10010 (Gramercy area)",,Imagine having a copywriter and data scientist for each person in your audience; Experience with relational data modeling. Who We Are:....
Software Engineer,PDT Partners,"New York, NY",,"Manage the codebase that runs order routing and execution, exchange connectivity, and market data. Designing and engineering our next generation platform for..."
Securitization Quantitative analyst,CA CIB Americas,"New York, NY",,"Run statistical analysis on performance data ; Crédit Agricole CIB est la banque de financement et d'investissement du Groupe Crédit Agricole, 13e groupe..."
Securitization Quantitative analyst,Crédit Agricole CIB,"New York, NY",,Type de métier Financement et Investissement Type de contrat VIE Durée (en mois) 18 Date prévue de prise de fonction 08/01/2018 Missions Your duties are...
Senior Data Engineer/Sales & Marketing Analytics,Sanofi US,"Bridgewater, NJ",,"Help data scientists optimize queries. The Senior Data Engineer will be part our global analytics team, providing data in a ready-to-use form to data scientists..."
Team Lead Data Scientist - Predictive Analytics,Grubhub,"New York, NY",,"Explore diverse data sets of large volumes to develop models which help drive complex, real time data driven products with real world impact...."
Research Assistant,Memorial Sloan Kettering,"New York, NY",,Carry out data analysis and interpret experimental results including quality controls and performance metrics....
Senior Data Strategy Analyst,"Neustar, Inc.","New York, NY 10012 (Little Italy area)",,"Manage data collection from clients, data review and quality checks of incoming data to ensure high quality data is used in database processing...."
Research Specialist I/II,Princeton University,"Princeton, NJ",,"Laboratory research experience and familiarity with microscopy, basic molecular biology procedures and data analysis...."
Senior Chemist - Polymer Science / Global Materials,Sun Chemical Corporation,"Carlstadt, NJ 07072",,Summarizes data in reports and/or presentations at regular intervals. Develop a strong working relationship in which he/she learns from experienced scientists...
Research Technician I,Weill Cornell Medicine,"New York, NY",,"Analyzes data using computer software and reports results to the principle investigator(s). Under supervision, assists scientists with laboratory and..."
Color Scientist,Sun Chemical Corporation,"Carlstadt, NJ 07072",,"Senior Color Scientist. Perform statistical data analysis on color measurements and material properties, assist with gage R&R studies of optical properties of..."
"Scientist, Clinical Research - NJ",Advent Global Solutions,"Summit, NJ 07901",,"Review of clinical data within eCRF system, patient profiles, etc. to issue queries and clean data from clinical perspective...."
"Clinical Research Scientist, Multiple Myeloma",Celgene Corporation,"Summit, NJ 07901",,"Clinical review of study data (conduct clinical data review, communicate as necessary to resolve data queries, draft/update/review data review plans, support..."
Scientist Clinical Research,Katalyst Healthcares & Life Sciences,"Summit, NJ 07901",,The individual will be responsible for hand-on management and tracking of all aspects of the IITs/COOPs/3rd Party trials and maintaining study data within the...
Chemist - Polymer Science / Global Materials,Sun Chemical Corporation,"Carlstadt, NJ 07072",,Development Team Scientist. Summarizes data in reports and/or presentations at regular intervals. Develop a strong working relationship in which he/she learns...
Financial Research Analyst & Reporting,Columbia University,"New York, NY",,"Reporting to the Manager of Research Finance, the post-award Financial Research Analyst & Reporting is responsible for assisting with the post award financial..."
Software Engineer I,Memorial Sloan Kettering,"New York, NY","Estimated salary: $106,000 - $135,000 a year",Process and analyze data from multi-modalities medical imaging and high-throughput next-generation sequencing with an emphasis in pathology;...
Equity Research Analyst - Long Only - Health Care Sector,Voya Financial,"New York, NY",,"Thoughtful process of analyzing data and problem solving data to reach a well-reasoned solution. As part of the application process, a candidate account is..."
HR Analyst - Short Term,Natural Resources Defense Council,"New York, NY 10011 (Chelsea area)",,"Create and run audit reports to ensure data integrity. Experience using quantitative and qualitative analytical strategies, working with multiple data sources..."
"Senior Scientist, Machine Learning and Virtual Screening",Schrodinger,"New York, NY",,"Senior Scientist, Machine Learning and Virtual Screening. The ideal candidate is a scientist experienced in the application, development, and refinement of..."
Associate Epidemiologist,Bayer,"Whippany, NJ",,"Within a team of scientists. Assess external data sources (health care databases,. Your tasks and responsibilities...."
Computer Scientist,SRI International,"Princeton, NJ",,"Develop algorithms, software, and applications in areas such as Visual Security and Surveillance, Autonomous Robotics, and Video Data Mining...."
Lead Product Analyst,Xaxis,"New York, NY",,"Working alongside data scientists, engineers, product managers, and traders you will build quantitative expertise around digital media trading...."
Sales Intern NY - Summer 2018,BuzzFeed,"New York, NY",,"We have offices in 19 cities around the world and more than 1500 employees including reporters, video producers, data scientists, engineers, brand strategists,..."
Associate Actuary,Oscar Insurance,"New York, NY 10012 (Little Italy area)",,"In this role, you will join our Risk team and work directly with Actuaries and Data Scientists. You have experience working with large databases and analyzing..."
Client Services Intern NYC - Summer 2018,BuzzFeed,"New York, NY",,"We have offices in 19 cities around the world and more than 1500 employees including reporters, video producers, data scientists, engineers, brand strategists,..."
Research Support Specialist,The Rockefeller University,"New York, NY",,The Research Support Specialist is ideal for a scientist with hands-on LC-MS/MS experience who has or wishes to gain additional proteomics and small molecule...
Software Defined Radio Developer (GNU),Vencore,"Red Bank, NJ",,"From smart grid to smart phones, intelligent highways to intelligent battlefields, Vencore Labs’ 200 scientists, engineers and analysts are consistently..."
Data Scientist- Yield Management,DISH Network,"New York, NY",,"A successful data scientist will have the following:. Suggest and implement improved data management, data mining and technology enhancements to support scaling..."
Software Engineer,Bluecore,"New York, NY 10002 (Lower East Side area)",,"Work cross-functionally with product managers, data scientists, and engineers to create cohesive products. Our customers include some of the largest digital..."
Software Engineer,Twitter,"New York, NY",,"Cortex is a team of software engineers, data scientists, and research scientists dedicated to developing state-of-the-art machine learning capabilities to..."
Technical Service Scientist,Ashland,"Bridgewater, NJ 08807",,"Ashland is seeking a Technical Service scientist to join our Bridgewater team. Position will be responsible for the compilation, interpretation and presentation..."
Data Manager - Sr. Associate,Pfizer Inc.,"Peapack, NJ",,Serve as Data Manager for one or more clinical trials assuming responsibility for DMM activities including selection and application of data acquisition...
Director of Credit Risk and Data Analytics,Strategic Financial Solutions,"New York, NY 10018 (Clinton area)",,"Creativity to challenge the status quo and create better solutions to the problem, ability to work independently as data scientist, but in the meantime,..."
Adjunct Associate Faculty – Machine Learning,Columbia University School of Professional Studies,"New York, NY",,"Columbia University, School of Professional Studies (SPS) seeks candidates to serve as a part-time Associate to assist with course facilitation and..."
Executive Assistant to the SVP,NYU Langone Health,"New York, NY",,"Compiles, categorizes, calculates, audits, verifies, or processes information or data. Responds to requests for information, summarizes and data based on..."
UNDERGRADUATE OR GRADUATE RESEARCH ASSISTANT,Research Foundation of The City University of New...,"New York, NY",,Post processing is achieved with analytical code developed to aggregate and slice the data to answer specific research questions....
Actuary,Oscar Insurance,"New York, NY 10012 (Little Italy area)",,"In this role, you will join our Risk team and work directly with Actuaries and Data Scientists. You will own pieces of our actuarial work that enables our..."
Director of Data Management and Analytics,Providge Consulting,"New York, NY",,"Director of Data Management and Analytics. Knowledge of the Python scientific and data libraries, particularly Pandas;..."
Principal Scientist,TRIS PHARMA INC,"Monmouth Junction, NJ 08852",,"Hands-on experience supervising, leading and training scientist and other laboratory personnel required. We have a unique opportunity for Principal Scientist in..."
Planning Associate,Mindshare,"New York, NY 10018 (Clinton area)",,"Media Planners at Mindshare are part psychologists, part scientists, part artists, part entrepreneurs, and part politicians...."
"Principal Scientist, Product Development Analytical",Bayer,"Morristown, NJ 07960",,"Scientist, Product Development Analytical,. LLC seeks a Principal Scientist,. Strong knowledge in analytical data analysis. Your tasks and responsibilities...."
Market Research Analyst - Analyst Development Program,Ipsos North America,"Parsippany, NJ",,"Love data, consumer decision-making, and puzzles. Would you like to work with a team of passionate problem-solvers dedicated to bringing research insights and..."
Product Manager - Data & Analytics,Elsevier,"New York, NY 10010 (Gramercy area)",,"Usage growth of structured data in charts/tables/databases. Strong MS Excel or other data analysis tools (e.g., R) skills is an advantage...."
Senior PV Scientist,Bristol-Myers Squibb,"Princeton, NJ 08540",,"Ability to understand complex medical-scientific data from a broad range of disciplines (eg, clinical trial laboratory data, nonclinical data, postmarketing..."
Innovation & Technology Senior Data Scientist,PwC,"New York, NY 10002 (Lower East Side area)",,"Proven ability in data analytics management. 5 in data analytics, development and programming. The team helps develop cutting edge data analytic and automation..."
Environmental Engineer / Scientist,AEI Consultants,"Freehold, NJ 07728",,Environmental Engineer / Scientist – Site Mitigation. Experience evaluating data and preparing technical reports based on the results of field sampling...
Statistical/ Database Marketing Analyst,FULLBEAUTY Brands,"New York, NY",,"MA/MS degree in Statistics, Data Science or related analytical field of study. Capability to execute the complete modeling process from data extraction..."
Computational Biologist I,Memorial Sloan Kettering,"New York, NY",,"Analyze data sets to discover and annotate cancer-causing genetic mutations in body fluids. Fluency with UNIX, next generation (Next-gen) sequencing data..."
Bioinformatics Scientist,CooperSurgical,"Livingston, NJ",,"Computes infrastructure for processing NGS data (local vs. Amazon cloud, etc.). Provide support and collaborate with our research scientists to develop new and..."
Computational Biologist I,Memorial Sloan Kettering,"New York, NY",,"Analyze data sets to discover and annotate cancer-causing genetic mutations in body fluids. Fluency with UNIX, next generation (Next-gen) sequencing data..."
"HBO Manager, Applied Analytics",HBO,"New York, NY",,Lead a team of talented data and applied scientist in the design and execution of complex data and analytic projects that influence key business decisions in...
MQA – Cross Asset Quantitative Analyst - VP,Citi,"New York, NY",,"Partnering with senior technology professionals to source internally generated data. United States,New York,New York...."
"Research Analyst, CSC",Vera Institute of Justice,"New York, NY 10279 (Financial District area)",,Creating data visualizations; Cleaning and preparing data for analysis; Assisting in the design and deployment of data collection instruments and surveys;...
Markets – Credit Quantitative Analyst – Assoc/VP,Citi,"New York, NY",,"Perform data analysis and draw good conclusions from the results. United States,New York,New York...."
Principal Data Scientist - Predictive and Prescriptive Analytics,Verizon,"Basking Ridge, NJ 07920",,"You will be a hands-on data scientist responsible for the entire end to end process of model development, implementation, and maintenance of business-changing..."
Principal Data Scientist - Healthcare - 35483BR,Aetna,"New York, NY 10016 (Gramercy area)",,We are currently looking for an exceptional Principal Data Scientist - Healthcare to play a pivotal role in the creation and deployment of information products....
Senior PV Scientist,Bristol-Myers Squibb,"Princeton, NJ 08540",,"Ability to understand complex medical-scientific data from a broad range of disciplines (eg, clinical trial laboratory data, nonclinical data, postmarketing..."
Customer Success Associate,Custoria,"New York, NY",,"You will work with an awesome close-knit team of engineers, designers, consultants, product managers, marketers, and data scientists...."
Principal Scientist,TRIS PHARMA INC,"Monmouth Junction, NJ 08852",,"Hands-on experience supervising, leading and training scientist and other laboratory personnel required. We have a unique opportunity for Principal Scientist in..."
