position,company,location,salary,summary
Sr. Database Marketing Analyst,FULLBEAUTY Brands,"New York, NY",,Manage and mentor a data analyst in the team. Capability to execute the complete modeling process from data extraction/manipulation through model development...
"Senior Scientist, Quantum Mechanics Applications",Schrodinger,"New York, NY",,Strong data organization and data presentation skills. Preparing data for scientific presentations and publications....
Video Fellow,BuzzFeed,"New York, NY",,"We have offices in 19 cities around the world and more than 1500 employees including reporters, video producers, data scientists, engineers, brand strategists,..."
"Software Engineer, Web Applications",FiscalNote,"New York, NY",,"You'll get the opportunity to work at an institution pushing the boundaries of open data transparency, while collaborating with some of the industry’s brightest..."
"Director, Operations Research",DEPARTMENT OF SANITATION,"New York, NY","$67,060 - $178,873 a year",The operation of data processing hardware or consoles. Primarily the entering or updating of data in a system; Its highly skilled staff includes data scientists...
Project Director,BOARD OF CORRECTION,"New York, NY","$87,768 - $113,838 a year",Evaluate and monitor the following data and reports from DOC and H+H:. Two years as a City Research Scientist Level I can be substituted for the experience...
Financial Reporting Specialist,Weill Cornell Medicine,"New York, NY",,"Provides data for implementation of approved project plans. Assists in the development, production and distribution of reports focused on the financial and..."
Data Scientist - Global Intelligence (New York),Uber,"New York, NY 10001 (Chelsea area)",,"Data Scientists on the Global Intelligence team work cross functionally with the product, engineering, and operations teams to develop models, optimization..."
Senior Software Engineer (Machine Learning),WeWork,"New York, NY 10005 (Financial District area)",,"Experience in Data Modeling & Evaluation. Data structures (stacks, queues, multi-dimensional arrays, trees, graphs, etc.)...."
HR Associate,Natural Resources Defense Council,"New York, NY 10011 (Chelsea area)",,Ensure data quality and integrity by performing regular maintenance and system audits. We combine the power of more than three million members and online...
Assistant Vice President - Data Scientist,BNP Paribas,"New York, NY",,"Expertise in data analytics, data science and data visualization. At least 1 year of relevant work experience (e.g., as a statistician/ data scientist /..."
Clinical Pharmacologist,Certara,"Parsippany, NJ",,"Minimum 1- 5 years experience and expertise in PK analysis, data management, reporting writing, and regulatory requirements...."
"Market Data Scientist fo QT Fund Ltd, Asset Management",Credit Suisse,"Princeton, NJ 08540",,"Market Data Scientist for QT Fund Ltd, Asset Management. Lead for data set development from raw data into trading/research solution, including understanding of..."
"Support Specialist, Clinical Applications",NYU Langone Health,"New York, NY",,"Ability to analyze data and make recommendations. Also part of NYU Langone Health is the Laura and Isaac Perlmutter Cancer Center , a National Cancer Institute..."
Senior Associate CMC QA (Microbiologist),Chenoa Information Services,"Bridgewater, NJ 08807",,Ability to work on complex issues where analysis of situations or data requires an in-depth evaluation of various factors....
Senior Staff Engineer / Scientist,Matteson Partners,"Princeton, NJ",,"Experience conducting environmental field investigations and data collection/sampling. Compile and assess environmental data using spreadsheets, databases and..."
Director of Data Science Retail Banking,Harnham,"New York, NY","$190,000 a year","Director of Data Science, Data Scientist, Data Science, Analytics, Machine Learning, Statistical Analysis, Predictive Analytics, Banking, Financial Services...."
Senior Business Analyst- Underwriting Analytics,AIG,"New York, NY",,"Collaborate with colleagues in a variety of roles across AIG, from senior business stakeholders to IT professionals and data scientists...."
Senior Data Analyst,Atlantic Media,"New York, NY 10010 (Gramercy area)",,"Work with data scientists, engineers, and product managers to understand data needs. Provide guidance on the sourcing, management, and presentation of data...."
Financial Reporting Specialist,Weill Cornell Medicine,"New York, NY",,"Provides data for implementation of approved project plans. Assists in the development, production and distribution of reports focused on the financial and..."
Machine Learning Engineer,TEKSystems,"New York, NY",,"They should have strong coding skills and fundamentals in data structures, predictive modeling, and big data concepts...."
Machine Learning Engineer,"Open Systems Technologies, Inc.","New York, NY",,"Our client is a financial services, data and multiformat media company, highly respected in the market for its leading data, managed services, analytics and..."
Principal Statistical Consultant,Novartis Pharmaceuticals,"East Hanover, NJ 07936",,"In statistics, biostatistics, data science, computational biology or another related field. Innovative clinical trial design, quantitative decision making,..."
Senior Software Engineer (Machine Learning),WeWork,"New York, NY 10005 (Financial District area)",,"Experience in Data Modeling & Evaluation. Data structures (stacks, queues, multi-dimensional arrays, trees, graphs, etc.)...."
Supervising Producer,BuzzFeed,"New York, NY",,"We have offices in 19 cities around the world and more than 1700 employees including reporters, video producers, data scientists, engineers, brand strategists,..."
HR Associate,Natural Resources Defense Council,"New York, NY 10011 (Chelsea area)","Estimated salary: $59,000 - $75,000 a year",Ensure data quality and integrity by performing regular maintenance and system audits. We combine the power of more than three million members and online...
Assistant Vice President - Data Scientist,BNP Paribas,"New York, NY",,"Expertise in data analytics, data science and data visualization. At least 1 year of relevant work experience (e.g., as a statistician/ data scientist /..."
"Support Specialist, Clinical Applications",NYU Langone Health,"New York, NY",,"Ability to analyze data and make recommendations. Also part of NYU Langone Health is the Laura and Isaac Perlmutter Cancer Center , a National Cancer Institute..."
Senior Business Analyst- Underwriting Analytics,AIG,"New York, NY",,"Collaborate with colleagues in a variety of roles across AIG, from senior business stakeholders to IT professionals and data scientists...."
"Associate Director, Cinical Project Scientist, Cardiovascular",Johnson & Johnson Family of Companies,"Raritan, NJ",,"Responsibilities for the Clinical Project Scientist include:. Qualifications for the Associate Director, Clinical Project Scientist, CV include:...."
Strategic Communications Manager,HDR,"New York, NY",,"Manage communications teams including multi-media designers, event planners, data managers and social media specialists...."
CCB - Risk-Fraud Data Scientist/Modeler-Text Mining-VP,JP Morgan Chase,"New York, NY 10001 (Chelsea area)",,"Your expertise and insights will help us effectively utilize big data platforms, data assets, and analytical capabilities to control fraud loss and improve..."
CCB - Risk-Fraud Data Scientist/Modeler-Computer Vision-VP,JP Morgan Chase,"New York, NY 10001 (Chelsea area)",,"Your expertise and insights will help us effectively utilize big data platforms, data assets, and analytical capabilities to control fraud loss and improve..."
CCB - Risk-Fraud Data Scientist/Modeler-Speech Recognition-VP,JP Morgan Chase,"New York, NY 10001 (Chelsea area)",,"Your expertise and insights will help us effectively utilize big data platforms, data assets, and analytical capabilities to control fraud loss and improve..."
Staff Associate and/or Senior Staff Associate (Applied Data Scientists),Columbia University,"New York, NY",,"The Data Science Institute of Columbia University invites applications to our Applied Data Scientist position(s) as candidates for Staff Associate (SA), and/or..."
Principal Statistician -Oncology,Bayer,"Whippany, NJ",,"Your tasks and responsibilities The primary responsibilities of this role, Principal Statistician, are to: Take the statistical lead for Oncology Medical..."
Quality Control Bioassay Scientist,"Immunomedics, Inc.","Morris Plains, NJ 07950",,"Provides subject matter expertise regarding the current format and analysis of bioassay data, prepares and presents technical data to management, and trains and..."
"Technical Services Manager Americas, Savory Ingredients - Parsippany, NJ",DSM Food Specialties,"Parsippany, NJ",,Coach and support a team of scientists in their technical capabilities and competencies. DSM – Bright Science....
Traffic Engineer/Designer,HDR,"Newark, NJ",,"We create an unshakable foundation for progress because our multidisciplinary teams also include scientists, economists, builders, analysts and artists...."
Project Manager I - Clincal Research Contracts Analyst,Atlantic Health System,"Morristown, NJ 07960",,"Under the supervision of internal counsel or working with external counsel, draft, review and assist with the negotiation of contractual agreements, including..."
Staff Associate and/or Senior Staff Associate (Applied Data Scientists),Columbia University,"New York, NY",,"The Data Science Institute of Columbia University invites applications to our Applied Data Scientist position(s) as candidates for Staff Associate (SA), and/or..."
Lead Data Scientist – Machine Learning,The NPD Group,"New York, NY 10001 (Chelsea area)",,"The NPD Group provides the world’s most successful brands with leading market research, combining consumer and retail point-of-sale data with analytic solutions..."
Senior Clinical Biomarker Scientist,Bristol-Myers Squibb,"Princeton, NJ 08540",,Experienced scientist with 3+ years of experience in the drug development process. The Clinical Biomarker Scientist is responsible for developing and executing...
Principal Statistician -Oncology,Bayer,"Whippany, NJ",,"Your tasks and responsibilities The primary responsibilities of this role, Principal Statistician, are to: Take the statistical lead for Oncology Medical..."
Quality Control Bioassay Scientist,"Immunomedics, Inc.","Morris Plains, NJ 07950",,"Provides subject matter expertise regarding the current format and analysis of bioassay data, prepares and presents technical data to management, and trains and..."
Data Scientist - Test & Learn Analytics,"J.Crew Group, Inc.","New York, NY 10003 (Greenwich Village area)","Estimated salary: $100,000 - $127,000 a year",Data Scientist – Test and Learn Analytics. Handle missing data through an algorithmic approach such as multiple imputations to enable insights in sparse and...
Data Scientist - Pricing,"J.Crew Group, Inc.","New York, NY 10003 (Greenwich Village area)",,J.Crew is seeking a Data Scientist with an emphasis on Pricing Analytics to join our team of highly successful predictive analysts....
"Technical Services Manager Americas, Savory Ingredients - Parsippany, NJ",DSM Food Specialties,"Parsippany, NJ",,Coach and support a team of scientists in their technical capabilities and competencies. DSM – Bright Science....
"Senior Analyst, Research and Insights",Undertone,"New York, NY 10173 (Midtown area)",,"Leverage data from multiple resources (syndicated, secondary) to convey compelling stories that are tailored to persuade and inform...."
Traffic Engineer/Designer,HDR,"Newark, NJ",,"We create an unshakable foundation for progress because our multidisciplinary teams also include scientists, economists, builders, analysts and artists...."
Machine Learning Engineer,Darwin Recruitment,"New York, NY","$150,000 - $180,000 a year",Big data technologies:. Darwin Recruitment are currently partnered with a Global Software Business (SAAS)....
Buyside Quantitative Model Review Analyst,Ashton Lane Group,"New York, NY",,"Assist on all matters related to risk modeling across all investment management strategies. Coverage of asset classes such as Equities, Fixed Income/Liquidity..."
Senior Associate CMC QA (Microbiologist),Chenoa Information Services,"Bridgewater, NJ 08807",,Ability to work on complex issues where analysis of situations or data requires an in-depth evaluation of various factors....
"VP, Business Strategy (New York)",BuzzFeed,"New York, NY",,"We have offices in 19 cities around the world and more than 1500 employees including reporters, video producers, data scientists, engineers, brand strategists,..."
Director Insurance Analytics / Principal II -Research & Development,ISO,"Jersey City, NJ",,"ISO Solutions group of Verisk Insurance Solutions, is seeking an experienced data scientist to serve as the lead technical resource in the development of new..."
Behavioral Science Center - Behavioral Scientist,Ipsos North America,"New York, NY",,"Behavioral Science Center (BSC) , one of the first dedicated centers on Behavioral Science and Behavioral Economics in the market research industry, is seeking..."
Data Scientist,APN Consulting,"New York, NY",,Efficient data processing algorithms. We are looking for a data scientist who wants to be part of the cutting edge of finance using AI....
"Head, Translational and clinical analytic enablement",Bristol-Myers Squibb,"Princeton, NJ 08540",,Lead a team of data scientist and analytic enablement talent. Defining a data strategy to make data available and accessible for scientific business...
Postdoctoral Fellowship,Kessler Foundation,"West Orange, NJ 07052",,"Ability to independently develop data processing/analysis methods. The two-year program prepares biomedical scientists, including engineers (e.g...."
Product Designer,Quartet,"New York, NY 10018 (Clinton area)",,"You will be talking to our users - physicians, therapists and patients, and working alongside product managers, engineers, data scientists and clinical experts..."
Product Designer,Temboo,"New York, NY 10013 (Tribeca area)",,"Help us re-imagine programming for everyone, from mechanical engineers and research scientists, to city designers and farmers...."
Software Engineer (Windows/Linux),Vencore,"Basking Ridge, NJ",,"From smart grid to smart phones, intelligent highways to intelligent battlefields, Vencore Labs’ 200 scientists, engineers and analysts are consistently..."
Visual Designer,Palantir Technologies,"New York, NY 10014 (West Village area)",,"Scientists, relief workers, civil servants, healthcare workers, and homicide detectives, just to name a few. We partner with the most important institutions in..."
Advisory Services Manager - Data Scientist,EY,"New York, NY",,"At least five years hands-on experience with data science, machine learning, big data, and data engineering...."
Business Analyst,NYU Langone Health,"New York, NY",,Prepares monthly data statistics for the Manager of Finance & Data Reporting to report out to Senior Leadership....
Environmental Remediation Scientist,PS&S,"Township of Warren, NJ",,"Direct and implement field and office data collection efforts, data validation, and data evaluation. PS&S is an award-winning “one-stop shop” of architecture..."
Principal Statistician,Celgene Corporation,"Berkeley Heights, NJ",,"Work closely with different departments in the company (regulatory, clinical, marketing, data management, health economics, etc.)...."
Lead Data Scientist,IBM,"New York, NY 10002 (Lower East Side area)",,"4+ years of experience with data analysis, preferably with digital data and structured and unstructured data...."
Sr. Research Analyst,Nielsen,"New York, NY 10003 (Greenwich Village area)",,"A passion for working with media data. 3-5 years in application development, data science or similar role. By integrating information from its Watch and Buy..."
Customer Success Lead,Custoria,"New York, NY",,"You will work with an awesome close-knit team of former engineers, designers, consultants, traders, marketers, and data scientists...."
Data Engineer / Scientist - Machine Learning,3coast,"New York, NY","$120,000 - $160,000 a year",Data Engineer / Scientist - Machine Learning. This Client is looking for their next senior data engineer / scientist....
VP of Technology,InRhythm,"New York, NY 10005 (Financial District area)",,"Manage and hire an existing and growing team of front-end engineers, UX designers and Data Scientists while continually attracting, growing and retaining top..."
Billing / Invoicing Specialist,Certara,"Parsippany, NJ",,Generate monthly fixed fee billing data and time review spreadsheets. It now has more than 100 scientists using a broad range of modeling and simulation methods...
"Global Manager, Planning and Performance Management",ZX Ventures,"New York, NY",,"We are a small army of futurists, dreamers, doers, designers, engineers, scientists, marketers, brewers, builders, and data geeks...."
Quantitative Research Analyst - Commodities and Global Markets (New York),Macquarie Group Limited,"New York, NY",,"Macquarie Group is a global provider of banking, financial, advisory, investment and funds management services. At Macquarie we offer you the experience and..."
"Associate Director, Cinical Project Scientist, Cardiovascular",Johnson & Johnson Family of Companies,"Raritan, NJ",,"Responsibilities for the Clinical Project Scientist include:. Qualifications for the Associate Director, Clinical Project Scientist, CV include:...."
Senior Data Scientist,Jobspring Partners,"Jersey City, NJ","$110,000 - $125,000 a year",Big Data exposure to Spark / Hadoop. We are looking for mid-senior Data Scientists to join one of the leading providers of healthcare analytics in the Chicago...
Systems Engineer,Banc3 Inc.,"Princeton, NJ",,"Professional experience should include successful planning, coordinating, and executing systems integration projects with a diverse team of scientists and..."
"Environmental Technicians – Parsippany, NJ",Tetra Tech,"Parsippany, NJ",,"Maintaining accurate field logs, data sheets. Exporting/processing field data utilizing computer programs (e.g., Windows Excel, Leica Geo Office, other handheld..."
Software Architect - Big Data,Siemens AG,"Princeton, NJ",,The Software Architect Big Data will help Siemens development teams leverage big data technologies to develop new products or enhance existing products....
Financial Counselor - Cancer Center,NYU Langone Health,"New York, NY",,"Monitoring and updating information regarding insurance data, authorizations, and re-authorizations, change of treatment authorizations including same day..."
"Manager/Director, Medical Writing and Publications",Flatiron Health,"New York, NY",,"Use scientific/research expertise to support strong working collaborations with both internal and external experts to ensure quality data analysis,..."
Clinical Project Leader,Sanofi US,"Bridgewater, NJ",,Professional demeanor with ability to interact effectively with scientists and managers from multiple disciplines;...
"Digital Media Buyer, Programmatic",Xaxis,"New York, NY",,"Xaxis combines proprietary technology, unique data assets and exclusive media relationships with the brightest team of audience analysts, data scientists and..."
Sr. Environmental Manager / LSRP,o'brien & gere engineers,"Edison, NJ 08837",,"Regularly interact with existing and prospective clients and establish collaborative OBG project teams with engineers, geologists and scientists...."
"Principal Scientist, Clinical Pharmacology and Pharmacokinetics",Celgene Corporation,"Summit, NJ 07901",,And standard noncompartmental data analysis software (Phoenix/WiNonlin). Perform and accountable for non-compartmental PK data analysis....
"Senior Associate Scientist, Analytical Services Laboratory",Celgene Corporation,"Summit, NJ 07901",,"Interpret and discuss data and results. Interacts with CSPs, reviews raw data generated by CSPs and supports their lab investigations as needed...."
Data Scientist,Workbridge Associates,"New York, NY","$80,000 - $120,000 a year","Experience tracking data in R. My client, a company that provides real estate lending services to consumers, is looking for a Data Scientist to join the team..."
Group Leader,Wuxi AppTec,"Plainsboro, NJ",,"Knowledge of Data Acquisitions and Operating Software as Analyst, MassLynx. Compiles, records, calculates, and analyzes data in accordance with accepted..."
Data Scientist,Fluid Intelligence,"New York, NY",,"Expert knowledge of data modeling and understanding of different data structures. Directs a team of Data Scientists to design, develop, and implement end-to-end..."
Quantitative Risk Analyst,Robert Walters,"New York, NY",,Ensure completeness and accuracy of all referential data. Develop processes and procedures for efficient and timely data capture....
Sr. Modeling Data Scientist,S.C. International,"New York, NY","$130,000 a year",Insurance organization is seeking talent to join growing corporate analytics group. Great opportunity to join a fast paced and entrepreneurial department....
Health Informaticist,pulseData,"New York, NY",,"Wrangle large data sets from client health systems and identify key clinical data elements. Pre-Series A, our team has a balanced team made up of engineers,..."
Associate Research Coordinator,NYU Langone Health,"New York, NY",,"Collaborate with the statistics, data management teams and enrolling centers to resolve outstanding forms and data queries;..."
Statistician,A10,"Princeton, NJ",,"Provide statistical support including statistical design and data analysis of clinical trials, and to perform secondary data analysis to support opt trials &..."
Cell Culture Media and Upstream Process Development Scientist,Eurofins Lancaster Laboratories Professional Scien...,"Kenilworth, NJ",,"Critical thinking, laboratory experimentation and data analysis. Eurofins Lancaster Laboratories PSS is searching for a Scientist in Kenilworth, NJ...."
Marketing Research Analyst/Consumer Insights Analyst,The Forum Group,"New York, NY 10016 (Gramercy area)","$45,000 - $65,000 a year","Work with Group Manager/Director on client requests, analyze data and produce deliverables. Should be able to interpret data from different perspectives, assist..."
"Senior Scientist, Global Biscuit RD&Q",Mondelez International,"East Hanover, NJ 07936",,"Provide internal and external data to support gap assessment of current portfolio, using Siemens specification tool...."
Financial Counselor - Cancer Center,NYU Langone Health,"New York, NY",,"Monitoring and updating information regarding insurance data, authorizations, and re-authorizations, change of treatment authorizations including same day..."
Machine Learning Engineer,"Open Systems Technologies, Inc.","New York, NY",,"Our client is a financial services, data and multiformat media company, highly respected in the market for its leading data, managed services, analytics and..."
"Director, Bioanalytical Services",Wuxi AppTec,"Plainsboro, NJ",,"May also supervise peer group scientists on a study or project related basis. Reviews, compiles, records, calculate, and analyze data in accordance with..."
VP of Technology,InRhythm,"New York, NY 10005 (Financial District area)",,"Manage and hire an existing and growing team of front-end engineers, UX designers and Data Scientists while continually attracting, growing and retaining top..."
"Associate Director, Pharmacovigilance Evaluation and Reporting",Johnson & Johnson Family of Companies,"Raritan, NJ",,"Scientists are required. Analyze data in broader context. The Associate Director, Pharmacovigilance Evaluation and Reporting Scientist...."
Data Scientist - Test & Learn Analytics,"J.Crew Group, Inc.","New York, NY 10003 (Greenwich Village area)",,Data Scientist – Test and Learn Analytics. Handle missing data through an algorithmic approach such as multiple imputations to enable insights in sparse and...
Data Scientist - Pricing,"J.Crew Group, Inc.","New York, NY 10003 (Greenwich Village area)",,J.Crew is seeking a Data Scientist with an emphasis on Pricing Analytics to join our team of highly successful predictive analysts....
Bell Labs - R&D Engineer,NOKIA,"Murray Hill, NJ",,"Experience with Cloud computing/SDN/Big Data Analytics. Apply skills and knowledge of fixed and wireless networks, cloud computing/SDN/Big Data Analytics, and..."
"Senior Product Leader, Video Intelligence",JW Player,"New York, NY 10018 (Clinton area)",,"You will work with a team of engineers, data scientists, designers, and QA to drive our product vision and strategy for new and existing functionality while..."
Freelance Video Editor - User Generated Social News,BuzzFeed,"New York, NY",,"Interest in social platforms and data. We have offices in 19 cities around the world and more than 1500 employees including reporters, video producers, data..."
"Senior Data Engineer, Machine Learning",Skillshare,"New York, NY 10012 (Little Italy area)",,"Prior experience on a data engineering team, working with data scientists. On a daily basis, you will build and optimize our data pipeline and ensure we’re..."
Web Developer/Programmer,Columbia University,"New York, NY",,(4) machine-learning focused data fusion methods; (2) semantic technologies such as ontologies and Linked Data;...
Senior Medical Writing Scientist,Johnson & Johnson Family of Companies,"Raritan, NJ",,Demonstrated ability to interpret and organize scientific data (e.g. The Senior Medical Writing Scientist will prepare sound scientific documents using...
UX Designer,QuintilesIMS,"Parsippany, NJ",,"An individual in this role will work directly with executives across many disciplines – Research, Marketing, Data Science, User Experience, Partnerships, and..."
