position,company,location,salary,summary
Operations Research Analyst,Department of the Air Force,"Buckley AFB, CO","$72,168 - $155,073 a year","An example of specialized experience includes extracting& organizing raw cost data under general direction from the team leader, conducting basic mathematical..."
Quantitative Research and Risk Analyst,Charles Schwab,"Lone Tree, CO 80124",,"Description: Lone Tree - CO, DENR2, 9800 Schwab Way, 80124 Axle J Marcoline 20170721-3736 We believe that , when done right, investing liberates people to..."
Machine Learning Data Analyst,Cognizant,"Denver, CO",,"Experience in various statistical and machine learning models, data mining, unstructured data analytics in corporate or academic research environments...."
Junior Data Scientist/Software Engineer,CCRi,"Aurora, CO",,"CCRi is looking for smart, innovative data scientists with analytical and software engineering skills. Data Processing and Analytics:...."
Data Scientist,BAE Systems,"Buckley AFB, CO 80011 (Norfolk Glen area)",,"As a Data Scientist, you will leverage knowledge of data science, methodologies, and processing techniques to perform predictive analytics in the geospatial..."
Big Data Developer,Forsythe,"Centennial, CO",,"Work closely with AWS architects, Big Data managers and Data Scientists, and ask appropriate questions to understand scope of work and provide accurate schedule..."
Sr. Data Scientist,BP,"Denver, CO",,"The data and analytics organization are teams of highly experienced data scientists, data engineers, data management and quality experts, reporting and..."
Lead Data Scientist,BP,"Denver, CO",,"The data and analytics organization are teams of highly experienced data scientists, data engineers, data management and quality experts, reporting and..."
Quantitative Analyst - IHS Command Center,DISH Network,"Littleton, CO",,"Collect, report on, model, analyze, and present large amounts of data with meticulous attention to detail. Conduct long-term and short-term data analysis with a..."
Analyst-Data Research I,S&P GLOBAL MARKET INTELLIGENCE,"Centennial, CO",,Do you love data? Prior experience with data entry a big advantage. Display a real passion for accuracy and dedication to detail in support our 100% data...
Analyst-Data Research I,S&P Global,"Centennial, CO","Estimated salary: $42,000 - $53,000 a year",Do you love data? Prior experience with data entry a big advantage. Display a real passion for accuracy and dedication to detail in support our 100% data...
Sr. Data Scientist (Technology & Operations),Ascend Learning,"Greenwood Village, CO",,"Ascend Learning is hiring a Senior Data Scientist to join our team. Reporting to the VP Data and Analytics, this person is responsible leading a small team of..."
Data Science Researcher,National Renewable Energy Laboratory,"Golden, CO",,"Design, implement, and document data workflows. Integrating multiple data sources, models, and software tools with scientific and engineering workflows for..."
Data Analytics Manager,Telligen,"Greenwood Village, CO 80111",,"Data Analytics Manager. Ensures customer satisfaction through the technical development, testing, and documentation of the data analysis solutions...."
Research Analyst,Denver Investments,"Denver, CO","Estimated salary: $54,000 - $69,000 a year","Perform data collection, industry research, analysis, and report conclusions to aid in the investment decision-making process...."
RESEARCH ANALYST,Kroenke Sports & Entertainment,"Denver, CO",,Ability to conduct in-depth data analysis. Ability to work with large data sets. Seeks ways to automate reporting for recurring data analysis....
Data Scientist / Researcher,Lockheed Martin,"Littleton, CO 80127",,"This position will work closely with the SSC IT Analytics data scientist and analytics team members, performing data research and analysis, working with a..."
"Associate, Data Scientist",KPMG,"Denver, CO 80202 (Lodo area)","Estimated salary: $101,000 - $128,000 a year","Retrieve, process and prepare a rich data variety of data sources such as social media, news, internal/external documents, emails, financial data, and..."
Research Scientist,CACI,"Aurora, CO 80010 (Delmar Parkway area)",,"Possess excellent data gathering, analytical, and problem solving skills. BIT Systems Inc...."
Senior Data Scientist,Layer3 TV,"Denver, CO","Estimated salary: $89,000 - $113,000 a year",Layer3 TV is seeking a data scientist with exceptional technical aptitude and the ability to draw insights from data....
Principal Engineer I - Data Scientist,Spectrum,"Centennial, CO",,"The Principal Engineer- Data Scientist will be responsible for designing, building and extracting large and complex data sets while thinking strategically about..."
"Analyst, Research",JLL,"Denver, CO",,"Passion for technology, analytics, and data visualization tools. This team member will enhance our offerings in the areas of business intelligence, data..."
Data Reporting Analyst Associate - Research Informatics Analyst,Children's Hospital Colorado,"Aurora, CO",,"Gathers functional and technical requirements to design, build, test, deliver and manage data repositories, reporting, ETL, data warehouse, registry or data..."
Sr. Data Scientist/Data Integration,BP,"Denver, CO",,"The data and analytics organization are teams of highly experienced data scientists, data engineers, data management and quality experts, reporting and..."
Research Scientist Sr Stf,Lockheed Martin,"Littleton, CO 80127",,"Manipulating and analyzing complex, high-volume, high-dimensionality data from varying sources combined with empirical research and finding answers to hard..."
Business Analyst,NBI Resources,"Aurora, CO",,Our core team of Computer scientists and Data Engineers have a passion for building tools that solve our clients most challenging and complex technical problems...
Contract Analyst-Research,Catholic Health Initiatives - National Office,"Englewood, CO",,Schedule - Full-time Job - Professional Non-Clinical Daily Schedule - Days Scheduled Hours per 2-week Pay Period - 80 Weekends Required - None...
Postdoctoral Researcher – Data Science and Machine Learning,National Renewable Energy Laboratory,"Golden, CO",,"Experience monitoring, mining, synthesizing from and analyzing multiple sources of digital and/or event-based data, such as network traffic and IoT data, is a..."
Senior Data Scientist,Comcast,"Denver, CO 80202 (Lodo area)",,Who does the Data Scientist work with? 4+ years working within an enterprise data warehouse environment or big data architecture....
US Head of Data Architecture and Analysis,Janus Henderson,"Denver, CO",,"Data feeds between the central data hub/warehouse and business applications or data marts. Architectural and data schema design in the data hub, warehouses and..."
Postdoctoral: Vehicle Data Analysis Engineer,National Renewable Energy Laboratory,"Golden, CO",,"Solid engineering and technical capabilities in experimental design, on-board data acquisition, data mining and data analysis. Vehicle Data Analysis:...."
Data Scientist - Media,Spectrum,"Greenwood Village, CO",,"TWCBDA347 Data Scientist Exempt. Passionate about data maintenance, data quality control and all other important data analysis techniques...."
Data Scientist - Clinical Strategy,Catholic Health Initiatives - National Office,"Englewood, CO",,Contributes to the development of data governance standards. Works with Clinical Decision Teams to discuss data outputs....
Lead Data Scientist,DISH Network,"Englewood, CO",,A successful Data Scientist will have the following:. Experience using streaming data processing techniques is a plus Bachelor's degree from four-year college...
Competitive Research Analyst,Layer3 TV,"Denver, CO",,"Strong analytical skills, including ability to analyze large data sets, identify insights, and synthesize how insights impact business decisions...."
Security Data Science Director,Great-West,"Denver, CO",,Experience managing Data Scientists. Great-West Financial is looking for a high-energy Director of Data Science to help build out a centralized security...
Education - Research Analyst II,National Conference of State Legislatures,"Denver, CO 80230 (Central East Denver area)","$3,486 a month","Collects and monitors data on legislative actions, state and federal programs, using library resources, available databases, and public and private..."
PRA - QC Analyst,University of Colorado,"Aurora, CO",,"As needed, assist development scientists and operations with technical/operational support. Excellent communication skills in both written as well as..."
Data Scientist IV,DCP Midstream,"Denver, CO",,"Understands data elements, data models and working with structured or unstructured data sets. Strong background in advanced statistical and data science..."
Environmental Technician/Entry Level Scientist,GHD,"Golden, CO",,"Environmental Technician/Entry Level Scientist - GOL00101. Perform sampling, site inspections and other data collection...."
"Scientist 5, Enterprise Data & Analytics",Comcast,"Englewood, CO 80112",,"Preferred.- Experience with machine learning, deep learning, data mining, and/or statistical analysis tools and how to adapt and customize the underlying..."
Research Associate - Bioinformatics,National Jewish Health,"Denver, CO 80206 (Central East Denver area)",,Prepares data for utilization by other scientists. Analysis of allele-specific expression data. Writes advanced scripts to access databases and analyze data....
Bioinformatics Analyst Trainee,National Jewish Health,"Denver, CO 80206 (Central East Denver area)",,Writes custom web tools for scientists. Writes custom scripts to access databases and analyze data. Bachelors-level training in high-throughput data analysis...
Postdoctoral Scientist,University of Colorado,"Aurora, CO",,"Patch-clamp electrophysiology data acquisition and analysis. Creative, independent and motivated Postdoctoral Scientist sought to lead a collaborative NIH..."
Operations Research Systems Analyst,Leidos,"Englewood, CO 80111",,Description: Job Summary: Leidos has a opening for a Operations Research Analyst in Englewood Colorado . Candidate will conduct operations research on...
Bioinformatics Analyst I,National Jewish Health,"Denver, CO 80206 (Central East Denver area)",,Writes custom web tools for scientists. Complete tasks in a Linux environment including primary analysis of sequence data (read mapping and gene expression...
K-12 Research Analyst II,National Conference of State Legislatures,"Denver, CO 80230 (Central East Denver area)","$3,486 a month","Collects and monitors data on legislative actions, state and federal programs, using library resources, available databases, and public and private..."
Business Intelligence Data Scientist,Chipotle Mexican Grill,"Denver, CO 80202 (Lodo area)",,Business Intelligence Data Scientist (17030694) Description Position Summary:. The Data Scientist will drive internal data analytics projects serving all areas...
"Intern, Marketing Operations & Data Analysis",Ping Identity,"Denver, CO 80202 (Lodo area)",,"At Ping Identity, we're changing the way people think about enterprise security technology. With our innovative Identity Defined Security platform, we're..."
Data Engineer,Return Path,"Broomfield, CO 80021",,"As a Data Engineer, you will collaborate with fellow engineers, data scientists and data analysts to support their needs and the needs of the business...."
Artificial Intelligence Software Engineer,KPMG,"Denver, CO 80202 (Lodo area)",,"Design, develop and maintain artificial intelligence-enabled managed services (APIs) with a team of Data Scientist, Software Engineers and Project Managers...."
Sr. Air Force Operations Research Analyst,Leidos,"Englewood, CO 80111",,Description: You will conduct research and analysis that employs a combination of advanced operations research methods in the study of complex and national...
Data Engineer,Return Path,"Broomfield, CO 80021",,"As a Data Engineer, you will collaborate with fellow engineers, data scientists and data analysts to support their needs and the needs of the business...."
Postdoctoral Researcher – Data-Driven Power System Analysis,National Renewable Energy Laboratory,"Golden, CO",,Stability analysis and prediction using synchrophasors Interconnection-wide and distribution level synchrophasor measurement data analytics Measurement-based...
Visualization Scientist,National Renewable Energy Laboratory,"Golden, CO",,"The Data, Analysis and Visualization group in NREL’s Computational Science Center has an immediate opening for a Computational Scientist to pursue a cross..."
Predictive Modeling Analyst,Vencore,"Aurora, CO",,"Ability to analyze multiple data sets and to present cohesive analysis findings. Vencore is a proven provider of information solutions, engineering and..."
D2V Scholar,University of Colorado,"Aurora, CO",,"Additionally, scholars will have theopportunity to engage in existing CU programs, providing unique experiences in scientific research areas including..."
CdTe Thin-Film Materials Processing Technician,National Renewable Energy Laboratory,"Golden, CO",,Performing work reproducibly with high degree of quality and reliability Recording data in computer databases ....
Roofing & Waterproofing Consultant - Denver,"Wiss, Janney, Elstner Associates","Denver, CO",,"Ability to record data clearly and write passages for reports, letters, etc. Wiss, Janney, Elstner Associates is a global firm of engineers, architects, and..."
Clinical Laboratory Scientist I,National Jewish Health,"Denver, CO 80206 (Central East Denver area)",,"Performs error correction, photocopy and data entry and compilation as required. Collects and organizes data before initiating analysis and asks questions to..."
Engineer I - Data Strategist (662144),Ball Aerospace,"Broomfield, CO",,"Technical data sourcing, management, and analysis. Open source data sourcing, management, and analysis. Our team of more than 3,000 engineers, scientists,..."
Clinical Laboratory Scientist I,National Jewish Health,"Denver, CO 80206 (Central East Denver area)",,"Performs error correction, photocopy and data entry and compilation as required. Collects and organizes data before initiating analysis and asks questions to..."
Prospect Research and Data Analyst,Nurse Family Partnership,"Denver, CO 80203 (Capitol Hill area)",,"This position will ensure that frontline fundraisers on our regional, institutional, and individual giving teams have the data and information that they need to..."
Clinical Laboratory Scientist Lead,National Jewish Health,"Denver, CO 80206 (Central East Denver area)",,"And preparing patient data for reporting. Compiles customized data for clients/studies as directed. For studies, may work on data compilation and writing..."
Data Scientist,Allegiance Consulting,"Denver, CO",,Our client is looking for several Data Scientists for a minimum 6-month project in South Denver. Adept at Data Wrangling /Data Munging....
"Software Engineer, VIPER",Comcast,"Denver, CO 80202 (Lodo area)","Estimated salary: $120,000 - $152,000 a year","Software architects, network engineers, big data scientists, player developers, content security specialists, and various streaming video technologists...."
Data Scientist Snr Manager,Oracle,"Broomfield, CO",,Data Scientist Snr Manager-1700142B. 3+ years in leadership/management of data science/analytic team. Create processes to calibrate any external data with...
"Sr App Dev, Dynamic Exp.",Spectrum,"Greenwood Village, CO",,"Software architects, web application engineers, big data scientists, operation engineers, and various entities from network security...."
"Manager, Data Scientist",KPMG,"Denver, CO 80202 (Lodo area)",,"Retrieve, process and prepare a rich data variety of data sources such as social media, news, internal/external documents, emails, financial data, and..."
Regulatory Affairs Coordinator,University of Colorado,"Aurora, CO",,Participates in Data Safety Monitoring Committee (DSMC) internal audits. Our division has physicians and advanced practice providers who are devoted primarily...
Engineer IV – DoD Initiatives,National Renewable Energy Laboratory,"Golden, CO",,Perform site assessments and data collection for the creation of electrical drawings and models. Implement and manage project control systems and metrics and...
Sr. Copy Writer,Aetna,"Denver, CO",,Collaborate with our UX researchers and data scientists to understand user behaviors and uncover new opportunities for engagement....
"Senior Associate, Data Scientist",KPMG,"Denver, CO 80202 (Lodo area)",,"Retrieve, process and prepare a rich data variety of data sources such as social media, news, internal/external documents, emails, financial data, and..."
"Manager, Data Analytics",KPMG,"Denver, CO 80202 (Lodo area)",,"Lead the design and development of tools and solutions working with data scientists, data integration teams and visualization experts to deliver analysis that..."
Global VP (Semiconductor Business),TransReach,"Golden, CO",,"Drives, and supports with data, internal decision making on long term growth investments including capital equipment and R&D programs...."
"Senior Software Engineer, Video Insights and Analysis",Comcast,"Denver, CO 80202 (Lodo area)",,Partner with data scientists to productionize machine learning algorithms. Excited about data visualization and telling a story with data....
Geotechnical Engineer - Denver,"Wiss, Janney, Elstner Associates","Denver, CO",,"Ability to record data clearly and write reports, letters, etc. Analyzes research and investigation data and develops alternate schemes for solving problems...."
Planner I - Manufacturing (661476),Ball Aerospace,"Westminster, CO",,"Our team of more than 3,000 engineers, scientists, technicians and support staff drives all the achievements at Ball Aerospace...."
Production Control Center Scheduler (662358),Ball Aerospace,"Broomfield, CO",,"Collect and verify production data and calculate statistical data for use in reports. Check and post data to production logs, records, or reports...."
Sr. Asset Management Consultant,HDR,"Denver, CO 80202 (Lodo area)",,"We create an unshakable foundation for progress because our multidisciplinary teams also include scientists, economists, builders, analysts and artists...."
"Director, Data Scientist",KPMG,"Denver, CO 80202 (Lodo area)",,"Retrieve, prepare, and process a rich data variety of data sources such as social media, news, internal/external documents, emails, financial data, and..."
Research Firmware Engineer,Honeywell,"Broomfield, CO 80021",,"Demonstrated understanding of centralized and distributed data storage, managing data access latency, and databases...."
Supvr Laboratory,UCHealth,"Aurora, CO",,"Middleware – WAM 5.0, Remisol, Data Innovations, CentraLink. Graduate of an accredited Medical Technologist or Medical Lab Scientist program...."
Coord Laboratory,UCHealth,"Aurora, CO",,Bachelor's degree in related field and graduate of an accredited Medical Technologist or Medical Laboratory Scientist program....
Principal Data Scientist - Audience Target Team,Oracle,"Broomfield, CO",,Principal Data Scientist - Audience Target Team-170017IX. Acting as a source of knowledge and mentorship for junior data scientists....
Administrative Associate III (662029),Ball Aerospace,"Broomfield, CO",,"Gather and interpret data; Prepare various schedules and perform data entry, etc. Our team of more than 3,000 engineers, scientists, technicians and support..."
"Food Scientist, Product Development Innovation",Dean Foods,"Broomfield, CO 80021",,Tactical decision-making ability using sound scientific principles and data analytics. Job Description & Requirements....
Sr Manager - Model Risk Management,Charles Schwab,"Lone Tree, CO 80124",,"Manager will work with Data Scientists, Statisticians, and Analysts to ensure that all statistically based models are in compliance with the model lifecycle..."
"Sr. Manager, Video Platform Analytics",Comcast,"Denver, CO 80202 (Lodo area)",,"The person in this position will lead a highly skilled engineering team that includes data engineers, data analysts, data scientists, testers, and DevOps..."
Sr. Market Research Analyst,TSYS,"Broomfield, CO",,"Data visualization tools such as Tableau. Works independently to analyze marketing data, interpret it for brand impact and report to management on implications..."
Associate Mission Systems Analyst (661328),Ball Aerospace,"Westminster, CO",,"Participate in test data collection and evaluation. Our team of more than 3,000 engineers, scientists, technicians and support staff drives all the achievements..."
Sr. Business Intelligence Project Manager,Chipotle Mexican Grill,"Denver, CO 80202 (Lodo area)",,"Manage portfolio of BI projects, leading a team of data engineers, data architect, data analysts, data scientists, business owners and subject matter experts..."
Air Quality Field Engineer or Scientist (Denver),ERM,"Denver, CO",,"ERM is seeking a hands-on Air Quality Field Engineer or Scientist looking for a career opportunity based out of our Denver, Colorado office...."
Sr Manager - Model Risk Management,Charles Schwab,"Lone Tree, CO 80124",,"Manager will work with Data Scientists, Statisticians, and Analysts to ensure that all statistically based models are in compliance with the model lifecycle..."
STEM Manager,Goodwill Industries of Denver,"Denver, CO",,Monitors the quality of the data submitted through participation in monthly audits of their data with the Program Monitoring and Evaluation (PME) department....
"Sr Staff Scientist, R&D",DigitalGlobe,"Westminster, CO",,Experience with 3D and elevation data. Please review the job details below....
Associate Range Engineer (662328),Ball Aerospace,"Westminster, CO",,"Our team of more than 3,000 engineers, scientists, technicians and support staff drives all the achievements at Ball Aerospace...."
Associate Industrial Engineer (661975),Ball Aerospace,"Westminster, CO",,"Identify and implement ways to automate data collection and analysis. Our team of more than 3,000 engineers, scientists, technicians and support staff drives..."
Associate Structural Engineer (661396),Ball Aerospace,"Westminster, CO",,"Our team of more than 3,000 engineers, scientists, technicians and support staff drives all the achievements at Ball Aerospace...."
Malware Threat Research Analyst,Webroot,"Broomfield, CO",,You are an information security/malware professional looking to contribute to an innovative and collaborative environment. You have a passion for the thrill...
"Sr Staff Scientist, R&D",DigitalGlobe,"Westminster, CO",,Experience with 3D and elevation data. Please review the job details below....
Malware Threat Research Analyst,Webroot,"Broomfield, CO",,You are an information security/malware professional looking to contribute to an innovative and collaborative environment. You have a passion for the thrill...
Associate Range Engineer (662328),Ball Aerospace,"Westminster, CO",,"Our team of more than 3,000 engineers, scientists, technicians and support staff drives all the achievements at Ball Aerospace...."
Associate Industrial Engineer (661975),Ball Aerospace,"Westminster, CO",,"Identify and implement ways to automate data collection and analysis. Our team of more than 3,000 engineers, scientists, technicians and support staff drives..."
Associate Structural Engineer (661396),Ball Aerospace,"Westminster, CO",,"Our team of more than 3,000 engineers, scientists, technicians and support staff drives all the achievements at Ball Aerospace...."
Medical Technologist,"SCHRYVER MEDICAL, LLC","Denver, CO 80239",,Reviews and interprets laboratory results and data. Must be a registered or certified Medical Technologist or Clinical Laboratory Scientist or meet equivalency...
Global Commercial Senior Director Automotive,TransReach,"Golden, CO",,"Drives, and supports with data, internal decision making on long term growth investments including capital equipment and R&D programs...."
Quality Control Manager,Bristol Companies,"Golden, CO",,"Ability to gather and analyze data, reason logically and creatively, draw conclusions and make appropriate recommendations...."
Quality Control Manager,Bristol Alliance of Companies,"Golden, CO",,"Ability to gather and analyze data, reason logically and creatively, draw conclusions and make appropriate recommendations...."
Postdoctoral Researcher - Computational Modeling of Catalysis,National Renewable Energy Laboratory,"Golden, CO",,"Fluency in at least one scientific programming stack (Python/R/MATLAB), including techniques for data manipulation and machine learning...."
Scientist Process Engineering,UPSHER SMITH,"Denver, CO",,Tabulate and perform statistical analysis of all study data. The Technical Services Scientist - Process Engineering supports activities related to the...
Material Planner (661698),Ball Aerospace,"Westminster, CO",,"Our team of more than 3,000 engineers, scientists, technicians and support staff drives all the achievements at Ball Aerospace...."
Quality Control Manager,Bristol Companies,"Golden, CO",,"Ability to gather and analyze data, reason logically and creatively, draw conclusions and make appropriate recommendations...."
Quality Control Manager,Bristol Alliance of Companies,"Golden, CO",,"Ability to gather and analyze data, reason logically and creatively, draw conclusions and make appropriate recommendations...."
Data Analyst/Scientist,"Computer Enterprises, Inc.","Centennial, CO 80112",$80 a day,"Responsible for gathering and assessing business information needs and preparing system requirements • Performs analyses, development and evaluation of data..."
Data Scientist/Analyst,"Computer Enterprises, Inc.","Centennial, CO 80112",$85 a day,"Identify relevant data sources from data warehouses, application logs, partner data sources, research reports, surveys, etc. and able to lead integration into..."
