position,company,location,salary,summary
Technology Risk Measurement- Data Scientist- Jr. level - NY,RPC Solutions,"New York, NY",,"Data Scientist – Jr Level. 1-4 years experience in data analytics, data science, data structure, and statistics...."
"Summer Research Assistant/Associate, Neuroscience",Simons Foundation,"New York, NY 10010 (Gramercy area)",,The primary mission of the Center for Computational Biology is to create new computational frameworks that will enable scientists to analyze the large and...
Research Assistant,Memorial Sloan Kettering,"New York, NY",,Carry out data analysis and interpret experimental results including quality controls and performance metrics....
Senior Data Strategy Analyst,"Neustar, Inc.","New York, NY 10012 (Little Italy area)",,"Manage data collection from clients, data review and quality checks of incoming data to ensure high quality data is used in database processing...."
Data Analysis & QA Engineer Role,Sentient Science Corporation,"Buffalo, NY 14209 (Delaware-West Ferry area)",,Work closely with software engineering and data analytics team to define & automate data ingestion and data QA....
Research Technician I,Weill Cornell Medicine,"New York, NY","Estimated salary: $30,000 - $38,000 a year","Analyzes data using computer software and reports results to the principle investigator(s). Under supervision, assists scientists with laboratory and..."
"Senior Analytics Consultant, Decision Analytics (Risk Analytics)",EXL,"New York, NY 10019 (Midtown area)",,"Extremely comfortable working with data, including managing large number of data sources, analyzing data quality, and pro-actively working with client’s data/..."
Financial Research Analyst & Reporting,Columbia University,"New York, NY",,"Reporting to the Manager of Research Finance, the post-award Financial Research Analyst & Reporting is responsible for assisting with the post award financial..."
Biostatistician/ Research Scientist,Stony Brook University,"Stony Brook, NY",,Expertise in the state-of-the-art data manipulation and statistical methodology. Stony Brook University is hiring a Research Scientist position in the...
Software Engineer I,Memorial Sloan Kettering,"New York, NY","Estimated salary: $106,000 - $135,000 a year",Process and analyze data from multi-modalities medical imaging and high-throughput next-generation sequencing with an emphasis in pathology;...
Equity Research Analyst - Long Only - Health Care Sector,Voya Financial,"New York, NY",,"Thoughtful process of analyzing data and problem solving data to reach a well-reasoned solution. As part of the application process, a candidate account is..."
Solution Delivery Manager - Healthcare Analytics & Delivery,McKinsey & Company,"New York, NY 10022 (Midtown area)",,"It is a unique mix of Healthcare Experts, physicians, statisticians, engineers, data scientists, and more. As one of the fastest-growing parts of our firm, New..."
Research Technician I,Weill Cornell Medicine,"New York, NY",,"Analyzes data using computer software and reports results to the principle investigator(s). Under supervision, assists scientists with laboratory and..."
"Senior Analytics Consultant, Decision Analytics (Risk Analytics)",EXL,"New York, NY 10019 (Midtown area)",,"Extremely comfortable working with data, including managing large number of data sources, analyzing data quality, and pro-actively working with client’s data/..."
Financial Research Analyst & Reporting,Columbia University,"New York, NY",,"Reporting to the Manager of Research Finance, the post-award Financial Research Analyst & Reporting is responsible for assisting with the post award financial..."
Research Scientist II - DMPK,Albany Molecular Research,"Rensselaer, NY 12144",,"Research Scientist II - DMPK in Rensselaer, NY. Record all appropriate data electronically in AMRI’s databases...."
Software Engineer I,Memorial Sloan Kettering,"New York, NY",,Process and analyze data from multi-modalities medical imaging and high-throughput next-generation sequencing with an emphasis in pathology;...
Equity Research Analyst - Long Only - Health Care Sector,Voya Financial,"New York, NY",,"Thoughtful process of analyzing data and problem solving data to reach a well-reasoned solution. As part of the application process, a candidate account is..."
Solution Delivery Manager - Healthcare Analytics & Delivery,McKinsey & Company,"New York, NY 10022 (Midtown area)",,"It is a unique mix of Healthcare Experts, physicians, statisticians, engineers, data scientists, and more. As one of the fastest-growing parts of our firm, New..."
HR Analyst - Short Term,Natural Resources Defense Council,"New York, NY 10011 (Chelsea area)",,"Create and run audit reports to ensure data integrity. Experience using quantitative and qualitative analytical strategies, working with multiple data sources..."
"Senior Scientist, Machine Learning and Virtual Screening",Schrodinger,"New York, NY",,"Senior Scientist, Machine Learning and Virtual Screening. The ideal candidate is a scientist experienced in the application, development, and refinement of..."
Patient-Centered Outcomes Assessment Lead,Pfizer Inc.,"New York, NY 10017 (Midtown area)",,"Providing technical expertise in the analysis and dissemination of COA data. Maintaining awareness of new methods, tools and data sources to ensure study..."
Assistant Scientist (S-1) / Associate Scientist,Brookhaven National Laboratory,"Upton, NY 11973",,"Research experience (as postdoc, research assistant, industrial scientist, or other equivalent work). Sample prep and handling skills, ability to interact..."
VP of Technology,InRhythm,"New York, NY 10005 (Financial District area)",,"Manage and hire an existing and growing team of front-end engineers, UX designers and Data Scientists while continually attracting, growing and retaining top..."
Lead Product Analyst,Xaxis,"New York, NY",,"Working alongside data scientists, engineers, product managers, and traders you will build quantitative expertise around digital media trading...."
Associate Actuary,Oscar Insurance,"New York, NY 10012 (Little Italy area)",,"In this role, you will join our Risk team and work directly with Actuaries and Data Scientists. You have experience working with large databases and analyzing..."
"Associate Researcher, Pharmacological Sciences",Mount Sinai Health System,"New York, NY 10029 (Yorkville area)",,"Centers, and laboratories, our scientists continue to shape the future of. In the collection, analysis and review of experimental data for publication and...."
"Associate Researcher, Metabolism Institute",Mount Sinai Health System,"New York, NY 10029 (Yorkville area)",,"And laboratories, our scientists continue to shape the future of clinical care. In the collection, analysis and review of experimental data for publication and...."
ASSOCIATE RESEARCHER-CARDIOLOGY,Mount Sinai Health System,"New York, NY 10029 (Yorkville area)",,"Assists in the collection, analysis and review of experimental data for publication and presentation...."
Director of Data Management and Analytics,Providge Consulting,"New York, NY",,"Director of Data Management and Analytics. Knowledge of the Python scientific and data libraries, particularly Pandas;..."
"Associate Researcher, Oncological Sciences",Mount Sinai Health System,"New York, NY 10029 (Yorkville area)",,"And laboratories, our scientists continue to shape the future of clinical care. In the collection, analysis and review of experimental data for publication and...."
Research Support Specialist,The Rockefeller University,"New York, NY",,The Research Support Specialist is ideal for a scientist with hands-on LC-MS/MS experience who has or wishes to gain additional proteomics and small molecule...
"Manager, Service Data Analysis (Op Planning)",New York City Transit,"Manhattan, NY","$95,534 a year","The candidate should be proficient working with a variety of data sources and formats from across the agency, including large data sets and operational data...."
Director of Credit Risk and Data Analytics,Strategic Financial Solutions,"New York, NY 10018 (Clinton area)",,"Creativity to challenge the status quo and create better solutions to the problem, ability to work independently as data scientist, but in the meantime,..."
Adjunct Associate Faculty – Machine Learning,Columbia University School of Professional Studies,"New York, NY",,"Columbia University, School of Professional Studies (SPS) seeks candidates to serve as a part-time Associate to assist with course facilitation and..."
Assistant Scientist (S-1) / Associate Scientist,Brookhaven National Laboratory,"Upton, NY 11973",,"Research experience (as postdoc, research assistant, industrial scientist, or other equivalent work). Sample prep and handling skills, ability to interact..."
Executive Assistant to the SVP,NYU Langone Health,"New York, NY",,"Compiles, categorizes, calculates, audits, verifies, or processes information or data. Responds to requests for information, summarizes and data based on..."
UNDERGRADUATE OR GRADUATE RESEARCH ASSISTANT,Research Foundation of The City University of New...,"New York, NY",,Post processing is achieved with analytical code developed to aggregate and slice the data to answer specific research questions....
Actuary,Oscar Insurance,"New York, NY 10012 (Little Italy area)",,"In this role, you will join our Risk team and work directly with Actuaries and Data Scientists. You will own pieces of our actuarial work that enables our..."
Director of Data Management and Analytics,Providge Consulting,"New York, NY",,"Director of Data Management and Analytics. Knowledge of the Python scientific and data libraries, particularly Pandas;..."
Data Scientist - Global Intelligence (New York),Uber,"New York, NY 10001 (Chelsea area)",,"Data Scientists on the Global Intelligence team work cross functionally with the product, engineering, and operations teams to develop models, optimization..."
"Associate Partner, Advanced Analytics",IBM,"New York, NY 10002 (Lower East Side area)",,"Manage delivery of advanced analytics First of A Kind (FOAK) engagements, leading teams of senior data scientists, developers, strategy consultants and working..."
Product Manager - Data & Analytics,Elsevier,"New York, NY 10010 (Gramercy area)",,"Usage growth of structured data in charts/tables/databases. Strong MS Excel or other data analysis tools (e.g., R) skills is an advantage...."
Statistical/ Database Marketing Analyst,FULLBEAUTY Brands,"New York, NY",,"MA/MS degree in Statistics, Data Science or related analytical field of study. Capability to execute the complete modeling process from data extraction..."
Computational Biologist I,Memorial Sloan Kettering,"New York, NY",,"Analyze data sets to discover and annotate cancer-causing genetic mutations in body fluids. Fluency with UNIX, next generation (Next-gen) sequencing data..."
Research Associate Physics – Instrumentation Systems,Brookhaven National Laboratory,"Upton, NY 11973",,"Familiarity with instrumentation control software development, data acquisition and data analysis based on C/C++, Python, Matlab...."
"HBO Manager, Applied Analytics",HBO,"New York, NY",,Lead a team of talented data and applied scientist in the design and execution of complex data and analytic projects that influence key business decisions in...
Project Manager - Intelligent Solutions Machine Learning,JP Morgan Chase,"New York, NY 10001 (Chelsea area)",,Familiarity with Big Data Technology is preferred. JPMorgan Intelligent Solutions (JPMIS) is a new group considering ways to transform and leverage JPM...
"Principal Scientist, Onc. In Vivo Pharmacology",Pfizer Inc.,"Pearl River, NY 10965",,"A Principal Scientist position requiring a Ph.D. Present data at internal and external meetings, first author or significant contributions to publications...."
Beamline Scientist,Brookhaven National Laboratory,"Upton, NY 11973",,"Engage in beamline control and data acquisition software development, implementation and testing. The Energy and Photon Sciences Directorate at Brookhaven..."
"Assoc. Editor, Genome Research",Cold Spring Harbor Laboratory,"Cold Spring Harbor, NY 11724",,"An understanding of data reproducibility, deposit and access issues would be helpful. Cold Spring Harbor Laboratory, a world-renowned scientific research..."
Postdoctoral Research Associate,Brookhaven National Laboratory,"Upton, NY 11973",,"Demonstrated experience with large-volume data analysis. The Laboratory's almost 3,000 scientists, engineers, and support staff are joined each year by more..."
MQA – Cross Asset Quantitative Analyst - VP,Citi,"New York, NY",,"Partnering with senior technology professionals to source internally generated data. United States,New York,New York...."
Markets – Credit Quantitative Analyst – Assoc/VP,Citi,"New York, NY",,"Perform data analysis and draw good conclusions from the results. United States,New York,New York...."
"Analytics Engagement Manager, Decision Analytics",EXL,"New York, NY 10019 (Midtown area)",,"Our global footprint of nearly 2,000 data scientists and analysts assist client organizations with complex risk minimization methods, advanced marketing,..."
Principal Data Scientist - Healthcare - 35483BR,Aetna,"New York, NY 10016 (Gramercy area)",,We are currently looking for an exceptional Principal Data Scientist - Healthcare to play a pivotal role in the creation and deployment of information products....
CLINICAL RESEARCH ASSOCIATE I-CARDIOLOGY,Mount Sinai Health System,"New York, NY 10029 (Yorkville area)",,Identifies and documents data errors or items requiring clarification on all documents collected for study and initiates data clarification/validation process...
Customer Success Associate,Custoria,"New York, NY",,"You will work with an awesome close-knit team of engineers, designers, consultants, product managers, marketers, and data scientists...."
Research Scientist II - DMPK,Albany Molecular Research,"Rensselaer, NY 12144",,"Research Scientist II - DMPK in Rensselaer, NY. Record all appropriate data electronically in AMRI’s databases...."
Administrative Assistant (Temp Program),NYU Langone Health,"New York, NY",,"Reports - Gathers data and information from various sources, prepares reports based on information compiled, determines report format and elements needed,..."
CCB - Risk-Fraud Data Scientist/Modeler-Text Mining-VP,JP Morgan Chase,"New York, NY 10001 (Chelsea area)",,"Your expertise and insights will help us effectively utilize big data platforms, data assets, and analytical capabilities to control fraud loss and improve..."
CCB - Risk-Fraud Data Scientist/Modeler-Computer Vision-VP,JP Morgan Chase,"New York, NY 10001 (Chelsea area)",,"Your expertise and insights will help us effectively utilize big data platforms, data assets, and analytical capabilities to control fraud loss and improve..."
CCB - Risk-Fraud Data Scientist/Modeler-Speech Recognition-VP,JP Morgan Chase,"New York, NY 10001 (Chelsea area)",,"Your expertise and insights will help us effectively utilize big data platforms, data assets, and analytical capabilities to control fraud loss and improve..."
Market Research Analyst - Analyst Development Program,Ipsos North America,"New York, NY",,"Love data, consumer decision-making, and puzzles. Would you like to work with a team of passionate problem-solvers dedicated to bringing research insights and..."
Research Study Specialist (RSS),Memorial Sloan Kettering,"New York, NY",,"Backlogged data entry. Be responsible for coordinating and performing data collection and QA, data entry, and data extraction and analysis for research projects..."
"Water System Analyst, Bureau of Environmental Sciences and Engineering",DEPT OF HEALTH/MENTAL HYGIENE,"Queens, NY","$70,286 - $87,295 a year","Monitoring and overseeing the data exchange process of water quality testing, inspection, and remediation data to ensure the fulfillment of business..."
Security Analyst,Maxus,"New York, NY",,"It is supported by a team of data scientists, technologists and digital practitioners from across GroupM specialist companies...."
Security Analyst,GroupM,"New York, NY",,"It is supported by a team of data scientists, technologists and digital practitioners from across GroupM specialist companies...."
"(Portal) MANAGER, ANALYTICS & INSIGHTS",Viacom,"New York, NY",,Oversee and administer the data processing and dashboarding solution with our data aggregation system. Your duties will also include supporting our various...
Technologist Trainee - Rapid Response Lab (Evening Shift),Memorial Sloan Kettering,"New York, NY",,"Review requisitions and Order Entry orders, verify accuracy of corresponding specimens, and enter required data into computer...."
Research Study Specialist (Genitourinary Non-Prostate Service),Memorial Sloan Kettering,"New York, NY",,"The Research Study Assistant works closely with MSK and each participating institution on data collection, entry and analysis and ensuring data quality and..."
Backend Software Engineer - Video-Intelligence,Verizon Digital Media Services,"New York, NY","Estimated salary: $136,000 - $173,000 a year","Experience with distributed data processing technologies, e.g., MapReduce, Hadoop, and highly available distributed data services...."
"Research Associate - Molecular, Cellular, and Biomedical Sciences",The City University of New York (CUNY),"New York, NY",,"Collects, analyzes, and assures validity of data. The Department of Molecular, Cellular, and Biomedical Sciences at the CUNY School of Medicine at The City..."
Postdoctoral Research Scientist,IBM,"Yorktown Heights, NY 10598",,We are seeking a Postdoctoral Research Scientist candidate to join us at IBM Austin Research Lab. Candidates with at deep understanding of big data analytics...
Post-Doctoral Research Associate,Brookhaven National Laboratory,"Upton, NY 11973",,"Theory, Data Analysis or Instrument Design relevant to Large Scale Structure Experiments. The Laboratory's almost 3,000 scientists, engineers, and support staff..."
Client Specialist - McKinsey Academy,McKinsey & Company,"New York, NY 10022 (Midtown area)",,"As one of the fastest-growing parts of our firm, New Ventures has more than 1,500 dedicated professionals (including more than 800 analysts and data scientists)..."
Echocardiography Specialist,Weill Cornell Medicine,"New York, NY",,"Records data, calculations and measurements of echocardiograms according to its anomaly. Under direction, performs complex echocardiography techniques...."
Analytics Lead,NYU Langone Health,"New York, NY",,Work with data architect in maintaining the enterprise data warehouse to include the necessary data fields used for accurate methodology of metrics ....
Professor/ Assoc Professor/Asst Professor,University of Rochester,"Rochester, NY",,"And, the modeling and analysis of neuroimaging data (e.g., functional MRI, EEG, NIRS). The modeling and analysis of data derived from mobile sensors and related..."
RESEARCH PROGRAM COORDINATOR - GENETICS /GENOMIC SCIENCES,Mount Sinai Health System,"New York, NY 10029 (Yorkville area)",,"The Research Program Coordinator develops study protocols, designs management and statistical plans, analyzes data and prepares final reports from study...."
"Threat Analyst, Research Operations ��� Business Integrity",Facebook,"New York, NY",,"Passionate about diving into the world of big data and trends analyses? (Menlo Park, CA - New York, NY - Seattle, WA)...."
Image Scientist/Engineer- Entry Level,Xerox Corporation,"Webster, NY",,"Xerox Corporation, an industry leader in printing technology and solutions, is looking for an image scientist/engineer or computer scientist to join a dynamic,..."
"Global Lead, Ecommerce Strategy and Capabilities",ZX Ventures,"New York, NY",,"We are a small army of futurists, dreamers, doers, designers, engineers, scientists, marketers, brewers, builders, and data geeks...."
"College Aide, World Trade Center Health Registry",DEPT OF HEALTH/MENTAL HYGIENE,"Queens, NY",$11.50 - $15.90 an hour,"Maintain confidentiality of identifiable data. Under guidance of the WTCHR Research and Survey Unit scientists, review open-ended text responses from ongoing..."
Research Summer intern - IBM Social Good Fellowship,IBM,"Yorktown Heights, NY 10598",,"At least 2 years of experience in predictive modeling, machine learning, data science, data mining, pattern recognition, design, mobile development or..."
CLINICAL RESEARCH COORDINATOR I - PEDIATRICS,Mount Sinai Health System,"New York, NY 10029 (Yorkville area)",,Collects and records study data. Ensures accurate and complete compilation of subject data through chart reviews....
CLINICAL RESEARCH COORDINATOR I - HEALTH POLICY,Mount Sinai Health System,"New York, NY 10029 (Yorkville area)",,Collects and records study data. Ensures accurate and complete compilation of subject data through chart reviews....
Pure Product Specialist,Elsevier,"New York, NY 10010 (Gramercy area)",,"A typical PS is curious and eager to learn, likes to explore data, and draws energy from helping others perform their best within the product...."
Senior Associate,Mindshare,New York State,,"Media Tools and Donovan Data Systems is a plus but not required. Media Planners at Mindshare are part psychologists, part scientists, part artists, part..."
Ultimate Hoops Statistician,Life Time Fitness,"Syosset, NY",,Experience tracking statistical data for basketball games. Life Time is currently seeking a qualified Ultimate Hoops Statistician....
USPA - NLP Scientist,Ipsos North America,"New York, NY",,"We are currently seeking an experienced NLP Scientist to join the U.S. You are comfortable working with a team of non-NLP Scientists, can explain how things..."
Technology Risk Measurement- Data Scientist- mid level - NY,RPC Solutions,"New York, NY",,"5-10 years experience in data analytics, data science, data structure, and statistics. RPC Solutions is currently seeking a Data Scientist to join our leading..."
Research Support Specialist,The Rockefeller University,"New York, NY",,The Research Support Specialist is ideal for a scientist with hands-on LC-MS/MS experience who has or wishes to gain additional proteomics and small molecule...
Jr. Quality Control Scientist,"Ascent Pharmaceuticals, Inc.","Islip, NY",,"Quality Control Scientist in Central Islip, NY to conduct pharmaceutical laboratory quality control/development activities;..."
Data Scientist- Yield Management,DISH Network,"New York, NY",,"A successful data scientist will have the following:. Suggest and implement improved data management, data mining and technology enhancements to support scaling..."
Software Engineer,Bluecore,"New York, NY 10002 (Lower East Side area)",,"Work cross-functionally with product managers, data scientists, and engineers to create cohesive products. Our customers include some of the largest digital..."
Software Engineer,Cornell University,"Ithaca, NY",,"More than one million users use eBird web sites and mobile applications to submit data, share experiences, and explore the world of birds...."
Software Engineer,Twitter,"New York, NY",,"Cortex is a team of software engineers, data scientists, and research scientists dedicated to developing state-of-the-art machine learning capabilities to..."
Director of Credit Risk and Data Analytics,Strategic Financial Solutions,"New York, NY 10018 (Clinton area)",,"Creativity to challenge the status quo and create better solutions to the problem, ability to work independently as data scientist, but in the meantime,..."
Adjunct Associate Faculty – Machine Learning,Columbia University School of Professional Studies,"New York, NY",,"Columbia University, School of Professional Studies (SPS) seeks candidates to serve as a part-time Associate to assist with course facilitation and..."
Manufacturing Scientist I,Enzo Labs,"Farmingdale, NY",,"The Production Scientist I is also responsible for understanding product specifications, troubleshooting technical problems, and implementing process..."
Senior Market Research Analyst,Willis Towers Watson,"White Plains, NY",,The team provides a range of services from information access and delivery (utilizing a number of 3rd-party research subscriptions and WTW proprietary research...
"Data Scientist, Magellan Presales",OpenText,"New York, NY",,"Introducing Magellan, a flexible, AI-powered Analytics platform that combines open source machine learning with advanced analytics, enterprise-grade BI, and..."
Postdoctoral Research Associate-Physics,Brookhaven National Laboratory,"Upton, NY 11973",,"Strong background in data processing, data analysis and analytics, knowledge of modern computing technologies and tools in these areas...."
Postdoctoral Research Associate - Nanoprobe BeamlineResearch Associate,Brookhaven National Laboratory,"Upton, NY 11973",,Program skills for image data reduction. The ability to interact effectively in a team environment with a diverse group of scientists and users....
Research Scientist,University at Buffalo,"Buffalo, NY","$45,000 - $55,000 a year",Experience with managing large-scale data sets; Developing machine learning and mathematics methodologies to address the computational challenges of analyzing...
Psychology Assistant,Albert Einstein College of Medicine,"Bronx, NY",,"Maintain computer databases of study data. Einstein’s major strength, in addition to training physicians and scientists, is its science...."
"Research Scientist, Optics",Corning,"Painted Post, NY 14870",,"We seek out scientists with experience modeling, fabricating, and characterizing optical components. Our projects are fast-paced, and we expect our scientists..."
Entry-Level Environmental Scientist,"Tectonic Engineering & Surveying Consultants, P.C.","Mountainville, NY 10953",,"TECTONIC is currently seeking a full-time Environmental Scientist to work within our Corporate Orange County, NY Office...."
