position,company,location,salary,summary
HR Associate,Natural Resources Defense Council,"New York, NY 10011 (Chelsea area)",,Ensure data quality and integrity by performing regular maintenance and system audits. We combine the power of more than three million members and online...
Senior Scientist,Lannett Company Inc,"Carmel, NY",,Record data and results as specified in documentation procedures. Review and approve data and results as assigned....
Assistant Vice President - Data Scientist,BNP Paribas,"New York, NY",,"Expertise in data analytics, data science and data visualization. At least 1 year of relevant work experience (e.g., as a statistician/ data scientist /..."
AR&D Scientist II,Lannett Company Inc,"Carmel, NY",,Accurately compiles and reports data. Responsible for supporting product development trial samples testing and method development/validation for primarily...
Data Scientist II,Paychex,"Rochester, NY",,"5 years of experience in Data mining, data warehousing, regression analysis or predictive modeling. Explores and gathers external data, including both public..."
Research Technician B,Albert Einstein College of Medicine,"Bronx, NY",,"Limited skills in the analysis and interpretation of data may be required. Einstein’s major strength, in addition to training physicians and scientists, is its..."
"Support Specialist, Clinical Applications",NYU Langone Health,"New York, NY",,"Ability to analyze data and make recommendations. Also part of NYU Langone Health is the Laura and Isaac Perlmutter Cancer Center , a National Cancer Institute..."
Director of Data Science Retail Banking,Harnham,"New York, NY","$190,000 a year","Director of Data Science, Data Scientist, Data Science, Analytics, Machine Learning, Statistical Analysis, Predictive Analytics, Banking, Financial Services...."
Senior Business Analyst- Underwriting Analytics,AIG,"New York, NY",,"Collaborate with colleagues in a variety of roles across AIG, from senior business stakeholders to IT professionals and data scientists...."
"Entry Level Geologist, Environmental Engineer or Environmental Scientist",Kleinfelder,"Fishkill, NY 12524",,"Analyzing and interpreting analytical data,. Data validity and Quality Assurance/Quality Control (QA/QC);..."
Technical Research Analyst,MDRC,"New York, NY 10016 (Gramercy area)",,"Writing technical memos that document data management, processing, and data quality. Master’s degree in statistics, economics, mathematics, education, social..."
Global Finance Manager,Wunderman,"New York, NY 10017 (Midtown area)",,"Headquartered in New York, we have 9,200 creatives, data scientists, strategists and technologists in 200 offices in 70 markets...."
Quantitative Analyst,"Open Systems Technologies, Inc.","New York, NY",,"Create optimization models based on extensive data analysis. Assist in defining plans with functional requirements, data collection, model development and..."
Research Technician B,Albert Einstein College of Medicine,"Bronx, NY",,"Limited skills in the analysis and interpretation of data may be required. Einstein’s major strength, in addition to training physicians and scientists, is its..."
"Senior Associate, Data Scientist",KPMG,"New York, NY 10154 (Midtown area)",,"Retrieve, process and prepare a rich data variety of data sources such as social media, news, internal/external documents, emails, financial data, and..."
Senior Associate - Cognitive Data Scientist Natural Language Processing,KPMG,"New York, NY 10154 (Midtown area)",,"KPMG is currently seeking a Senior Associate - Cognitive Data Scientist Natural Language Processing, to join our National Organization...."
Supervising Producer,BuzzFeed,"New York, NY",,"We have offices in 19 cities around the world and more than 1700 employees including reporters, video producers, data scientists, engineers, brand strategists,..."
Research Associate - NMR,Albany Molecular Research,"Albany, NY 12203 (Campus Area-University District area)",,Analyze experimental data for validity before reporting results. Interpret and report scientific data clearly and concisely....
"Software Engineer, Web Applications",FiscalNote,"New York, NY",,"You'll get the opportunity to work at an institution pushing the boundaries of open data transparency, while collaborating with some of the industry’s brightest..."
Manufacturing Scientist I,Enzo Labs,"Farmingdale, NY",,"The Production Scientist I is also responsible for understanding product specifications, troubleshooting technical problems, and implementing process..."
"Director, Operations Research",DEPARTMENT OF SANITATION,"New York, NY","$67,060 - $178,873 a year",The operation of data processing hardware or consoles. Primarily the entering or updating of data in a system; Its highly skilled staff includes data scientists...
Project Director,BOARD OF CORRECTION,"New York, NY","$87,768 - $113,838 a year",Evaluate and monitor the following data and reports from DOC and H+H:. Two years as a City Research Scientist Level I can be substituted for the experience...
Financial Reporting Specialist,Weill Cornell Medicine,"New York, NY",,"Provides data for implementation of approved project plans. Assists in the development, production and distribution of reports focused on the financial and..."
"Coordinator of Youth Initiatives, Friedman Center",New York Hall of Science,"Queens, NY",,Collect demographic data and translate data into graphs to disseminate information for funding purposes. Utilize data to make strategic improvements to grow the...
"Data Correction Specialist, with Java experience",CSRA,"Rensselaer, NY",,Perform essential restructuring and processing on large data files. Conduct Quality Control (QC) checks on client and vendor data files with the goal of...
Cloud Application Engineer,Fareportal Inc.,"New York, NY 10020 (Midtown area)",,Very strong experience with building/developing modern cloud and data engineering solutions involving TBs of data....
"Data Analyst, Bureau of Early Intervention",DEPT OF HEALTH/MENTAL HYGIENE,"Queens, NY","$59,708 - $65,678 a year","The Data Analyst will:. Assist with data management activities and analysis for the Bureau with support from the Director of Research and Evaluation, the Data..."
Scientist III Cell/Molecular Biology,Thermo Fisher Scientific,"Grand Island, NY 14072",,Presents data at scientific conferences (external and internal) and prepares other publications when appropriate....
Manufacturing Scientist I,Enzo Labs,"Farmingdale, NY",,"The Production Scientist I is also responsible for understanding product specifications, troubleshooting technical problems, and implementing process..."
Payroll Administrator,BuzzFeed,"New York, NY",,"We have offices in 19 cities around the world and more than 1500 employees including reporters, video producers, data scientists, engineers, brand strategists,..."
"Senior Analyst, Research and Insights",Undertone,"New York, NY 10173 (Midtown area)",,"Leverage data from multiple resources (syndicated, secondary) to convey compelling stories that are tailored to persuade and inform...."
Assistant Scientist I/II,Bristol-Myers Squibb,"Syracuse, NY",,Ability to perform limited data analysis and data review. Assistant Scientist II. Ability to perform routine data analysis....
"Statistician, Probe Analytics Risk Score",MultiPlan,"New York, NY 10003 (Greenwich Village area)",,At least 2 years of experience using Microsoft SQL for data mining or have 5 years of experience with other data mining languages and a demonstrated ability to...
Lead Data Scientist – Machine Learning,The NPD Group,"New York, NY 10001 (Chelsea area)",,"The NPD Group provides the world’s most successful brands with leading market research, combining consumer and retail point-of-sale data with analytic solutions..."
Scientist/Engineer I,Bristol-Myers Squibb,"Syracuse, NY",,"Support PPQ and BLA filings including on-floor support, data verification and data analysis. Technical writing and data presentation abilities are requirements...."
Research Scientist - Machine Learning and NLP,"Open Systems Technologies, Inc.","New York, NY",,They are looking to add a skilled research scientist and data science engineer to their machine learning efforts....
"Data Analyst, Bureau of Epidemiology Services",DEPT OF HEALTH/MENTAL HYGIENE,"Queens, NY","$70,286 - $87,295 a year","- Process data to prepare them for analysis, including recoding variables and imputing missing data. The data analyst will also analyze other datasets such as..."
Behavioral Science Center - Behavioral Scientist,Ipsos North America,"New York, NY",,"Behavioral Science Center (BSC) , one of the first dedicated centers on Behavioral Science and Behavioral Economics in the market research industry, is seeking..."
Environmental Remediation Scientist,PS&S,"Yonkers, NY 10701",,"Implement field and office data collection efforts, data validation, and data evaluation. PS&S is an award-winning “one-stop shop” of architecture and..."
Research Coordinator,Albert Einstein College of Medicine,"Bronx, NY",,"Overseeing process of data collection, data cleaning, data analysis and result reporting. Experience in quantitative and qualitative data collection and..."
SENIOR RESEARCH ANALYST,Montefiore Medical Center,"Bronx, NY",,The data generated by the Senior Research Analyst are used in multiple ways:. The Senior Research Analyst is responsible for a broad array of generating reports...
GEOLOGIST 1,DEPT OF ENVIRONMENT PROTECTION,"Manhattan, NY","$45,919 - $52,807 a year",Interpretation of geologic data for recommendations of shaft and tunnel support systems; Evaluate buildings and use plans and environmental data to determine...
Product Designer,Quartet,"New York, NY 10018 (Clinton area)",,"You will be talking to our users - physicians, therapists and patients, and working alongside product managers, engineers, data scientists and clinical experts..."
Product Designer,Temboo,"New York, NY 10013 (Tribeca area)",,"Help us re-imagine programming for everyone, from mechanical engineers and research scientists, to city designers and farmers...."
Research Associate - NMR,Albany Molecular Research,"Albany, NY 12203 (Campus Area-University District area)",,Analyze experimental data for validity before reporting results. Interpret and report scientific data clearly and concisely....
Visual Designer,Palantir Technologies,"New York, NY 10014 (West Village area)",,"Scientists, relief workers, civil servants, healthcare workers, and homicide detectives, just to name a few. We partner with the most important institutions in..."
Advisory Services Manager - Data Scientist,EY,"New York, NY",,"At least five years hands-on experience with data science, machine learning, big data, and data engineering...."
Applications Programmer,Albert Einstein College of Medicine,"Bronx, NY",,"Writing scripts in a unix environment to batch process image data. Einstein’s major strength, in addition to training physicians and scientists, is its science...."
Business Analyst,NYU Langone Health,"New York, NY",,Prepares monthly data statistics for the Manager of Finance & Data Reporting to report out to Senior Leadership....
Sr. Administrative Assistant,Albert Einstein College of Medicine,"Bronx, NY",,"Einstein’s major strength, in addition to training physicians and scientists, is its science. Coordinate data and information and prepare internal and external..."
QC Scientist III,Lannett Company Inc,"Carmel, NY",,Record data and results as specified in documentation procedures. We are seeking a detail oriented person to join our Quality Control Lab as a QC Chemist III at...
Customer Success Lead,Custoria,"New York, NY",,"You will work with an awesome close-knit team of former engineers, designers, consultants, traders, marketers, and data scientists...."
"Global Manager, Planning and Performance Management",ZX Ventures,"New York, NY",,"We are a small army of futurists, dreamers, doers, designers, engineers, scientists, marketers, brewers, builders, and data geeks...."
Quantitative Research Analyst - Commodities and Global Markets (New York),Macquarie Group Limited,"New York, NY",,"Macquarie Group is a global provider of banking, financial, advisory, investment and funds management services. At Macquarie we offer you the experience and..."
Machine Learning Research Scientist,"Open Systems Technologies, Inc.","New York, NY",,Experience with training models on time series data. Design and build systems that solve problems involving text and time series data....
"VP, Business Strategy (New York)",BuzzFeed,"New York, NY",,"We have offices in 19 cities around the world and more than 1500 employees including reporters, video producers, data scientists, engineers, brand strategists,..."
AML/Surveillance Quantitative Audit Analyst,Morgan Stanley,"New York, NY 10032 (Washington Heights area)",,"Recognizing the necessity of enhanced rigor in the firm’s Anti Money Laundering and Compliance Surveillance efforts and continued regulatory scrutiny, Internal..."
Computational Science Developer II,Cold Spring Harbor Laboratory,"Cold Spring Harbor, NY 11724",,"Familiarity with scientific data models/formats. Data and statistical analysis using R, Matlab or similar tool...."
Optical Test Station Development Engineer,Elenion Technologies,"New York, NY",,"Develop code/algorithms in Python for data analysis. Develop code/algorithms in C, C++, and Python to control opto-electronic test stations, including..."
Senior Machine Learning Engineer (VP) - Intelligent Solutions,JP Morgan Chase,"New York, NY 10001 (Chelsea area)",,JPMorgan Chase Intelligent Solutions (JPMIS) is a new group considering ways to transform our data assets into opportunities for JPMorgan Chase by leveraging...
Provider Services Financial Research Analyst,CSRA,"Menands, NY",,Clearance Level Must Currently Possess: No Active Clearance Required Clearance Level Must Be Able to Obtain: No Active Clearance Required Suitability: No...
Research Scientist 2,"Children & Family Services, Office of","Rensselaer, NY","$68,238 - $86,398 a year","Extracting, preparing, and analyzing data from administrative databases to respond to programmatic data requests and federal reporting requirements;..."
Research Coordinator,NYU Langone Health,"New York, NY",,"Abstraction of data for publications, or data collection from outside physicians offices. Reporting and Analysis Researches, compiles and consolidates data and..."
Behavioral Science Center - Behavioral Scientist,Ipsos North America,"New York, NY",,"Behavioral Science Center (BSC) , one of the first dedicated centers on Behavioral Science and Behavioral Economics in the market research industry, is seeking..."
Data Scienitst | Cyber,Glocomms,"New York, NY","$100,000 - $200,000 a year",As a Data Scientist you will interface with the cyber team to fully understand the end goal of each scenario while also identifying gaps in the data protections...
Sr. Research Analyst,Nielsen,"New York, NY 10003 (Greenwich Village area)",,"A passion for working with media data. 3-5 years in application development, data science or similar role. By integrating information from its Watch and Buy..."
Product Designer,Quartet,"New York, NY 10018 (Clinton area)",,"You will be talking to our users - physicians, therapists and patients, and working alongside product managers, engineers, data scientists and clinical experts..."
Product Designer,Temboo,"New York, NY 10013 (Tribeca area)",,"Help us re-imagine programming for everyone, from mechanical engineers and research scientists, to city designers and farmers...."
Visual Designer,Palantir Technologies,"New York, NY 10014 (West Village area)",,"Scientists, relief workers, civil servants, healthcare workers, and homicide detectives, just to name a few. We partner with the most important institutions in..."
Advisory Services Manager - Data Scientist,EY,"New York, NY",,"At least five years hands-on experience with data science, machine learning, big data, and data engineering...."
GEOLOGIST 1,DEPT OF ENVIRONMENT PROTECTION,"Manhattan, NY","$45,919 - $52,807 a year",Interpretation of geologic data for recommendations of shaft and tunnel support systems; Evaluate buildings and use plans and environmental data to determine...
Business Analyst,NYU Langone Health,"New York, NY",,Prepares monthly data statistics for the Manager of Finance & Data Reporting to report out to Senior Leadership....
Risk Assessment Scientist/Toxicologist,"SRC, Inc.","Syracuse, NY 13212",,Perform various evaluations of environmental chemistry and toxicity data under the direction of more senior scientists....
Customer Success Lead,Custoria,"New York, NY",,"You will work with an awesome close-knit team of former engineers, designers, consultants, traders, marketers, and data scientists...."
"Global Manager, Planning and Performance Management",ZX Ventures,"New York, NY",,"We are a small army of futurists, dreamers, doers, designers, engineers, scientists, marketers, brewers, builders, and data geeks...."
Quantitative Research Analyst - Commodities and Global Markets (New York),Macquarie Group Limited,"New York, NY",,"Macquarie Group is a global provider of banking, financial, advisory, investment and funds management services. At Macquarie we offer you the experience and..."
Data Scientist,"Open Systems Technologies, Inc.","New York, NY",,"Experience researching large data sets related to trading (tick/market data, orders and trades) is a plus. The research tasks involve developing research plans,..."
Data Scientist,Fluid Intelligence,"New York, NY",,"Expert knowledge of data modeling and understanding of different data structures. Directs a team of Data Scientists to design, develop, and implement end-to-end..."
Physicist,Brookhaven National Laboratory,"Upton, NY 11973",,"Experience in managing a distributed team of SW professionals and scientists. The Laboratory's almost 3,000 scientists, engineers, and support staff are joined..."
Total Scattering,Brookhaven National Laboratory,"Upton, NY 11973",,Strong data analysis skills and experience in using computers for data analysis and modeling. Ability to interact effectively with a diverse group of scientists...
Computing Professional,Brookhaven National Laboratory,"Upton, NY 11973",,"Implement new software to automate data management which includes enhancing existing code, data base schema design, monitoring tools, and developing ML..."
"Health Economic Analyst, Office of Strategic Data Use/FDC Office",DEPT OF HEALTH/MENTAL HYGIENE,"Queens, NY","$78,630 - $90,425 a year","Become a proficient user of health care claims/utilization data, including Medicaid data extracted from the Salient Interactive Miner and the Statewide Planning..."
Quantitative Risk Analyst,Robert Walters,"New York, NY",,Ensure completeness and accuracy of all referential data. Develop processes and procedures for efficient and timely data capture....
Sr. Modeling Data Scientist,S.C. International,"New York, NY","$130,000 a year",Insurance organization is seeking talent to join growing corporate analytics group. Great opportunity to join a fast paced and entrepreneurial department....
AML/Surveillance Quantitative Audit Analyst,Morgan Stanley,"New York, NY 10032 (Washington Heights area)",,"Recognizing the necessity of enhanced rigor in the firm’s Anti Money Laundering and Compliance Surveillance efforts and continued regulatory scrutiny, Internal..."
Optical Test Station Development Engineer,Elenion Technologies,"New York, NY",,"Develop code/algorithms in Python for data analysis. Develop code/algorithms in C, C++, and Python to control opto-electronic test stations, including..."
Senior Imaging Scientist,Ursa,"Ithaca, NY",,Work with current image providers on data processing system requirements and specifications. Ursa Space Systems is building ground-breaking solutions to deliver...
Research Coordinator,NYU Langone Health,"New York, NY",,"Abstraction of data for publications, or data collection from outside physicians offices. Reporting and Analysis Researches, compiles and consolidates data and..."
Senior Machine Learning Engineer (VP) - Intelligent Solutions,JP Morgan Chase,"New York, NY 10001 (Chelsea area)",,JPMorgan Chase Intelligent Solutions (JPMIS) is a new group considering ways to transform our data assets into opportunities for JPMorgan Chase by leveraging...
Marketing Research Analyst/Consumer Insights Analyst,The Forum Group,"New York, NY 10016 (Gramercy area)","$45,000 - $65,000 a year","Work with Group Manager/Director on client requests, analyze data and produce deliverables. Should be able to interpret data from different perspectives, assist..."
Pre-Sales Data Scientist,Digital Reasoning,"New York, NY",,"Apply data mining, NLP, and machine learning (both supervised and unsupervised) on unstructured data. 3-5 years experience with data science...."
"VP, Insights & Design Strategist",Citi,"Long Island City, NY",,"Partner with product managers, designers, data scientists, developers and third-party agencies/partners. United States,New York,Long Island City...."
"Senior Analyst, Data Management and Quantitative Analysis",BNY Mellon,"Oriskany, NY 13424",,"Data Management and Quantitative Analysis - IC2 Under direct guidance, works with internal and external datasets and client reference data and provides analysis..."
Senior Imaging Scientist,Ursa,"Ithaca, NY",,Work with current image providers on data processing system requirements and specifications. Ursa Space Systems is building ground-breaking solutions to deliver...
"Senior Scientist, Immuno-Oncology",Pfizer Inc.,"Pearl River, NY 10965",,"Ability to effectively and positively interact and collaborate with other scientists, both within the group and together with other groups;..."
Machine Learning Engineer,TEKSystems,"New York, NY",,"They should have strong coding skills and fundamentals in data structures, predictive modeling, and big data concepts...."
Machine Learning Engineer,"Open Systems Technologies, Inc.","New York, NY",,"Our client is a financial services, data and multiformat media company, highly respected in the market for its leading data, managed services, analytics and..."
"Senior Product Leader, Video Intelligence",JW Player,"New York, NY 10018 (Clinton area)",,"You will work with a team of engineers, data scientists, designers, and QA to drive our product vision and strategy for new and existing functionality while..."
Freelance Video Editor - User Generated Social News,BuzzFeed,"New York, NY",,"Interest in social platforms and data. We have offices in 19 cities around the world and more than 1500 employees including reporters, video producers, data..."
"Senior Data Engineer, Machine Learning",Skillshare,"New York, NY 10012 (Little Italy area)",,"Prior experience on a data engineering team, working with data scientists. On a daily basis, you will build and optimize our data pipeline and ensure we’re..."
Web Developer/Programmer,Columbia University,"New York, NY",,(4) machine-learning focused data fusion methods; (2) semantic technologies such as ontologies and Linked Data;...
Digital Technology Director,Natural Resources Defense Council,"New York, NY 10011 (Chelsea area)",,"Proficiency in web development and data management, including HTML, CSS, MySQL, etc. The Natural Resources Defense Council (NRDC) is the nation's most effective..."
Risk Assessment Scientist/Toxicologist,"SRC, Inc.","Syracuse, NY 13212",,Perform various evaluations of environmental chemistry and toxicity data under the direction of more senior scientists....
"Digital Media Buyer, Programmatic",Xaxis,"New York, NY",,"Xaxis combines proprietary technology, unique data assets and exclusive media relationships with the brightest team of audience analysts, data scientists and..."
Sr Data Scientist,Axius Technologies,"New York, NY",,"This opportunity is with a multibillion $ Global giant based in United States, Canada & Mexico, with 16 different delivery centers and Regional offices in..."
"Director, Data Scientist",KPMG,"New York, NY 10154 (Midtown area)","Estimated salary: $168,000 - $214,000 a year","Retrieve, prepare, and process a rich data variety of data sources such as social media, news, internal/external documents, emails, financial data, and..."
Senior Data Scientist - NYC,Darwin Recruitment,"New York, NY","$170,000 - $200,000 a year",Together we are searching for a Senior Data Scientist (5 years professional experience). Darwin Recruitment are currently partnered with a Data Science...
Freelance Video Editor - User Generated Social News,BuzzFeed,"New York, NY",,"Interest in social platforms and data. We have offices in 19 cities around the world and more than 1500 employees including reporters, video producers, data..."
Senior Data Scientist - Modeling,Harnham,"New York, NY","$150,000 a year","Senior Data Scientist - Modeling. As a Senior Data Scientist, you will be an integral part of drafting the new work flow for data and analytics within the..."
Equity Research - Machinery Analyst/Associate,Morgan Stanley,"New York, NY 10032 (Washington Heights area)","Estimated salary: $80,000 - $102,000 a year","Interact with institutional investors, responding to requests for models, reports and data analysis. Assist in writing research reports for initiations of..."
"Senior Data Engineer, Machine Learning",Skillshare,"New York, NY 10012 (Little Italy area)",,"Prior experience on a data engineering team, working with data scientists. On a daily basis, you will build and optimize our data pipeline and ensure we’re..."
Research Scientist III- Screening by Mass Spec.,Albany Molecular Research,"Buffalo, NY 14203 (Willert Park area)",,"RESEARCH SCIENTIST III, SCREENING BY MASS SPECTROMETRY. Troubleshooting of automated equipment and data analysis templates...."
