position,company,location,salary,summary
"Director Research, Next Generation Psychometrics and Data Science",Educational Testing Service (ETS),"Princeton, NJ 08541",,"The Psychometrics, Statistics & Data Sciences (PSDS) area of Research & Development seeks a Director for its Next Generation Psychometrics & Data Science (NGP..."
"Associate Scientist, Bioanalytical",Merck,"Rahway, NJ",,This is an associate bioanalytical scientist position with primary duties in preparing and analyzing samples from biological matrices using LC-MS/MS....
"Scientist III-IV - Biochemical Characterization, Process Development","Oncobiologics, Inc.","Cranbury, NJ",,Basic understanding of statistical data analysis. Train junior scientists and maintain and troubleshoot laboratory instruments....
Statistical Programmer/Data Manager - General Medicine,Columbia University,"New York, NY",,"Harmonizes and organizes datasets, including the maintenance of relevant data documentation. The candidate would have primary responsibility for data integrity..."
Data Analyst / Data Scientist,Defined Clarity,"New York, NY",$65 - $75 an hour,We have a client that is looking for a data scientist to add to its team. Call Center or Customer care data experience a plus....
Data Science Director,AIG,"New York, NY",,Manage and develop a team of highly talented data scientist. We are looking for a top-notch strategic thinker and data science expert that can lead teams of...
Bell Labs Summer Intern,NOKIA,"Murray Hill, NJ",,"Serving customers in over 100 countries, our research scientists and engineers continue to invent and accelerate new technologies that will increasingly..."
Quantum Information Research Scientist,Vencore,"Red Bank, NJ",,Vencore Labs is currently seeking a Research Scientist with a strong background in quantum information science to contribute to applied research and technology...
Technology Intern,Veeco,"Somerset, NJ",,"Experience in DOE and experimental data process tools and techniques (JMP, Minitab, etc.). Work with process scientists in conducting application-specific..."
"Head, Statistical Programming & Analysis",Johnson & Johnson Family of Companies,"Raritan, NJ",,"Establishing Janssen Data Analysis team as an industry. High-end programming solutions for data exploration, design evaluation etc...."
Fixed Income Quantitative Research Analyst,Susquehanna International Group,"New York, NY 10005 (Financial District area)",,"Projects will include work with high-performance algorithmic trading, volatility model backtesting, and statistical analysis of relevant market data...."
"Quantitative Software Engineer, Feature Modeling Analytics","Two Sigma Investments, LLC.","New York, NY",,"A high impact role that works directly with data scientists, engineers, and quantitative analysts; Passion for tacking big data challenges...."
Senior Quantitative Analyst,TD Bank,"New York, NY",,"Strong knowledge of Interest Rates Options market conventions, pricing and risk management techniques Strong knowledge of Linear Interest Rates Derivatives..."
Data Scientist,BuzzFeed,"New York, NY",,BuzzFeed is looking for extraordinary data scientists to join its New York and Los Angeles offices. We have offices in 19 cities around the world and more than...
Quantitative Analyst,Crédit Agricole CIB,"New York, NY",,"General information Entity Crédit Agricole CIB is the Corporate and Investment Banking arm of the Crédit Agricole Group, the world's n°13 bank measured by..."
Stress Testing Data Analysis - VP,Société Générale,"New York, NY",,"The candidate will be in charge of analyzing financial impacts of market shocks and idiosyncratic risks on our US operations on our US scope, understand the RWA..."
Quantitative Research Associate,"Two Sigma Investments, LLC.","New York, NY",,"Developing trading strategies, from idea generation and data collection to analysis and model creation;..."
"People Research Scientist, PhD Intern/Co-op",Facebook,"New York, NY",,Work with HR and recruiting teams to understand their analytical requirements and translate that into data deliverables....
Principal Scientist,Bristol-Myers Squibb,"Princeton, NJ 08540",,"The responsibilities of the scientist will include:. Experience with general programming and data analysis tools/languages such as Python, R, Matlab, Spotfire,..."
HBO Advanced Analytics Specialist,HBO,"New York, NY",,"As a Data Scientist on the Analytic Support team, this individual will assist in the design, implementation and management of analytic workflows within a cloud..."
Predictive Analytics Data Scientist,Verizon,"Basking Ridge, NJ 07920",,"Experience using data munging, data engineering, and feature engineering software to prepare data for use in machine learning Experience with data visualization..."
Market Research Analyst (Corporate and Political),Benenson Strategy Group,"New York, NY",,"They are creative, intellectually curious, and have an interest in translating data into actionable insights...."
Data Research and Acceleration Analyst,"Two Sigma Investments, LLC.","New York, NY",,"In this role, you will partner with our close-knit team of quantitative researchers, data scientists, engineers, and data sourcing colleagues to translate data..."
Business Intelligence Manager,Verizon,"Basking Ridge, NJ 07920",,Connect various data locations in order to stage data before visualizations. Work with large sets of data to build proper visualizations and setups for...
Senior Statistician,"Neustar, Inc.","New York, NY 10012 (Little Italy area)",,Well versed in using SQL to process/extract data from data processing platforms. Own onboarding of client data into our attribution solution by deep diving into...
Software Engineer / Research Scientist - Machine Learning Team,Bloomberg,"New York, NY",,"Bloomberg's Machine Learning Group - a group of scientists, researchers and software engineers who have a passion for solving complex data problems...."
"Research Investigator, Translational Bioinformatics",Bristol-Myers Squibb,"Hopewell, NJ",,"The scientists in this group analyze real-world health data, design experiments and analyze both pre-clinical and clinical -omics data sets, including RNA-Seq,..."
Postdoctoral Research Associate - Statistical Analysis,Princeton University,"Princeton, NJ",,"The Department of Astrophysical Sciences, Princeton University has as an open postdoctoral or more senior research position in the area of statistical analysis..."
Big Data Engineer,Capgemini,"New York, NY",,"Big Data expert (SPARK, PYTHON, Big Data Stack, Data Analysis, Risk and regulatory domain. Big Data engineer...."
"Research Analyst - Project Employee - New York, NY",Navigant,"New York, NY",,Regularly uses close visual acuity and operates computer equipment to prepare and analyze and transmit data. Navigant’s Global Investigations & Compliance team...
Big Data Engineer,Capgemini,"New York, NY",,"Big Data expert (SPARK, PYTHON, Big Data Stack, Data Analysis, Risk and regulatory domain. Big Data engineer...."
"Manager, Data Research & Analytics",Weill Cornell Medicine,"New York, NY",,"Use quantitative analysis, data mining, and the presentation of data to support decision making; Manage the preparation, maintenance and administration of data..."
"Research Scientist, Technology Innovation",New York Genome Center,"New York, NY 10013 (Tribeca area)",,Excellent communication skills and experience of writing first-author manuscripts for publication – able to present complex data in simple terms;...
Senior Statistician,"Neustar, Inc.","New York, NY 10012 (Little Italy area)",,Well versed in using SQL to process/extract data from data processing platforms. Own onboarding of client data into our attribution solution by deep diving into...
Global Markets Lab Machine Learning Expert,BNP Paribas,"New York, NY",,"Experience with big Data environment (Hadoop, Spark). Proven track record of delivery of projects using data mining, data visualization and machine learning..."
"Vice President, Decision Analytics (Account Management)",EXL,"Jersey City, NJ",,"Our global footprint of nearly 2,000 data scientists and analysts assist client organizations with complex risk minimization methods, advanced marketing,..."
Research Scientist,NYU Langone Health,"New York, NY",,May develop protocol for the collection and quality of research data. We have an exciting opportunity to join our team as a Research Scientist....
"Quantitative Consumer Insights Researcher, Marketing Science Research",Facebook,"New York, NY",,Identify methods to leverage Facebook's large internal data sets to validate hypotheses and enhance 3rd party research work with proprietary data....
"Executive Director, Business Intelligence & Data Science","Starz Entertainment, LLC","New York, NY",,Manage small internal and extensive external team of data scientists. 2-5 years managing internal and third party data engineering and data science teams....
Research Scientist - Data Science,Educational Testing Service (ETS),"Princeton, NJ 08541",,"Data scientist, data analysis, quantitative research, qualitative research, computer science, statistics, theory, technical leadership, conceptualization,..."
Associate Chemist,Breakwater Treatment & Wellness,"Cranbury, NJ",$12 - $15 an hour,"Data entry and maintaining detailed records for regulatory compliance. Horticulture, MMJ, medical marijuana, cannabis, greenhouse, chemist, scientist, New..."
Research Analyst - NJ,Cushman & Wakefield,"East Rutherford, NJ 07073",,Provides an advanced level of research support in ensuring data integrity. Write about and analyze proprietary market data (both historical and future)....
Analyst of Brand Analytics and Custom Research,Univision communications inc,"New York, NY",,"Written and oral language proficiency A self-starter with strong written/oral communication and project management skills Advanced skills in Excel, PowerPoint A..."
Graduate Advanced Technology & Research Analyst,Arup,"New York, NY",,Graduate AT&R; Positions available in 2018 in New York The Advanced Technology and Research practice (AT+R) brings together specialists of the highest...
Data Engineer - Product,Showtime,"New York, NY 10176 (Murray Hill area)",,# Data Engineer - Product. Develop and enhance data warehouse in AWS S3. Work with other departments to understand their data needs....
"Scientist II, Analytical Development",Celgene Corporation,"Summit, NJ 07901",,Generate laboratory clinical release and stability data. The Scientist II individual should work with minimal supervision to carry out laboratory based de novo...
"Scientist II, Biologics Analytical Development",Celgene Corporation,"Summit, NJ 07901",,Review analytical data for completeness and correctness. Scientist should work with minimal supervision to carry out laboratory based de novo analytical methods...
Software/Data Engineer - Spark Streaming,Capital One,"New York, NY",,"Values data and truth over ego. Enterprise Customer Intelligence is a team of engineers, product managers, data scientists and program managers who are..."
Research Scientist - Data Science,Educational Testing Service (ETS),"Princeton, NJ 08541",,"Data scientist, data analysis, quantitative research, qualitative research, computer science, statistics, theory, technical leadership, conceptualization,..."
Strategic Data Scientist,AIG,"New York, NY",,We are looking for top-notch Strategic Data Scientists to join our team and be the creative force for the next wave of dramatic performance improvement and...
"Research Analyst - Project Employee - New York, NY",Navigant,"New York, NY",,Regularly uses close visual acuity and operates computer equipment to prepare and analyze and transmit data. Navigant’s Global Investigations & Compliance team...
Customer & Digital Analytics,GAF Materials Corporation,"Parsippany, NJ",,Partner with data scientists to use key metrics as inputs to advanced analytical models. Data visualization skills using Tableau also a very big plus....
Research Analyst - NJ,Cushman & Wakefield,"East Rutherford, NJ 07073",,Provides an advanced level of research support in ensuring data integrity. Write about and analyze proprietary market data (both historical and future)....
Strategic Data Scientist,AIG,"New York, NY",,We are looking for top-notch Strategic Data Scientists to join our team and be the creative force for the next wave of dramatic performance improvement and...
"Analyst, Program and Digital Research",NBCUniversal,"New York, NY",,"Ability to write clearly, analyze data and summarize data. Provide strategic insights based on Nielsen and Digital data for recurring and ad hoc requests...."
Market Research Analyst (Corporate),Benenson Strategy Group,"New York, NY",,"They are creative, intellectually curious, and have an interest in translating data into actionable insights...."
"Director, Data Science",NBCUniversal,"New York, NY",,"Lead and manage a team of data scientists in the design and execution of advanced analytical data exploration, mining, inference, models and systems utilizing..."
Business Intelligence Developer,Hospital for Special Surgery,"New York, NY",,Proven experience consolidating disparate data sets into usable data. 2+ years of experience in data warehousing with designing multi-layered data warehouses...
"Software Engineer, PhD Intern/Co-op (Machine Learning)",Facebook,"New York, NY",,"Research experience in a relevant field, such as machine learning, NLP, recommendation systems, pattern recognition, signal processing, data mining, artificial..."
"Instagram - Software Engineer, Machine Learning",Facebook,"New York, NY",,"Machine learning, recommendation systems, pattern recognition, large-scale data mining or artificial intelligence...."
"Senior Scientist, Research Analytics",Celgene Corporation,"Summit, NJ 07901",,"We seek a talented computational scientist who will work in a highly collaborative environment on the analysis, statistical modeling, and the generation of..."
Market Research Client Analyst,Kantar Millward Brown,"New York, NY",,"He or she will also develop questionnaires, drive data analysis and interpret research results. Strong analytical and critical thinking skills with the ability..."
Applications Team Leader,Croda Inc,"Edison, NJ 08837",,Lead and direct a team of scientists to meet agreed business objectives. Carry out and lead application programs to generate innovative data for new and...
Director of Data Science,Xaxis,"New York, NY",,"Director, Data Science. You will mentor data scientists, establish a path for career growth, and help grow the team...."
Data Research and Acceleration Manager,"Two Sigma Investments, LLC.","New York, NY",,"You will partner with our close-knit team of quantitative researchers, data scientists, engineers, and data sourcing colleagues to translate data into..."
"Buyside Research Analyst,Financials",Lazard Ltd.,"New York, NY",,"Research Analyst, Financials As a Research Analyst at Lazard Asset Management, you will work as part of the Financials Research team and your day-to-day..."
SMX - Research Analyst,Ipsos North America,"New York, NY",,"Find new spins on data visualization, attend and learn at the presentation stage. The ideal candidate is a business-minded individual who is interested in and..."
Connect - Research Analyst,Ipsos North America,"New York, NY",,"Love data, consumer decision-making, and puzzles. Would you like to work with a team of passionate problem-solvers dedicated to bringing research insights and..."
Intermediate Research Analyst,OppenheimerFunds,"New York, NY",,"Able to make good decisions when faced with complex or ambiguous data. OppenheimerFunds is seeking an Analyst on the Global Equity team, specifically for the..."
OGIQ Research Analyst,Options Group,"New York, NY 10003 (Greenwich Village area)",,Maintain all pertinent applicant and interview data. An OGiQ Research Analyst’s primary role is to be the catalyst for growth to leverage the firm’s recruiting...
Connect - Research Analyst,Ipsos North America,"New York, NY",,"Love data, consumer decision-making, and puzzles. Would you like to work with a team of passionate problem-solvers dedicated to bringing research insights and..."
Intermediate Research Analyst,OppenheimerFunds,"New York, NY",,"Able to make good decisions when faced with complex or ambiguous data. OppenheimerFunds is seeking an Analyst on the Global Equity team, specifically for the..."
OGIQ Research Analyst,Options Group,"New York, NY 10003 (Greenwich Village area)",,Maintain all pertinent applicant and interview data. An OGiQ Research Analyst’s primary role is to be the catalyst for growth to leverage the firm’s recruiting...
Equity Research Analyst Small Cap,AllianceBernstein,"New York, NY",,"Job Number: 9043 Position Title: Team Member - Exempt Location_formattedLocationLong: New York, New York US External Description: Research is the..."
Research Analyst - Forum,Third Bridge,"New York, NY",,"We are currently looking to develop our Forum team. These are group conference calls, private meetings and roundtables, where industry thought leaders discuss..."
Research Analyst - Immediate Openings,Third Bridge,"New York, NY",,First job out of college not what you thought it would be? Boring? No real responsibility? Just a cog in a wheel? If you are ready to leave dull and join...
Portfolio Research Analyst,"Two Sigma Investments, LLC.","New York, NY",,"Proactively analyzing data, running simulations, and pursuing wide-ranging research to improve performance;..."
AVP Intermediate Research Analyst,OppenheimerFunds,"New York, NY",,"Analyze economic and market data, industry trends, issuer credit quality and security characteristics to support investment decisions...."
Data Engineer - Product,Showtime,"New York, NY 10176 (Murray Hill area)",,# Data Engineer - Product. Develop and enhance data warehouse in AWS S3. Work with other departments to understand their data needs....
Director of Data Engineering and Data Science Technology,New York Life Insurance Co,"New York, NY",,"Is this not why we became data scientists? Director of Data Engineering and Data Science Technology. We work with data ranging from demographics, credit and geo..."
"Scientist, Quality Assurance",Katalyst Healthcares & Life Sciences,"South Plainfield, NJ 07080",,"Primary focus of this position is focused on the oversight on the stability program and the coordination and planning of stability studies, data analysis and..."
"Environmental Health Surveillance Analyst, Bureau of Childcare",DEPT OF HEALTH/MENTAL HYGIENE,"New York, NY","$59,708 - $65,678 a year","-Analyzing environmental and health data from a variety of sources, including but not limited to child care inspectional data;..."
Bus Intelligence & App Specialist,Weill Cornell Medicine,"New York, NY",,"Prior experience with data warehouse is desired. Analyzes and understands various data models in depth; Proactively define data structures additions (views,..."
Research Engineer,Stevens Institute of Technology,"Hoboken, NJ 07030",,"Advanced data analysis skills using software such as Matlab; The Department of Civil, Environmental, and Ocean Engineering (CEOE) at Stevens Institute of..."
Senior Quantitative Analyst - Credit Risk,Capital One,"New York, NY",,Panel data analysis; Develop quantitative models based on statistical and mathematical principles and perform qualitative and quantitative data analysis and...
"MD, Head of Data Science",S&P Global,"New York, NY",,"Detailed knowledge (10+ years) in multiple data domains – familiarity with, and knowledge of financial data assets, as well as application of alternative data..."
Clinical Data Analyst-Clinical Quality and Effectiveness,NYU Langone Health,"New York, NY",,We have an exciting opportunity to join our team as a Clinical Data Analyst-Clinical Data Analyst-Clinical Quality and Effectiveness....
Strategic Data Scientist (Manager),AIG,"New York, NY",,We are looking for top-notch Strategic Data Scientists to join our team and be the creative force for the next wave of dramatic performance improvement and...
MQA – Algorithmic Quantitative Developer/Analyst - VP,Citi,"New York, NY",,"Perform analysis of large data sets comprising of market data, orders, executions and derived analytics. Experience applying statistical modelling and machine..."
Research Staff Assistant,Columbia University,"New York, NY",,"Other duties as assigned by the PI, including imaging and analysis of data. Zuckerman Mind Brain Behavior Institute (Zuckerman Institute) supports..."
"Head of Data Science, Demand Generation & Marketing",Getty Images,"New York, NY",,Building and developing a highly capable team of data scientists. Our data driven modern marketing team is looking for a Head of Data Science and Insight to...
Data Scientist,CELONIS SE,"New York, NY",,"You are excited about Big Data, Data Mining and Process Mining. Data Scientists run the newest proof-of-concept projects and fill our software with the real..."
Loyalty - Research Analyst (Entry-Level),Ipsos North America,"Parsippany, NJ",,"Find new spins on data visualization, attend and learn at the presentation stage. The ideal candidate is a business-minded individual who is interested in and..."
"Data Scientist, Business Intelligence & Data Science","Starz Entertainment, LLC","New York, NY","Estimated salary: $127,000 - $162,000 a year","Drive requirements for 3rd party data acquisition, customer data platform expansion, and customer data platform...."
"Scientist, In Vitro Biology",Wuxi AppTec,"Plainsboro, NJ",,Ability to learn instrument and data analysis software. We are seeking skilled and motivated scientists with substantial experience in assay development for...
Marketing Research Analyst,Weichert New Homes Co,"Morris Plains, NJ","Estimated salary: $43,000 - $54,000 a year","Responds to all requests for data and information. Understands and practices various statistical concepts, research data, standards, and practices...."
Data Platform Engineer,Quartet,"New York, NY 10018 (Clinton area)",,"You are passionate about data and will collaborate with and learn from other engineers, data scientists, and clinicians...."
Data Engineer - Analytics Platform,Grubhub,"New York, NY",,Collaborate with data scientists to design and develop processes to further business unit and company-wide data science initiatives on a common data platform....
Optical Systems Research Scientist,Vencore,"Red Bank, NJ",,"Vencore Labs is currently seeking a Research Scientist to work with our optical systems research group. From smart grid to smart phones, intelligent highways to..."
Senior Model Implementation Analyst,AIG,"New York, NY",,Creating and maintaining SAS processes to support reporting as a service to stakeholders Automating data pipelines from multiple sources in order to run...
Project Environmental Scientist,Mott MacDonald,"Iselin, NJ",,"Utilizes experienced judgment to research and analyze data. Provides basic mentoring, reference, oversight, and supervision for less-experienced geologists and..."
Scientist III,Ortho Clinical Diagnostics,"Raritan, NJ 08869",,Performs data reviews and release inspection lots in SAP. Make independent decisions regarding the design and execution of experiments and protocols and the...
"Research Scientist, Machine Learning (PhD University Grad)",Facebook,"New York, NY",,"Research and/or work experience in machine learning, NLP, recommendation systems, pattern recognition, signal processing, data mining, artificial intelligence,..."
Digital Intelligence - Data Engineer,JP Morgan Chase,"New York, NY 10001 (Chelsea area)",,"They feel comfortable working with a diverse team of data scientists, product managers and business partners...."
Healthcare Analytics Director,Essence Group Holdings Corporation,"New York, NY",,Healthcare Data Expertise :. 4)Partner with our biostatisticians and data scientists to perform the analyses and displays....
Associate Research Scientist,Columbia University,"New York, NY",,The candidate will also employ advanced statistical approaches for data analysis. The successful candidate will also have experience working closely with...
Computer Vision Engineer,Bowery Farming,"New York, NY",,This role will help lead a team of data scientists and help shape the how machine learning and computer vision are used by modern farmers....
Principal Data Management & Quantitative Analysis,BNY Mellon,"New York, NY",,"Oversees the development of statistical, financial and/or econometric models for analyzing asset performance, client reference data, securities data, derivative..."
Senior Scientist - Biochemical Characterization,"Oncobiologics, Inc.","Cranbury, NJ",,"This includes generating, documenting, and analyzing data for team and senior management discussions and development reports...."
Associate Scientist I,Wuxi AppTec,"Plainsboro, NJ",,"Prepare accurate data summary with minimal supervision. XBL is seeking an Associate Scientist I located in Plainsboro, NJ...."
"Senior Scientist, Biophysical Characterization","Oncobiologics, Inc.","Cranbury, NJ",,Provide training to scientists. Support the continuous improvement of data quality systems required for the stability testing and filing....
Cell Line Development Scientist,Eurofins Lancaster Laboratories Professional Scien...,"Kenilworth, NJ",,"Cell Line Development Scientist responsibilities include, but are not limited to, the following:. Eurofins Lancaster Laboratories PSS is searching for a Cell..."
Sponsored Research Engineer - Davidson,Stevens Institute of Technology,"Hoboken, NJ 07030",,The researcher will be responsible for working with other scientists and graduate students to accomplish this work and to prepare findings for publication(s) in...
