position,company,location,salary,summary
Property Administrator I (662235),Ball Aerospace,"Westminster, CO",,"Our team of more than 3,000 engineers, scientists, technicians and support staff drives all the achievements at Ball Aerospace...."
Postdoctoral Scientist,University of Colorado,"Aurora, CO",,"Patch-clamp electrophysiology data acquisition and analysis. Creative, independent and motivated Postdoctoral Scientist sought to lead a collaborative NIH..."
"D10/13-Boulder, CO. Temporary Field Technician",National Ecological Observatory Network Inc,"Boulder, CO","Estimated salary: $36,000 - $46,000 a year","Records data from sample collection; A 30+ year project dedicated to understanding how changes in climate, land use and invasive species impact ecology, the..."
Data Scientist - Clinical Strategy,Catholic Health Initiatives - National Office,"Englewood, CO",,Contributes to the development of data governance standards. Works with Clinical Decision Teams to discuss data outputs....
Technician II-Production Test (661027),Ball Aerospace,"Westminster, CO",,"Will collect and analyze computer data and make data based decisions. Monitor, analyze, reduce and record data;..."
RF Range Technician II (662041),Ball Aerospace,"Westminster, CO",,"Monitor, analyze, reduce and record data; Process and plot required Range data files as defined. Our team of more than 3,000 engineers, scientists, technicians..."
Range Technician II (661517),Ball Aerospace,"Westminster, CO",,"Monitor, analyze, reduce and record data; Process and plot required Range data files as defined. Our team of more than 3,000 engineers, scientists, technicians..."
Prospect Research and Data Analyst,Nurse Family Partnership,"Denver, CO 80203 (Capitol Hill area)",,"This position will ensure that frontline fundraisers on our regional, institutional, and individual giving teams have the data and information that they need to..."
Roofing & Waterproofing Consultant - Denver,"Wiss, Janney, Elstner Associates","Denver, CO",,"Ability to record data clearly and write passages for reports, letters, etc. Wiss, Janney, Elstner Associates is a global firm of engineers, architects, and..."
Lead Data Scientist,DISH Network,"Englewood, CO",,A successful Data Scientist will have the following:. Experience using streaming data processing techniques is a plus Bachelor's degree from four-year college...
Technical Intern-Quality Assurance (661402),Ball Aerospace,"Boulder, CO",,"Our team of more than 3,000 engineers, scientists, technicians and support staff drives all the achievements at Ball Aerospace...."
Clinical Laboratory Scientist I,National Jewish Health,"Denver, CO 80206 (Central East Denver area)",,"Performs error correction, photocopy and data entry and compilation as required. Collects and organizes data before initiating analysis and asks questions to..."
IT Infrastructure Administrator III,National Ecological Observatory Network Inc,"Boulder, CO",,"A 30+ year project dedicated to understanding how changes in climate, land use and invasive species impact ecology, the observatorys scientists and engineers..."
Mission Analysis Manager-Advanced Technologies & Missions (662204),Ball Aerospace,"Broomfield, CO",,"Our team of more than 3,000 engineers, scientists, technicians and support staff drives all the achievements at Ball Aerospace...."
Clinical Laboratory Scientist Lead,National Jewish Health,"Denver, CO 80206 (Central East Denver area)",,"And preparing patient data for reporting. Compiles customized data for clients/studies as directed. For studies, may work on data compilation and writing..."
Engineer IV – DoD Initiatives,National Renewable Energy Laboratory,"Golden, CO",,Perform site assessments and data collection for the creation of electrical drawings and models. Implement and manage project control systems and metrics and...
"Software Engineer, VIPER",Comcast,"Denver, CO 80202 (Lodo area)",,"Software architects, network engineers, big data scientists, player developers, content security specialists, and various streaming video technologists...."
Technician III - Assembly (661312),Ball Aerospace,"Westminster, CO",,"Apply solid computer skills to access & input data via computer interface or automated equipment. Our team of more than 3,000 engineers, scientists, technicians..."
Director - ITS Infrastructure and Operations (662016),Ball Aerospace,"Lafayette, CO",,"Create a data driven operations culture. Establishing data driven operations monitoring and response. Manage the data center design, technology implementation,..."
"Project Manager, NEON Operations",Battelle,"Boulder, CO 80301",,Establishes strategies for using cost and schedule performance data analysis in making project decisions to ensure timely and cost-effective delivery of...
Airborne Sensor Operations Technician,National Ecological Observatory Network Inc,"Boulder, CO",,"Manage, evaluate and analyze multi-source data (e.g., QA/QC, configure, backup raw data sets) and dispatch output to data processing facility...."
Subcontract Lead (661155),Ball Aerospace,"Boulder, CO",,"Our team of more than 3,000 engineers, scientists, technicians and support staff drives all the achievements at Ball Aerospace...."
Technician III-Environmental Stress Screening (661970),Ball Aerospace,"Westminster, CO",,"Monitor, analyze, reduce, and record data. Our team of more than 3,000 engineers, scientists, technicians and support staff drives all the achievements at Ball..."
"Manager, Data Scientist",KPMG,"Denver, CO 80202 (Lodo area)",,"Retrieve, process and prepare a rich data variety of data sources such as social media, news, internal/external documents, emails, financial data, and..."
Technician I - Test Operations (661603),Ball Aerospace,"Boulder, CO",,Will collect and analyze computer data. Assimilate diverse data and recommend action to address unique and complex technical situations....
Program Manager I (662315),Ball Aerospace,"Broomfield, CO",,"Our team of more than 3,000 engineers, scientists, technicians and support staff drives all the achievements at Ball Aerospace...."
RF Technician II or III,UCAR,"Boulder, CO",,"EOL deploys its systems for research by scientists from universities, NCAR, and government agencies, as well as for education...."
Global VP (Semiconductor Business),TransReach,"Golden, CO",,"Drives, and supports with data, internal decision making on long term growth investments including capital equipment and R&D programs...."
Project Manager I - ND Operations (662051),Ball Aerospace,"Broomfield, CO",,"Our team of more than 3,000 engineers, scientists, technicians and support staff drives all the achievements at Ball Aerospace...."
Technician I-Cleanroom Operations (662219),Ball Aerospace,"Boulder, CO",,"Our team of more than 3,000 engineers, scientists, technicians and support staff drives all the achievements at Ball Aerospace...."
Field Geologist,Terracon,"Longmont, CO",,"Interpret soil, bedrock and groundwater elevation and quality data. Performs site visits, field observations and field data collection or assignments...."
Ground Systems Development Lead (662089),Ball Aerospace,"Boulder, CO",,"Recommend integrated ground system architecture solutions for satellite command and control, data transportation, and mission data processing...."
"D10/13-Boulder, CO. Lead Temporary Field Technician",National Ecological Observatory Network Inc,"Boulder, CO",,"Records data from sample collection; A 30+ year project dedicated to understanding how changes in climate, land use and invasive species impact ecology, the..."
Sr. Metrology Technician,National Ecological Observatory Network Inc,"Boulder, CO",,"A 30+ year project dedicated to understanding how changes in climate, land use and invasive species impact ecology, the observatorys scientists and engineers..."
"Senior Associate, Data Scientist",KPMG,"Denver, CO 80202 (Lodo area)",,"Retrieve, process and prepare a rich data variety of data sources such as social media, news, internal/external documents, emails, financial data, and..."
NEON Observatory Director/Chief Scientist,Battelle,"Boulder, CO 80301",,"The NEON Observatory Director/Chief Scientist leads a multi-disciplinary scientific and technical staff to provide highly reliable data, infrastructure, and..."
Principal Engineer-Vibration (662322),Ball Aerospace,"Boulder, CO",,"Our team of more than 3,000 engineers, scientists, technicians and support staff drives all the achievements at Ball Aerospace...."
Principal Engineer - Radiation Effects (662257),Ball Aerospace,"Boulder, CO",,"Our team of more than 3,000 engineers, scientists, technicians and support staff drives all the achievements at Ball Aerospace...."
Principal Optical Engineer (662137),Ball Aerospace,"Boulder, CO",,"Our team of more than 3,000 engineers, scientists, technicians and support staff drives all the achievements at Ball Aerospace...."
"Manager, Data Analytics",KPMG,"Denver, CO 80202 (Lodo area)",,"Lead the design and development of tools and solutions working with data scientists, data integration teams and visualization experts to deliver analysis that..."
Project Controls Senior Analyst – Tools & Training Group (661856),Ball Aerospace,"Lafayette, CO",,"Our team of more than 3,000 engineers, scientists, technicians and support staff drives all the achievements at Ball Aerospace...."
Program Manager II - Tactical Solutions Programs (662034),Ball Aerospace,"Westminster, CO",,"Our team of more than 3,000 engineers, scientists, technicians and support staff drives all the achievements at Ball Aerospace...."
Staff Consultant - Optical (661858),Ball Aerospace,"Boulder, CO",,"Our team of more than 3,000 engineers, scientists, technicians and support staff drives all the achievements at Ball Aerospace...."
Senior Talent Acquisition Manager - Aerospace Division (659637),Ball Aerospace,"Broomfield, CO",,"Our team of more than 3,000 engineers, scientists, technicians and support staff drives all the achievements at Ball Aerospace...."
Telecom System Principal Engineer (662275),Ball Aerospace,"Boulder, CO",,"Applicable data rates. Our team of more than 3,000 engineers, scientists, technicians and support staff drives all the achievements at Ball Aerospace...."
Propulsion System Principal Engineer (661360),Ball Aerospace,"Boulder, CO",,"Our team of more than 3,000 engineers, scientists, technicians and support staff drives all the achievements at Ball Aerospace...."
Principal Manufacturing Planner (661657),Ball Aerospace,"Boulder, CO",,"Our team of more than 3,000 engineers, scientists, technicians and support staff drives all the achievements at Ball Aerospace...."
Technician II-Test (661960),Ball Aerospace,"Boulder, CO",,Ability to learn and execute basic computer skills such as data entry and data query. Measure/record test data and recognize/report out of tolerance conditions....
Technician II-Production (659893),Ball Aerospace,"Boulder, CO",,"Our team of more than 3,000 engineers, scientists, technicians and support staff drives all the achievements at Ball Aerospace...."
Postdoctoral Fellow,University of Colorado,"Aurora, CO",,"Lead and organize data acquisition and analysis. The Proenza lab in the Department of Physiology and Biophysics and the Department of Medicine, Division of..."
Data Scientist,Allegiance Consulting,"Denver, CO",,Our client is looking for several Data Scientists for a minimum 6-month project in South Denver. Adept at Data Wrangling /Data Munging....
"Senior Food Scientist, Product Development Innovation",Dean Foods,"Broomfield, CO 80021",,Strategic and tactical decision-making ability using sound scientific principles and data analytics. As a team member of the largest dairy company in the U.S....
Accountant I-Financial Accounting (662094),Ball Aerospace,"Lafayette, CO",,"Our team of more than 3,000 engineers, scientists, technicians and support staff drives all the achievements at Ball Aerospace...."
Multi-Layer Insulation Technician (662246),Ball Aerospace,"Boulder, CO",,"Must be able to organize and document various data inputs. Our team of more than 3,000 engineers, scientists, technicians and support staff drives all the..."
Sr. Copy Writer,Aetna,"Denver, CO",,Collaborate with our UX researchers and data scientists to understand user behaviors and uncover new opportunities for engagement....
Technician II-Materials & Processes Development Lab (662101),Ball Aerospace,"Boulder, CO",,"Monitor, analyze, reduce, and record data. Our team of more than 3,000 engineers, scientists, technicians and support staff drives all the achievements at Ball..."
Ground Systems Development Lead (661993) - Security clearance required,Ball Aerospace,"Boulder, CO",,"Recommend integrated ground system architecture solutions for satellite command and control, data transportation, and mission data processing...."
Principal Engineer - Electronics Manufacturing (661523),Ball Aerospace,"Boulder, CO",,"Our team of more than 3,000 engineers, scientists, technicians and support staff drives all the achievements at Ball Aerospace...."
Mechanical Assembly Technician (661622),Ball Aerospace,"Boulder, CO",,"Our team of more than 3,000 engineers, scientists, technicians and support staff drives all the achievements at Ball Aerospace...."
"Senior Software Engineer, Video Insights and Analysis",Comcast,"Denver, CO 80202 (Lodo area)",,Partner with data scientists to productionize machine learning algorithms. Excited about data visualization and telling a story with data....
Senior Scientist - Process Development #354,KBI Biopharma,"Boulder, CO",,"Scientist will interact with internal and external client teams on Upstream study design, scope, data reporting and analysis...."
Senior Scientist - Process Development,KBI Biopharma,"Boulder, CO",,Prepares documents using own and others’ data; Conceptualizes and proposes development and testing strategies based on experimental data....
Talent Acquisition Specialist I - Sourcer (662205) (CWN),Ball Aerospace,"Broomfield, CO",,"Our team of more than 3,000 engineers, scientists, technicians and support staff drives all the achievements at Ball Aerospace...."
Program Security Officer I (661641) - Security clearance required,Ball Aerospace,"Westminster, CO",,"Our team of more than 3,000 engineers, scientists, technicians and support staff drives all the achievements at Ball Aerospace...."
Staff Consultant - Space Systems (661999),Ball Aerospace,"Boulder, CO",,"Our team of more than 3,000 engineers, scientists, technicians and support staff drives all the achievements at Ball Aerospace...."
Embedded Software Engineer II - LabVIEW (661956),Ball Aerospace,"Boulder, CO",,"Our team of more than 3,000 engineers, scientists, technicians and support staff drives all the achievements at Ball Aerospace...."
Principal PWB Designer (661901),Ball Aerospace,"Boulder, CO",,"Our team of more than 3,000 engineers, scientists, technicians and support staff drives all the achievements at Ball Aerospace...."
Web Applications Developer Intern (661822),Ball Aerospace,"Lafayette, CO",,"Oracle databases, primarily accessing data through ADO.Net or EF. Primary UI developed to display data within grids with searching capabilities, along with..."
"Director, Data Scientist",KPMG,"Denver, CO 80202 (Lodo area)",,"Retrieve, prepare, and process a rich data variety of data sources such as social media, news, internal/external documents, emails, financial data, and..."
Predictive Modeling Analyst,Vencore,"Aurora, CO",,"Ability to analyze multiple data sets and to present cohesive analysis findings. Vencore is a proven provider of information solutions, engineering and..."
Technician I-Electronic Design Development (659798),Ball Aerospace,"Boulder, CO",,"Our team of more than 3,000 engineers, scientists, technicians and support staff drives all the achievements at Ball Aerospace...."
D2V Scholar,University of Colorado,"Aurora, CO",,"Additionally, scholars will have theopportunity to engage in existing CU programs, providing unique experiences in scientific research areas including..."
Data Scientist - Media,Spectrum,"Greenwood Village, CO",,"TWCBDA347 Data Scientist Exempt. Passionate about data maintenance, data quality control and all other important data analysis techniques...."
Operations Research Systems Analyst,Leidos,"Englewood, CO 80111",,Description: Job Summary: Leidos has a opening for a Operations Research Analyst in Englewood Colorado . Candidate will conduct operations research on...
Enterprise Solutions Architect II: Classified IT Infrastructure (660993),Ball Aerospace,"Lafayette, CO",,"Our team of more than 3,000 engineers, scientists, technicians and support staff drives all the achievements at Ball Aerospace...."
Electro-Optical and Infrared Advanced Systems Manager (661374),Ball Aerospace,"Broomfield, CO",,"Our team of more than 3,000 engineers, scientists, technicians and support staff drives all the achievements at Ball Aerospace...."
Geotechnical Engineer - Denver,"Wiss, Janney, Elstner Associates","Denver, CO",,"Ability to record data clearly and write reports, letters, etc. Analyzes research and investigation data and develops alternate schemes for solving problems...."
Principal Optical Engineer (659180) - Current Clearance Required,Ball Aerospace,"Boulder, CO",,"Our team of more than 3,000 engineers, scientists, technicians and support staff drives all the achievements at Ball Aerospace...."
Senior Software Engineer,Association of Universities for Research in Astron...,"Boulder, CO",,"With the DKIST Operations Scientist and Data Center Project Manager, elaborate & refine the scientific and operational goals and development roadmap of the..."
Optical Technician III (661854),Ball Aerospace,"Boulder, CO",,"Make measurements and analyze data using basic math skills. Our team of more than 3,000 engineers, scientists, technicians and support staff drives all the..."
Engineering Manager II (662303),Ball Aerospace,"Boulder, CO",,"Our team of more than 3,000 engineers, scientists, technicians and support staff drives all the achievements at Ball Aerospace...."
Sr. Asset Management Consultant,HDR,"Denver, CO 80202 (Lodo area)",,"We create an unshakable foundation for progress because our multidisciplinary teams also include scientists, economists, builders, analysts and artists...."
"Senior Manager, Laboratory & Analytical Services","WhiteWave Foods, Inc.","Louisville, CO",,"Ability to do simple math calculations, input data into a computer and analyze data is required. (3) Quality Scientists (1) Lab Supervisor...."
Technician IV - Radio Frequency (662158),Ball Aerospace,"Westminster, CO",,"Make decisions about designs and test configurations based on interpretation of test data. Our team of more than 3,000 engineers, scientists, technicians and..."
Range Engineer I (662148),Ball Aerospace,"Westminster, CO",,"Our team of more than 3,000 engineers, scientists, technicians and support staff drives all the achievements at Ball Aerospace...."
Phased Array Engineer I (661949),Ball Aerospace,"Westminster, CO",,"Our team of more than 3,000 engineers, scientists, technicians and support staff drives all the achievements at Ball Aerospace...."
Engineer I-Materials & Processes (661919),Ball Aerospace,"Westminster, CO",,"Our team of more than 3,000 engineers, scientists, technicians and support staff drives all the achievements at Ball Aerospace...."
Structural Engineer I (661894),Ball Aerospace,"Westminster, CO",,"Our team of more than 3,000 engineers, scientists, technicians and support staff drives all the achievements at Ball Aerospace...."
Senior Engineer - Command and Data Handling / Avionics (661976),Ball Aerospace,"Boulder, CO",,"Senior Engineer - Command and Data Handling / Avionics. Our team of more than 3,000 engineers, scientists, technicians and support staff drives all the..."
Analog/Digital Engineer I (662280),Ball Aerospace,"Westminster, CO",,"Our team of more than 3,000 engineers, scientists, technicians and support staff drives all the achievements at Ball Aerospace...."
Principal Antenna (Low Observable) Design Engineer (662108),Ball Aerospace,"Westminster, CO",,"Our team of more than 3,000 engineers, scientists, technicians and support staff drives all the achievements at Ball Aerospace...."
Associate Analog/Digital Design Engineer (662357),Ball Aerospace,"Boulder, CO",,"Our team of more than 3,000 engineers, scientists, technicians and support staff drives all the achievements at Ball Aerospace...."
Analog/Digital Design Engineer-Associate (661841),Ball Aerospace,"Boulder, CO",,"Our team of more than 3,000 engineers, scientists, technicians and support staff drives all the achievements at Ball Aerospace...."
Phased Array Engineer I (661949),Ball Aerospace,"Westminster, CO",,"Our team of more than 3,000 engineers, scientists, technicians and support staff drives all the achievements at Ball Aerospace...."
Engineer I-Materials & Processes (661919),Ball Aerospace,"Westminster, CO",,"Our team of more than 3,000 engineers, scientists, technicians and support staff drives all the achievements at Ball Aerospace...."
Structural Engineer I (661894),Ball Aerospace,"Westminster, CO",,"Our team of more than 3,000 engineers, scientists, technicians and support staff drives all the achievements at Ball Aerospace...."
Receiving Inspector II-Procured Inspection (662310),Ball Aerospace,"Boulder, CO",,"Our team of more than 3,000 engineers, scientists, technicians and support staff drives all the achievements at Ball Aerospace...."
Technician III - Mechanical (661784),Ball Aerospace,"Boulder, CO",,"Our team of more than 3,000 engineers, scientists, technicians and support staff drives all the achievements at Ball Aerospace...."
Analog/Digital Engineer I (662280),Ball Aerospace,"Westminster, CO",,"Our team of more than 3,000 engineers, scientists, technicians and support staff drives all the achievements at Ball Aerospace...."
Sr. Business Intelligence Project Manager,Chipotle Mexican Grill,"Denver, CO 80202 (Lodo area)",,"Manage portfolio of BI projects, leading a team of data engineers, data architect, data analysts, data scientists, business owners and subject matter experts..."
Principal Antenna (Low Observable) Design Engineer (662108),Ball Aerospace,"Westminster, CO",,"Our team of more than 3,000 engineers, scientists, technicians and support staff drives all the achievements at Ball Aerospace...."
Technical Aide - Manufacturing Fall 2017 (661479),Ball Aerospace,"Boulder, CO",,"Strong competency in MS basic office skills, plus advanced MS Excel skills (meta data organization, data query, Visual Basic Macros)...."
Administrator II - ND Operations (662028),Ball Aerospace,"Broomfield, CO",,"Our team of more than 3,000 engineers, scientists, technicians and support staff drives all the achievements at Ball Aerospace...."
Talent Acquisition Specialist III (662136),Ball Aerospace,"Broomfield, CO",,"Our team of more than 3,000 engineers, scientists, technicians and support staff drives all the achievements at Ball Aerospace...."
Scientist I/II/Sr - Clinical Research 2017-161,"SomaLogic, Inc.","Boulder, CO 80301",,Helps to create knowledge from the data:. This Scientist will also support prospective clinical studies. This position will collaborate with our investigators...
Scientist I/II/Sr - Clinical Research,"Somalogic, Inc.","Boulder, CO 80301",,Helps to create knowledge from the data:. This Scientist will also support prospective clinical studies. This position will collaborate with our investigators...
CdTe Thin-Film Materials Processing Engineer,National Renewable Energy Laboratory,"Golden, CO",,Performing work reproducibly with high degree of quality and reliability Recording data in computer databases ....
"Scientist, Bioanalytical Chemistry","Miragen Therapeutics, Inc.","Boulder, CO 80301",,"Strong qualitative and quantitative data analysis and interpretation skills. We currently seek an industry experienced Bioanalytical Chemist to develop,..."
Air Quality Field Engineer or Scientist (Denver),ERM,"Denver, CO",,"ERM is seeking a hands-on Air Quality Field Engineer or Scientist looking for a career opportunity based out of our Denver, Colorado office...."
Manufacturing Planner (661653),Ball Aerospace,"Boulder, CO",,"Our team of more than 3,000 engineers, scientists, technicians and support staff drives all the achievements at Ball Aerospace...."
Associate Scientist - Product Development,Leprino Foods,"Denver, CO 80211 (Highland area)",,"Run Design of Experiment (DOE), collect, process and analyzes data using software; The Associate Product Development Scientist will manage internal and external..."
Manufacturing Shops & Service Center Technician II - 2nd Shift (660813),Ball Aerospace,"Westminster, CO",,"Must be able to organize and document various data inputs. Our team of more than 3,000 engineers, scientists, technicians and support staff drives all the..."
Associate Embedded Software Engineer (662253),Ball Aerospace,"Boulder, CO",,"Our team of more than 3,000 engineers, scientists, technicians and support staff drives all the achievements at Ball Aerospace...."
STEM Manager,Goodwill Industries of Denver,"Denver, CO",,Monitors the quality of the data submitted through participation in monthly audits of their data with the Program Monitoring and Evaluation (PME) department....
Human Resources Business Partner (662030),Ball Aerospace,"Boulder, CO",,"Our team of more than 3,000 engineers, scientists, technicians and support staff drives all the achievements at Ball Aerospace...."
Global Commercial Senior Director Automotive,TransReach,"Golden, CO",,"Drives, and supports with data, internal decision making on long term growth investments including capital equipment and R&D programs...."
Electronic Technician IV (661331),Ball Aerospace,"Boulder, CO",,"Our team of more than 3,000 engineers, scientists, technicians and support staff drives all the achievements at Ball Aerospace...."
