position,company,location,salary,summary
Machine Learning Data Analyst,Cognizant,"Denver, CO",,"Experience in various statistical and machine learning models, data mining, unstructured data analytics in corporate or academic research environments...."
Data Engineer,IMM,"Boulder, CO",,"Data pipeline/workflow management. You will work closely with our solutions architect, data scientists, and analysts to help build out our data aggregation and..."
Data Science Researcher,National Renewable Energy Laboratory,"Golden, CO",,"Design, implement, and document data workflows. Integrating multiple data sources, models, and software tools with scientific and engineering workflows for..."
"Faculty Positions in Data Science, Machine Learning, and Security",University of Colorado,"Boulder, CO",,"This is an interdisciplinary search in data science, machine learning, and security, conducted by the Departments of Computer Science, Electrical, Computer and..."
Data Engineer I,"UNAVCO, Inc.","Boulder, CO",,"The Data Engineer will also play an active role in the development of new data access and processing tools and interfaces, providing expertise on data and end..."
Sr. Data Engineer,"Pandora Media, Inc.","Boulder, CO",,"Experience collaborating with data scientists, exposure to machine learning algorithms and/or statistical modeling methods...."
"Research Analyst - Navigant Research - Energy- Boulder, CO",Navigant,"Boulder, CO",,Regularly uses close visual acuity and operates computer equipment to prepare and analyze and transmit data....
Principal Engineer - Machine Learning,Medtronic,"Boulder, CO",,ESSENTIAL DUTIES AND RESPONSIBILITIES: The principal development engineer in Technology Explorations role is responsible for the application of technology to...
High Dimensional Data Analysis,University of Colorado,"Boulder, CO",,"The position is in the area of high dimensional data analysis (big data), with possible areas of emphasis including nonlinear optimization, analysis in high..."
Research Associate,University of Colorado,"Boulder, CO",,And the ability to effectively interact with other scientists and students. Applicants must complete the Faculty/University Staff and EEO Data (application)...
2018 SOARS Internship Program,UCAR,"Boulder, CO",,Ability to analyze data and draw conclusions. Participates in technical and career seminars with peers and scientists....
Sr. Data Scientist,BP,"Denver, CO",,"The data and analytics organization are teams of highly experienced data scientists, data engineers, data management and quality experts, reporting and..."
Lead Data Scientist,BP,"Denver, CO",,"The data and analytics organization are teams of highly experienced data scientists, data engineers, data management and quality experts, reporting and..."
Data Engineer,Return Path,"Broomfield, CO 80021","Estimated salary: $86,000 - $109,000 a year","As a Data Engineer, you will collaborate with fellow engineers, data scientists and data analysts to support their needs and the needs of the business...."
Geodesist (Gravity Scientist) ZP-1372-04 (DE/CR),Department of Commerce,"Boulder, CO","$92,969 - $142,821 a year","Geodesist (Gravity Scientist), ZP-1372-04. Collect and process terrestrial and airborne gravity data. Ability to collect high quality terrestrial and airborne..."
Professional Research Asst,University of Colorado,"Boulder, CO",,Experience with modern particle detectors and data analysis techniques. Research Scientist Position on CMS at the University of Colorado Boulder....
2018 Unidata Summer Internship,UCAR,"Boulder, CO",,"Work to enhance Unidata scientific data access and distribution software products, e.g., THREDDS Data Server (TDS) and netCDF...."
Habitat Team Spring Intern,Environmental Defense Fund,"Boulder, CO 80302",$14.28 an hour,"Help design, and input data methodically in a Google spreadsheet. Work closely with staff scientists shape the research questions and analysis for this project...."
Postdoctoral Researcher – Data Science and Machine Learning,National Renewable Energy Laboratory,"Golden, CO",,"Experience monitoring, mining, synthesizing from and analyzing multiple sources of digital and/or event-based data, such as network traffic and IoT data, is a..."
Animal Care Tech I,University of Colorado,"Boulder, CO","$28,000 - $29,000 a year",Experience entering and manipulating data in a database. You will also provide routine and specialized care for a variety of species of small laboratory animals...
"Associate, Data Scientist",KPMG,"Denver, CO 80202 (Lodo area)",,"Retrieve, process and prepare a rich data variety of data sources such as social media, news, internal/external documents, emails, financial data, and..."
Computer Scientist (DHA),Department of Commerce,"Boulder, CO","$65,228 - $101,641 a year",Computer Research Scientists. Computer And Information Research Scientists. This vacancy may be used to fill other Computer Scientist positions at the Institute...
Software Development Engineer - Machine Learning,Conga,"Broomfield, CO 80021",,Knowledge of industry standards and trends in big data and machine learning. Bachelor’s Degree in Computer Science or equivalent experience and 3+ years of...
Research Analyst,Denver Investments,"Denver, CO",,"Perform data collection, industry research, analysis, and report conclusions to aid in the investment decision-making process...."
RESEARCH ANALYST,Kroenke Sports & Entertainment,"Denver, CO",,Ability to conduct in-depth data analysis. Ability to work with large data sets. Seeks ways to automate reporting for recurring data analysis....
Office Assistant,National Ecological Observatory Network Inc,"Boulder, CO",,"A 30+ year project dedicated to understanding how changes in climate, land use and invasive species impact ecology, the observatorys scientists and engineers..."
Postdoctoral: Vehicle Data Analysis Engineer,National Renewable Energy Laboratory,"Golden, CO",,"Solid engineering and technical capabilities in experimental design, on-board data acquisition, data mining and data analysis. Vehicle Data Analysis:...."
Measurement Science,"Muse Biotechnology, Inc.","Boulder, CO",,Support process development by interpreting data and providing guidance for process optimization. We are looking for a highly talented Scientist to be a key...
Cell Biology & Translational Medicine Scientist,Array BioPharma,"Boulder, CO 80301",,"Plans, designs and initiates studies, and analyzes the data. Generates in-vitro data that support investigational new drug filings for product candidates...."
Senior Data Scientist,Layer3 TV,"Denver, CO",,Layer3 TV is seeking a data scientist with exceptional technical aptitude and the ability to draw insights from data....
Engineer I - Data Strategist (662144),Ball Aerospace,"Broomfield, CO",,"Technical data sourcing, management, and analysis. Open source data sourcing, management, and analysis. Our team of more than 3,000 engineers, scientists,..."
Science Writer/Media Relations Professional,University of Colorado,"Boulder, CO",,"And data visualization. Identify stories of wide public interest for news packaging by meeting with campus scientists to discuss latest research efforts, and..."
Sr. Research Associate/Research Scientist/Scientist I - Bioinformatics,"Somalogic, Inc.","Boulder, CO 80301",,Experience analyzing “wide” data sets (more covariates than observations). Experience working with large data sets in a Health Science or Clinical field....
"Analyst, Research",JLL,"Denver, CO",,"Passion for technology, analytics, and data visualization tools. This team member will enhance our offerings in the areas of business intelligence, data..."
Business Intelligence Intern (661821),Ball Aerospace,"Lafayette, CO",,"Collect, integrate, analyze and visualize data using a variety of data analytics and visualization tools. Increasingly businesses understand that one of their..."
Sr. Data Scientist/Data Integration,BP,"Denver, CO",,"The data and analytics organization are teams of highly experienced data scientists, data engineers, data management and quality experts, reporting and..."
Knowledge Management Analyst,National Ecological Observatory Network Inc,"Boulder, CO",,"A 30+ year project dedicated to understanding how changes in climate, land use and invasive species impact ecology, the observatorys scientists and engineers..."
Environmental Technician/Entry Level Scientist,GHD,"Golden, CO",,"Environmental Technician/Entry Level Scientist - GOL00101. Perform sampling, site inspections and other data collection...."
Material Control Analyst I (662024),Ball Aerospace,"Boulder, CO",,"Our team of more than 3,000 engineers, scientists, technicians and support staff drives all the achievements at Ball Aerospace...."
Scientist I/II - Bioinformatics 2017-166,"SomaLogic, Inc.","Boulder, CO 80301",,Experience analyzing “wide” data sets (more covariates than observations). Experience working with large data sets in a Health Science or Clinical field....
Data Scientist Snr Manager,Oracle,"Broomfield, CO",,Data Scientist Snr Manager-1700142B. 3+ years in leadership/management of data science/analytic team. Create processes to calibrate any external data with...
Scientist I/II - Bioinformatics 2017-166,"SomaLogic, Inc.","Boulder, CO 80301",,Experience analyzing “wide” data sets (more covariates than observations). Experience working with large data sets in a Health Science or Clinical field....
Scientist I/II - Bioinformatics,"Somalogic, Inc.","Boulder, CO 80301",,Experience analyzing “wide” data sets (more covariates than observations). Experience working with large data sets in a Health Science or Clinical field....
RESEARCH SCIENTIST - OUTER SOLAR SYSTEM,Southwest Research Institute,"Boulder, CO",,"Experience is data analysis of spacecraft data, IDL and other scientific coding languages, ice science (laboratory, in situ or remote), peer-reviewed journal..."
Analyst II-Project Controls (661697),Ball Aerospace,"Boulder, CO",,Compile and analyze Sales Forecast data and cost estimating data. Organize cost and/or schedule data for monthly/quarterly program reviews....
Sr. Office Assistant,National Ecological Observatory Network Inc,"Boulder, CO",,"Gather and research data to create reports as needed for designated teams. A 30+ year project dedicated to understanding how changes in climate, land use and..."
PostDoctoral Associate,University of Colorado,"Boulder, CO",,"Applicants must complete the Faculty/University Staff and EEO Data (application) form, and upload the following required documents:...."
US Head of Data Architecture and Analysis,Janus Henderson,"Denver, CO",,"Data feeds between the central data hub/warehouse and business applications or data marts. Architectural and data schema design in the data hub, warehouses and..."
Engineer I-Mission Systems Analyst (662223),Ball Aerospace,"Boulder, CO",,"Our team of more than 3,000 engineers, scientists, technicians and support staff drives all the achievements at Ball Aerospace...."
Planner I - Manufacturing (661476),Ball Aerospace,"Westminster, CO",,"Our team of more than 3,000 engineers, scientists, technicians and support staff drives all the achievements at Ball Aerospace...."
Competitive Research Analyst,Layer3 TV,"Denver, CO",,"Strong analytical skills, including ability to analyze large data sets, identify insights, and synthesize how insights impact business decisions...."
Production Control Center Scheduler (662358),Ball Aerospace,"Broomfield, CO",,"Collect and verify production data and calculate statistical data for use in reports. Check and post data to production logs, records, or reports...."
Embedded Software Engineer I (662365),Ball Aerospace,"Boulder, CO",,"Our team of more than 3,000 engineers, scientists, technicians and support staff drives all the achievements at Ball Aerospace...."
Security Data Science Director,Great-West,"Denver, CO",,Experience managing Data Scientists. Great-West Financial is looking for a high-energy Director of Data Science to help build out a centralized security...
Research Firmware Engineer,Honeywell,"Broomfield, CO 80021",,"Demonstrated understanding of centralized and distributed data storage, managing data access latency, and databases...."
Sr Deep Learning Software Engineer,NVIDIA,"Boulder, CO 80302",,"Artificial intelligence, the dream of computer scientists for over half a century, is no longer science fiction...."
2018 Graduate Student Internship-SIParCS Program Intern,UCAR,"Boulder, CO",,SIParCS students serve as paid interns at NCAR’s Computational & Information Systems Lab (CISL) that provides supercomputing and data services for scientists...
Business Intelligence Data Scientist,Chipotle Mexican Grill,"Denver, CO 80202 (Lodo area)",,Business Intelligence Data Scientist (17030694) Description Position Summary:. The Data Scientist will drive internal data analytics projects serving all areas...
Data Scientist IV,DCP Midstream,"Denver, CO",,"Understands data elements, data models and working with structured or unstructured data sets. Strong background in advanced statistical and data science..."
Principal Data Scientist - Audience Target Team,Oracle,"Broomfield, CO",,Principal Data Scientist - Audience Target Team-170017IX. Acting as a source of knowledge and mentorship for junior data scientists....
Software Engineer/Programmer II,UCAR,"Boulder, CO","$70,449 - $88,061 a year","And interacts with users, scientists and data providers to build user centered products. Integrates technology within complex data information systems;..."
Postdoctoral Researcher – Data-Driven Power System Analysis,National Renewable Energy Laboratory,"Golden, CO",,Stability analysis and prediction using synchrophasors Interconnection-wide and distribution level synchrophasor measurement data analytics Measurement-based...
Visualization Scientist,National Renewable Energy Laboratory,"Golden, CO",,"The Data, Analysis and Visualization group in NREL’s Computational Science Center has an immediate opening for a Computational Scientist to pursue a cross..."
"Professional, Geospatial Operations: Solutions Specialist",CoreLogic,"Boulder, CO 80301",,"Experience with large data sets. This position also collaborates with our scientists, data modelers, and analysts to perform complex spatial analysis along with..."
Financial Analyst,National Ecological Observatory Network Inc,"Boulder, CO",,"Reconcile transactions by comparing and correcting data. A 30+ year project dedicated to understanding how changes in climate, land use and invasive species..."
Administrative Associate III-Travel (662165),Ball Aerospace,"Lafayette, CO",,"Accounting skills for reconciliations, accruals and daily data analyses with a strong competence in Microsoft Office, especially Excel...."
"Intern, Marketing Operations & Data Analysis",Ping Identity,"Denver, CO 80202 (Lodo area)",,"At Ping Identity, we're changing the way people think about enterprise security technology. With our innovative Identity Defined Security platform, we're..."
Machinist Prototype-Wire EDM (662155) - 2nd Shift,Ball Aerospace,"Boulder, CO",,"Our team of more than 3,000 engineers, scientists, technicians and support staff drives all the achievements at Ball Aerospace...."
Machinist Prototype-CNC 2nd Shift (661604),Ball Aerospace,"Boulder, CO",,"Our team of more than 3,000 engineers, scientists, technicians and support staff drives all the achievements at Ball Aerospace...."
QC Inspector III - CMM & Procured Inspection (661026),Ball Aerospace,"Boulder, CO",,"Our team of more than 3,000 engineers, scientists, technicians and support staff drives all the achievements at Ball Aerospace...."
Machinist I (660885),Ball Aerospace,"Boulder, CO",,"Our team of more than 3,000 engineers, scientists, technicians and support staff drives all the achievements at Ball Aerospace...."
CdTe Thin-Film Materials Processing Technician,National Renewable Energy Laboratory,"Golden, CO",,Performing work reproducibly with high degree of quality and reliability Recording data in computer databases ....
Technical Systems Manager --Research & Innovation,DANONE,"Louisville, CO",,"Aptitude for training and collaborating with a wide variety of personalities including scientists, engineers, and business partners...."
"Administrative Intern-Environmental, Health & Safety (661485)",Ball Aerospace,"Boulder, CO",,"Provide health & safety-related statistical data to BATC employees, including management personnel, as required...."
Administrative Associate III (662029),Ball Aerospace,"Broomfield, CO",,"Gather and interpret data; Prepare various schedules and perform data entry, etc. Our team of more than 3,000 engineers, scientists, technicians and support..."
"Food Scientist, Product Development Innovation",Dean Foods,"Broomfield, CO 80021",,Tactical decision-making ability using sound scientific principles and data analytics. Job Description & Requirements....
Associate Optical Engineer - Spatial Metrology (662163),Ball Aerospace,"Boulder, CO",,"Experience with basic data analysis. Work with teams of engineers performing optical system development, integration, alignment, and data analysis...."
Artificial Intelligence Software Engineer,KPMG,"Denver, CO 80202 (Lodo area)",,"Design, develop and maintain artificial intelligence-enabled managed services (APIs) with a team of Data Scientist, Software Engineers and Project Managers...."
Production Control Expeditor (661737),Ball Aerospace,"Boulder, CO",,"Collect and verify production data for use in reports. Check and post data to production logs, records, or reports...."
Technical Writer Intern (661823),Ball Aerospace,"Boulder, CO",,"Our team of more than 3,000 engineers, scientists, technicians and support staff drives all the achievements at Ball Aerospace...."
Sr. Project Controls Analyst - Scheduling (662169),Ball Aerospace,"Boulder, CO",,"Recommend and maintain any additional historical data bases pertinent to assigned business unit. Our team of more than 3,000 engineers, scientists, technicians..."
Sr. Market Research Analyst,TSYS,"Broomfield, CO",,"Data visualization tools such as Tableau. Works independently to analyze marketing data, interpret it for brand impact and report to management on implications..."
Principal Contamination Control Analyst (660886),Ball Aerospace,"Boulder, CO",,"Hands-on experience with cleanroom practices, vacuum baking, material outgassing data bases, and material selection...."
Administrative Associate II (661909) - Current security clearance required,Ball Aerospace,"Broomfield, CO",,"Gather and interpret data; Prepare various schedules and perform data entry, etc. Our team of more than 3,000 engineers, scientists, technicians and support..."
Planner-Supply Chain Management (660236),Ball Aerospace,"Boulder, CO",,"Our team of more than 3,000 engineers, scientists, technicians and support staff drives all the achievements at Ball Aerospace...."
Engineer Associate - Systems Test (662266),Ball Aerospace,"Boulder, CO",,"Our team of more than 3,000 engineers, scientists, technicians and support staff drives all the achievements at Ball Aerospace...."
Engineer Associate-Space Systems (661828),Ball Aerospace,"Boulder, CO",,"Our team of more than 3,000 engineers, scientists, technicians and support staff drives all the achievements at Ball Aerospace...."
Associate Mission Systems Analyst (661328),Ball Aerospace,"Westminster, CO",,"Participate in test data collection and evaluation. Our team of more than 3,000 engineers, scientists, technicians and support staff drives all the achievements..."
"D10/13-Boulder, CO. Temporary Field Technician",National Ecological Observatory Network Inc,"Boulder, CO",,"Records data from sample collection; A 30+ year project dedicated to understanding how changes in climate, land use and invasive species impact ecology, the..."
Technical Intern-Quality Assurance (661402),Ball Aerospace,"Boulder, CO",,"Our team of more than 3,000 engineers, scientists, technicians and support staff drives all the achievements at Ball Aerospace...."
IT Infrastructure Administrator III,National Ecological Observatory Network Inc,"Boulder, CO",,"A 30+ year project dedicated to understanding how changes in climate, land use and invasive species impact ecology, the observatorys scientists and engineers..."
Engineer IV – DoD Initiatives,National Renewable Energy Laboratory,"Golden, CO",,Perform site assessments and data collection for the creation of electrical drawings and models. Implement and manage project control systems and metrics and...
Prospect Research and Data Analyst,Nurse Family Partnership,"Denver, CO 80203 (Capitol Hill area)",,"This position will ensure that frontline fundraisers on our regional, institutional, and individual giving teams have the data and information that they need to..."
Financial Analyst II-Government Compliance Accountant/Auditor (661744),Ball Aerospace,"Lafayette, CO",,"Develop incurred cost claim schedules, analyze data and clearly report findings in a timely manner. Our team of more than 3,000 engineers, scientists,..."
"Sr Staff Scientist, R&D",DigitalGlobe,"Westminster, CO",,Experience with 3D and elevation data. Please review the job details below....
"Project Manager, NEON Operations",Battelle,"Boulder, CO 80301",,Establishes strategies for using cost and schedule performance data analysis in making project decisions to ensure timely and cost-effective delivery of...
Subcontract Lead (661155),Ball Aerospace,"Boulder, CO",,"Our team of more than 3,000 engineers, scientists, technicians and support staff drives all the achievements at Ball Aerospace...."
Associate Range Engineer (662328),Ball Aerospace,"Westminster, CO",,"Our team of more than 3,000 engineers, scientists, technicians and support staff drives all the achievements at Ball Aerospace...."
Associate Industrial Engineer (661975),Ball Aerospace,"Westminster, CO",,"Identify and implement ways to automate data collection and analysis. Our team of more than 3,000 engineers, scientists, technicians and support staff drives..."
Associate Structural Engineer (661396),Ball Aerospace,"Westminster, CO",,"Our team of more than 3,000 engineers, scientists, technicians and support staff drives all the achievements at Ball Aerospace...."
Ground Systems Development Lead (662089),Ball Aerospace,"Boulder, CO",,"Recommend integrated ground system architecture solutions for satellite command and control, data transportation, and mission data processing...."
"D10/13-Boulder, CO. Lead Temporary Field Technician",National Ecological Observatory Network Inc,"Boulder, CO",,"Records data from sample collection; A 30+ year project dedicated to understanding how changes in climate, land use and invasive species impact ecology, the..."
Field Geologist,Terracon,"Longmont, CO",,"Interpret soil, bedrock and groundwater elevation and quality data. Performs site visits, field observations and field data collection or assignments...."
Malware Threat Research Analyst,Webroot,"Broomfield, CO",,You are an information security/malware professional looking to contribute to an innovative and collaborative environment. You have a passion for the thrill...
Sr. Metrology Technician,National Ecological Observatory Network Inc,"Boulder, CO",,"A 30+ year project dedicated to understanding how changes in climate, land use and invasive species impact ecology, the observatorys scientists and engineers..."
Prospect Research and Data Analyst,Nurse Family Partnership,"Denver, CO 80203 (Capitol Hill area)",,"This position will ensure that frontline fundraisers on our regional, institutional, and individual giving teams have the data and information that they need to..."
Associate Range Engineer (662328),Ball Aerospace,"Westminster, CO",,"Our team of more than 3,000 engineers, scientists, technicians and support staff drives all the achievements at Ball Aerospace...."
Associate Industrial Engineer (661975),Ball Aerospace,"Westminster, CO",,"Identify and implement ways to automate data collection and analysis. Our team of more than 3,000 engineers, scientists, technicians and support staff drives..."
Associate Structural Engineer (661396),Ball Aerospace,"Westminster, CO",,"Our team of more than 3,000 engineers, scientists, technicians and support staff drives all the achievements at Ball Aerospace...."
Global VP (Semiconductor Business),TransReach,"Golden, CO",,"Drives, and supports with data, internal decision making on long term growth investments including capital equipment and R&D programs...."
"Manager, Data Scientist",KPMG,"Denver, CO 80202 (Lodo area)",,"Retrieve, process and prepare a rich data variety of data sources such as social media, news, internal/external documents, emails, financial data, and..."
"D10/13-Boulder, CO. Lead Temporary Field Technician",National Ecological Observatory Network Inc,"Boulder, CO",,"Records data from sample collection; A 30+ year project dedicated to understanding how changes in climate, land use and invasive species impact ecology, the..."
Sr. Metrology Technician,National Ecological Observatory Network Inc,"Boulder, CO",,"A 30+ year project dedicated to understanding how changes in climate, land use and invasive species impact ecology, the observatorys scientists and engineers..."
Principal Engineer-Vibration (662322),Ball Aerospace,"Boulder, CO",,"Our team of more than 3,000 engineers, scientists, technicians and support staff drives all the achievements at Ball Aerospace...."
Principal Engineer - Radiation Effects (662257),Ball Aerospace,"Boulder, CO",,"Our team of more than 3,000 engineers, scientists, technicians and support staff drives all the achievements at Ball Aerospace...."
Principal Optical Engineer (662137),Ball Aerospace,"Boulder, CO",,"Our team of more than 3,000 engineers, scientists, technicians and support staff drives all the achievements at Ball Aerospace...."
