position,company,location,salary,summary
Senior Engineer-Attitude Determination and Control (659399) - Security clearance required,Ball Aerospace,"Broomfield, CO",,"Our team of more than 3,000 engineers, scientists, technicians and support staff drives all the achievements at Ball Aerospace...."
"IBM - 111573BR - Watson Health - Researcher - Truven - MA, MI, MD, CO",IBM,"Denver, CO 80237 (Southeastern Denver area)",,Other Data Science. 1-3 years previous work history analyzing medical claims and managed care encounter data....
Principal Mechanical Engineer (661399) - Current Security Clearance Required,Ball Aerospace,"Westminster, CO",,"Our team of more than 3,000 engineers, scientists, technicians and support staff drives all the achievements at Ball Aerospace...."
GIS Data Systems Analysts,xentity corporation,"Denver, CO",,"We are looking for GIS-specific data analysts, data wranglers, data scientists with excellent leadership, technical, and subject matter expertise qualities...."
Machine Learning Engineer,DISYS (Digital Intelligence SYStems Pvt. Ltd.),"Denver, CO",,"We are looking for Machine Learning Engineers who bring fresh ideas from different areas, including retrieval, computing, system design, networking and data..."
Lead Product Architect – Multi-function Electronics Warfare (EW) Systems - Advanced Systems Manager,Ball Aerospace,"Westminster, CO",,"Our team of more than 3,000 engineers, scientists, technicians and support staff drives all the achievements at Ball Aerospace...."
Regional Enterprise Benefits Executive - Denver,Lumity Inc,"Denver, CO","$90,000 - $110,000 a year","An amazing team of tech professionals, data scientists and benefits specialists with the drive to deliver a superior benefits experience to our clients needs..."
Data Scientist,demiSourced,"Denver, CO",,Provide practical and technical expertise in the design and execution of Data Science solutions. You will develop highly robust data Science solutions that...
Machine Learning Engineer,The Stratagem Group,"Aurora, CO",,Comfortable with statistics and data science concepts. Are you interested in supporting the ever-changing technology needs of the U.S....
Environmental Scientist II (Hydrogeologist),Gilbane,"Denver, CO",,"Evaluate data generated by field activities to provide detailed interpretations of subsurface lithology, groundwater flow conditions, vadose zone transport,..."
Senior Data Scientist,Ibotta,"Denver, CO 80202 (Lodo area)",,Ibotta is seeking a Senior Data Scientist who will help build out innovative new analytical capabilities. Mentor a growing team of junior team members who are...
Sr. Database Administrator,"Alteryx, Inc.","Broomfield, CO 80021",,"Alteryx Inc., headquartered in Irvine, CA, offers a quick-to-implement, end-to-end analytics platform that empowers business analysts and data scientists alike..."
"Software Engineer, Localization","Alteryx, Inc.","Broomfield, CO 80021",,"Alteryx Inc., headquartered in Irvine, CA, offers a quick-to-implement, end-to-end analytics platform that empowers business analysts and data scientists alike..."
Account Executive,Well Data Labs,"Denver, CO",,"About Well Data Labs. Well Data Labs was founded in June 2014 with a focus on solving the problems the Upstream Oil & Gas Industry has with managing, analyzing,..."
Solutions Consultant - Colorado,"Alteryx, Inc.","Broomfield, CO 80021",,"Alteryx Inc., headquartered in Irvine, CA, offers a quick-to-implement, end-to-end analytics platform that empowers business analysts and data scientists alike..."
Environmental Scientist,Navarro Inc.,"Westminster, CO",,"Is recruiting for an Environmental Scientist in Westminster, CO. Will provide technical support as required for review of FUSRAP documents, data, GIS..."
Air Quality Field Engineer or Scientist (Denver),Environmental Resources Management (ERM),"Denver, CO",,Is seeking a hands-on *Air Quality Field Engineer or Scientist*. Work with air quality engineers and field teams supporting clients to execute project scope and...
GIS Analyst,xentity corporation,"Denver, CO",,"We are looking for GIS-specific data analysts , data wranglers, data scientists with excellent leadership, technical, and subject matter expertise qualities...."
"Software Architect, Front-End","Alteryx, Inc.","Broomfield, CO 80021",,"Alteryx Inc., headquartered in Irvine, CA, offers a quick-to-implement, end-to-end analytics platform that empowers business analysts and data scientists alike..."
DevOps Engineer,"Alteryx, Inc.","Broomfield, CO 80021",,AYX) is a rapidly growing leader in self-service data analytics – breaking barriers and democratizing the process of empowering hundreds of employees within a...
Sr. Process Scientist,Germer International LLC,"Denver, CO","$90,000 - $140,000 a year",Data analysis and innovative problem-solving skills are considered essential. Opportunity to collaborate with highly skilled Scientists on the team....
"Sr. Software Engineer, Reporting","Alteryx, Inc.","Broomfield, CO 80021",,AYX) is a rapidly growing leader in self-service data analytics – breaking barriers and democratizing the process of empowering hundreds of employees within a...
"IT Administrator, Windows","Alteryx, Inc.","Broomfield, CO 80021",,"Alteryx Inc., headquartered in Irvine, CA, offers a quick-to-implement, end-to-end analytics platform that empowers business analysts and data scientists alike..."
Business Intelligence Solution Architect,xentity corporation,"Denver, CO",,----Perform data cleansing and data auditing as necessary to ensure data quality. Collaborate with business areas and data owners to successfully implement and...
Water Resources Engineer,"Kleinfelder, Inc.","Denver, CO 80202 (Lodo area)",,"Ability to collect, compile, and analyze large amounts of data; Prepping data for input into hydraulic and hydrologic modeling software using GIS and/or CAD..."
"Sr. Software Engineer, Alteryx Promote","Alteryx, Inc.","Broomfield, CO 80021",,AYX) is a rapidly growing leader in self-service data analytics – breaking barriers and democratizing the process of empowering hundreds of employees within a...
Sr. Human Resources Business Partner,"Alteryx, Inc.","Broomfield, CO 80021",,"Alteryx Inc., headquartered in Irvine, CA, offers a quick-to-implement, end-to-end analytics platform that empowers business analysts and data scientists alike..."
"Technical Project Manager, IT","Alteryx, Inc.","Broomfield, CO 80021",,"Alteryx Inc., headquartered in Irvine, CA, offers a quick-to-implement, end-to-end analytics platform that empowers business analysts and data scientists alike..."
Government Enterprise Architect,xentity corporation,"Denver, CO","$95,000 - $127,000 a year","Validate data models (logical and physical) for adherence to data management standards. Maintain a data dictionary containing information about data, including..."
"Director, UX","Alteryx, Inc.","Broomfield, CO 80021",,"Alteryx Inc., headquartered in Irvine, CA, offers a quick-to-implement, end-to-end analytics platform that empowers business analysts and data scientists alike..."
Sr. Food Scientist,LScience Inc,"Broomfield, CO",,Strategic and tactical decision-making ability using sound scientific principles and data analytics. This scientist role will be responsible for developing new...
"Director, UX","Alteryx, Inc.","Broomfield, CO 80021",,"Alteryx Inc., headquartered in Irvine, CA, offers a quick-to-implement, end-to-end analytics platform that empowers business analysts and data scientists alike..."
Sr. Food Scientist,LScience Inc,"Broomfield, CO",,Strategic and tactical decision-making ability using sound scientific principles and data analytics. This scientist role will be responsible for developing new...
Sr. Food Scientist- Product Innovation,Apex Life Sciences,"Broomfield, CO",,Strategic and tactical decision-making ability using sound scientific principles and data analytics. This scientist role will be responsible for developing new...
Geospatial Architect,xentity corporation,"Golden, CO",,"Experience in Geospatial data lifecycle including program planning, various data acquisition techniques including remote sensing, surveying, and partnering,..."
Government Services Solution Architect,xentity corporation,"Golden, CO",,"We are a fast-growing data consulting and support services firm. Up to date on new architecture patterns (ROA, Semantic, Big Data), software frameworks, new..."
Marketing Director,"Flagship Biosciences, Inc.","Westminster, CO",,"Collaborate with scientists, technicians, designers, external influencers, and industry experts to produce relevant content...."
"Product Manager, Beta Programs","Alteryx, Inc.","Broomfield, CO 80021",,"Alteryx Inc., headquartered in Irvine, CA, offers a quick-to-implement, end-to-end analytics platform that empowers business analysts and data scientists alike..."
"Product Manager, Competitive Intelligence","Alteryx, Inc.","Broomfield, CO 80021",,"Alteryx Inc., headquartered in Irvine, CA, offers a quick-to-implement, end-to-end analytics platform that empowers business analysts and data scientists alike..."
